Date,Ticker,Company_Name,Title,Cleaned_Content,Density_Ticker,Density_Company,Sentiment,Url,PublishedAt,Source
2024-12-31,DGX,Quest Diagnostics,JPMorgan Chase & Co. Decreases Stock Position in Quest Diagnostics Incorporated (NYSE:DGX),jpmorgan chase amp co lowered position quest diagnostics incorporated nyse dgx free report third quarter holdingschannel com reports institutional investor owne chars,0.0,0.06896551724137931,0.2,https://www.etfdailynews.com/2024/12/31/jpmorgan-chase-co-decreases-stock-position-in-quest-diagnostics-incorporated-nysedgx/,2024-12-31T08:51:13Z,ETF Daily News
2024-12-31,RL,Ralph Lauren Corporation,Ralph Lauren (NYSE:RL) Upgraded by Argus to Buy Rating,ralph lauren nyse rl get free report upgraded research analysts argus hold rating buy rating research note issued investors tuesday marketbeat reports b chars,0.0,0.05405405405405406,0.4,https://www.etfdailynews.com/2024/12/31/ralph-lauren-nyserl-upgraded-by-argus-to-buy-rating/,2024-12-31T12:46:43Z,ETF Daily News
2024-12-31,RJF,Raymond James Financial,Raymond James (RJF) to Issue Quarterly Dividend of $0.50 on January 16th,raymond james nyse rjf get free report declared quarterly dividend tuesday december rd rtt news reports investors record thursday january nd given dividend per chars,0.0,0.05714285714285714,0.4,https://www.etfdailynews.com/2024/12/31/raymond-james-rjf-to-issue-quarterly-dividend-of-0-50-on-january-16th/,2024-12-31T12:06:55Z,ETF Daily News
2024-12-31,RTX,RTX Corporation,"Wizz Air Tackles Engine Issues With New Pratt & Whitney Deal, Sets Stage For Recovery",wizz air holdings plc otc wzzzy entered new agreement pratt amp whitney rtx corporation nyse rtx unit address ongoing engine issues pw g jm geared turbofan engines th chars,0.03225806451612903,0.06451612903225806,0.13636363636363635,https://biztoc.com/x/6b1177c05f6cdcbe,2024-12-31T18:02:01Z,Biztoc.com
2024-12-31,RSG,Republic Services,"Republic Services, Inc. (NYSE:RSG) Announces Quarterly Dividend of $0.58",republic services inc nyse rsg get free report declared quarterly dividend wednesday october rd zacks dividends reports shareholders record thursday january nd given chars,0.0,0.03125,0.4,https://www.etfdailynews.com/2024/12/31/republic-services-inc-nysersg-announces-quarterly-dividend-of-0-58/,2024-12-31T12:27:12Z,ETF Daily News
2024-12-31,ROST,Ross Stores,Ross Stores (NASDAQ:ROST) Shares Pass Above 200-Day Moving Average – Time to Sell?,shares ross stores inc nasdaq rost get free report passed day moving average trading monday stock day moving average traded high chars,0.0,0.02631578947368421,0.065,https://www.etfdailynews.com/2024/12/31/ross-stores-nasdaqrost-shares-pass-above-200-day-moving-average-time-to-sell/,2024-12-31T08:46:25Z,ETF Daily News
2024-12-31,SPG,Simon Property Group,Simon Property Group (NYSE:SPG) Share Price Crosses Above 200 Day Moving Average – Here’s What Happened,simon property group inc nyse spg get free report crossed day moving average trading monday stock day moving average traded high chars,0.0,0.05405405405405406,0.065,https://www.etfdailynews.com/2024/12/31/simon-property-group-nysespg-share-price-crosses-above-200-day-moving-average-heres-what-happened/,2024-12-31T09:06:59Z,ETF Daily News
2024-12-31,SW,Smurfit WestRock,JPMorgan Chase & Co. Buys New Stake in Smurfit Westrock Ltd (NYSE:SW),jpmorgan chase amp co purchased new position shares smurfit westrock ltd nyse sw free report third quarter according company recent f filing secur chars,0.0,0.05405405405405406,0.1340909090909091,https://www.etfdailynews.com/2024/12/31/jpmorgan-chase-co-buys-new-stake-in-smurfit-westrock-ltd-nysesw/,2024-12-31T08:55:01Z,ETF Daily News
2024-12-31,LUV,Southwest Airlines,Southwest Airlines (NYSE:LUV) Given New $40.00 Price Target at Raymond James,southwest airlines nyse luv free report price objective boosted raymond james research note published monday benzinga reports currently outp chars,0.0,0.06060606060606061,0.13333333333333333,https://www.etfdailynews.com/2024/12/31/southwest-airlines-nyseluv-given-new-40-00-price-target-at-raymond-james/,2024-12-31T07:18:53Z,ETF Daily News
2024-12-31,STT,State Street Corporation,State Street Co. (STT) To Go Ex-Dividend on January 2nd,state street co nyse stt get free report declared quarterly dividend thursday december th rtt news reports shareholders record thursday january nd given dividend chars,0.0,0.058823529411764705,0.4,https://www.etfdailynews.com/2024/12/31/state-street-co-stt-to-go-ex-dividend-on-january-2nd/,2024-12-31T12:27:29Z,ETF Daily News
2024-12-31,STE,Steris,STERIS plc (NYSE:STE) Shares Sold by JPMorgan Chase & Co.,jpmorgan chase amp co cut stake shares steris plc nyse ste free report third quarter according company recent filing securities amp chars,0.0,0.02631578947368421,0.13333333333333333,https://www.etfdailynews.com/2024/12/31/steris-plc-nyseste-shares-sold-by-jpmorgan-chase-co/,2024-12-31T08:51:07Z,ETF Daily News
2024-12-31,SYY,Sysco,Sysco (NYSE:SYY) Shares Cross Above 200 Day Moving Average – Here’s What Happened,shares sysco co nyse syy get free report crossed two hundred day moving average trading monday stock two hundred day moving average traded hig chars,0.0,0.02564102564102564,0.03333333333333333,https://www.etfdailynews.com/2024/12/31/sysco-nysesyy-shares-cross-above-200-day-moving-average-heres-what-happened/,2024-12-31T08:40:51Z,ETF Daily News
2024-12-31,TRGP,Targa Resources,Targa Resources (NYSE:TRGP) Stock Passes Above Two Hundred Day Moving Average – Here’s What Happened,shares targa resources corp nyse trgp get free report crossed day moving average trading monday stock day moving average traded high chars,0.0,0.05405405405405406,0.065,https://www.etfdailynews.com/2024/12/31/targa-resources-nysetrgp-stock-passes-above-two-hundred-day-moving-average-heres-what-happened/,2024-12-31T08:46:23Z,ETF Daily News
2024-12-31,TEL,TE Connectivity,JPMorgan Chase & Co. Has $203.42 Million Stock Position in TE Connectivity Ltd. (NYSE:TEL),jpmorgan chase amp co lessened holdings te connectivity ltd nyse tel free report third quarter holdingschannel reports firm owned shares elec chars,0.0,0.06060606060606061,0.06666666666666667,https://www.etfdailynews.com/2024/12/31/jpmorgan-chase-co-has-203-42-million-stock-position-in-te-connectivity-ltd-nysetel/,2024-12-31T08:58:46Z,ETF Daily News
2024-12-31,TSLA,"Tesla, Inc.",Tesla Stock Surge Runs Up Against a Potential Annual Sales Drop,bloomberg exuberance tesla inc tsla benefiting donald trumps return white house wall street isnt sure carmaker avoid first annual sales decline chars,0.0,0.027777777777777776,0.25,https://finance.yahoo.com/news/tesla-stock-surge-runs-against-125059167.html,2024-12-31T12:50:59Z,Yahoo Entertainment
2024-12-31,TSCO,Tractor Supply,Barclays Lowers Tractor Supply (NASDAQ:TSCO) Price Target to $52.00,tractor supply nasdaq tsco free report target price reduced barclays report published monday benzinga reports barclays currently equal weight rat chars,0.0,0.06060606060606061,0.2,https://www.etfdailynews.com/2024/12/31/barclays-lowers-tractor-supply-nasdaqtsco-price-target-to-52-00/,2024-12-31T07:30:59Z,ETF Daily News
2024-12-31,TT,Trane Technologies,Trane Technologies plc (NYSE:TT) Receives $409.93 Consensus Target Price from Analysts,shares trane technologies plc nyse tt get free report earned average rating hold fifteen brokerages presently covering firm marketbeat com reports one equi chars,0.0,0.06060606060606061,0.012499999999999997,https://www.etfdailynews.com/2024/12/31/trane-technologies-plc-nysett-receives-409-93-consensus-target-price-from-analysts/,2024-12-31T07:26:55Z,ETF Daily News
2024-12-31,TRMB,Trimble Inc.,Trimble Inc. (NASDAQ:TRMB) Short Interest Update,trimble inc nasdaq trmb get free report saw large increase short interest month december december th short interest totalling shares increase chars,0.0,0.05555555555555555,0.15357142857142858,https://www.etfdailynews.com/2024/12/31/trimble-inc-nasdaqtrmb-short-interest-update/,2024-12-31T09:06:56Z,ETF Daily News
2024-12-31,TYL,Tyler Technologies,"JPMorgan Chase & Co. Grows Stock Position in Tyler Technologies, Inc. (NYSE:TYL)",jpmorgan chase amp co increased position shares tyler technologies inc nyse tyl free report rd quarter holdings channel reports firm owned shares chars,0.0,0.029411764705882353,0.1,https://www.etfdailynews.com/2024/12/31/jpmorgan-chase-co-grows-stock-position-in-tyler-technologies-inc-nysetyl/,2024-12-31T08:46:25Z,ETF Daily News
2024-12-31,USB,U.S. Bancorp,U.S. Bancorp Target of Unusually Large Options Trading (NYSE:USB),u bancorp nyse usb get free report recipient unusually large options trading monday investors acquired call options stock increase compared chars,0.0,0.05555555555555555,0.30714285714285716,https://www.etfdailynews.com/2024/12/31/u-s-bancorp-target-of-unusually-large-options-trading-nyseusb/,2024-12-31T08:12:45Z,ETF Daily News
2024-12-31,UBER,Uber,Good news! Popular Nvidia hardware gets free upgrade that boosts its performance by up to 70% - but it's not for gamers,ul li jetson nano nvidia uber popular dev kit li li nvidia cut price half bid attract developers platform li li also released firmware unl chars,0.029411764705882353,0.029411764705882353,0.21666666666666667,https://www.techradar.com/pro/good-news-popular-nvidia-hardware-gets-free-upgrade-that-boosts-its-performance-by-up-to-70-percent-but-its-not-for-gamers,2024-12-31T10:03:00Z,TechRadar
2024-12-31,UBER,Uber,Best Stock to Buy Right Now: Uber vs. Lyft,uber nyse uber lyft nasdaq lyft synonymous ride hailing services uber market leader u many countries lyft underdog operates chars,0.05555555555555555,0.05555555555555555,0.5,https://biztoc.com/x/1a977649740b66fd,2024-12-31T01:42:12Z,Biztoc.com
2024-12-31,UBER,Uber,Why did Assam CM ordered immediate action over a cab driver and passenger dispute,yesterday night booked uber premier guwahati asked driver turn ac refused saying booked ac ride requested turn due dust aller chars,0.022727272727272728,0.022727272727272728,-0.125,https://timesofindia.indiatimes.com/etimes/trending/why-did-assam-cm-ordered-immediate-action-over-a-cab-driver-and-passenger-dispute/articleshow/116834978.cms,2024-12-31T14:11:16Z,The Times of India
2024-12-31,UNP,Union Pacific Corporation,Union Pacific Corporation (UNP): Are Hedge Funds Bullish On This Logistics Stock Right Now?,recently compiled list best logistics stocks invest right article going take look union pacific corporation nyse unp stands chars,0.0,0.07894736842105263,0.42857142857142855,https://finance.yahoo.com/news/union-pacific-corporation-unp-hedge-071633140.html,2024-12-31T07:16:33Z,Yahoo Entertainment
2024-12-31,UAL,United Airlines Holdings,Raymond James Forecasts Strong Price Appreciation for United Airlines (NASDAQ:UAL) Stock,united airlines nasdaq ual free report target price upped raymond james research note issued investors monday morning benzinga reports raymond james chars,0.0,0.058823529411764705,0.4,https://www.etfdailynews.com/2024/12/31/raymond-james-forecasts-strong-price-appreciation-for-united-airlines-nasdaqual-stock/,2024-12-31T07:30:57Z,ETF Daily News
2024-12-31,V,Visa Inc.,"VISA ALERT: Bragar Eagel & Squire, P.C. Announces that a Class Action Lawsuit Has Been Filed Against Visa Inc. and Encourages Investors to Contact the Firm",new york dec globe newswire bragar eagel amp squire p c nationally recognized stockholder rights law firm announces class action lawsuit filed visa inc chars,0.0,0.029411764705882353,0.012121212121212116,https://www.globenewswire.com/news-release/2024/12/31/3002960/0/en/VISA-ALERT-Bragar-Eagel-Squire-P-C-Announces-that-a-Class-Action-Lawsuit-Has-Been-Filed-Against-Visa-Inc-and-Encourages-Investors-to-Contact-the-Firm.html,2024-12-31T04:30:00Z,GlobeNewswire
2024-12-31,V,Visa Inc.,"DEADLINE ALERT: Faruqi & Faruqi, LLP Encourages Investors of Visa to Contact Us to Have Their Losses Evaluated Today",faruqi amp faruqi llp securities litigation partner james josh wilson encourages investors suffered losses exceeding visa contact directly discuss options chars,0.0,0.03225806451612903,0.1,https://www.globenewswire.com/news-release/2024/12/31/3003114/683/en/DEADLINE-ALERT-Faruqi-Faruqi-LLP-Encourages-Investors-of-Visa-to-Contact-Us-to-Have-Their-Losses-Evaluated-Today.html,2024-12-31T13:01:00Z,GlobeNewswire
2024-12-31,VST,Vistra Corp.,Vistra Announces Appointment of Rob Walters to Board of Directors,vistra corp nyse vst recently expanded board directors appointing rob walters independent director effective december decision bring walters onto board chars,0.0,0.058823529411764705,0.19999999999999998,https://www.etfdailynews.com/2024/12/31/vistra-announces-appointment-of-rob-walters-to-board-of-directors/,2024-12-31T09:08:56Z,ETF Daily News
2024-12-31,WAB,Wabtec,Wabtec acquires Bloom Engineering for $69M cash in ‘immediately accretive’ deal,wabtec wab announced acquired bloom engineering acquisition strengthe chars,0.0,0.07142857142857142,0.0,https://finance.yahoo.com/news/wabtec-acquires-bloom-engineering-69m-121044336.html,2024-12-31T12:10:44Z,Yahoo Entertainment
2024-12-31,WMT,Walmart,These Are The 5 Best Dow Jones Stocks Of 2024,nvidia nvda walmart wmt amazon com amzn count among five best dow jones stocks goldman sachs gs american express axp also make cut xnow playingstocks end strong chars,0.0,0.02857142857142857,0.4777777777777778,https://www.investors.com/news/best-dow-jones-stocks-2024-nvidia-walmart-amazon-goldman-sachs-american-express/,2024-12-31T21:21:21Z,Investor's Business Daily
2024-12-31,WMT,Walmart,Is Walmart open on New Year’s Eve and New Year's Day 2025?,consumers appear increasingly warmed walmart especially retail giant cut prices items august effort attract cash strapped shoppers chars,0.0,0.027777777777777776,0.0,https://biztoc.com/x/f6abd5f649367222,2024-12-31T12:41:12Z,Biztoc.com
2024-12-31,WBD,Warner Bros. Discovery,Warner Bros Discovery Stock Could Outperform Next Month,article warner bros discovery inc nasdaq wbd stock last seen higher trade looking close month quarter solid gain year date basis wbd un chars,0.02702702702702703,0.02702702702702703,0.08333333333333333,https://biztoc.com/x/73cafc08dd989941,2024-12-31T18:02:03Z,Biztoc.com
2024-12-31,WBD,Warner Bros. Discovery,"ROSEN, LEADING INVESTOR COUNSEL, Encourages Warner Bros. Discovery, Inc. Investors to Secure Counsel Before Important Deadline in Securities Class Action - WBD",new york new york newsfile corp december rosen law firm global investor rights law firm reminds purchasers securities warner bros discovery inc nasdaq nasdaq wbd chars,0.0,0.06060606060606061,-0.025454545454545462,https://www.investing.com/news/press-releases/rosen-leading-investor-counsel-encourages-warner-bros-discovery-inc-investors-to-secure-counsel-before-important-deadline-in-securities-class-action--wbd-93CH-3792232,2024-12-31T05:12:03Z,Investing.com
2024-12-31,WYNN,Wynn Resorts,Saudi Arabia’s Push for Affordable Tourism Projects,big changes travel industry middle east sphere entertainment announced location abu dhabi mgm resorts announced sphere dubai wynn resorts got chars,0.02702702702702703,0.08108108108108109,0.0,http://skift.com/2024/12/31/saudi-arabias-push-for-affordable-tourism-projects/,2024-12-31T11:00:00Z,Skift
2024-12-31,WYNN,Wynn Resorts,"Principal Financial Group Inc. Acquires 2,001 Shares of Wynn Resorts, Limited (NASDAQ:WYNN)",principal financial group inc boosted holdings wynn resorts limited nasdaq wynn free report rd quarter holdings channel com reports fund owned shares chars,0.03125,0.03125,0.10952380952380954,https://www.etfdailynews.com/2024/12/31/principal-financial-group-inc-acquires-2001-shares-of-wynn-resorts-limited-nasdaqwynn/,2024-12-31T08:46:54Z,ETF Daily News
2024-12-31,YUM,Yum! Brands,Yum! Brands (NYSE:YUM) Upgraded by Argus to Buy Rating,yum brands nyse yum get free report upgraded analysts argus hold rating buy rating report issued tuesday marketbeat reports firm presently p chars,0.0,0.05263157894736842,0.06666666666666667,https://www.etfdailynews.com/2024/12/31/yum-brands-nyseyum-upgraded-by-argus-to-buy-rating/,2024-12-31T12:46:43Z,ETF Daily News
2024-12-31,ZBRA,Zebra Technologies,Zebra to acquire 3D machine firm Photoneo with ‘cash on hand’ in accretive deal,zebra technologies zbra announced intends acquire photoneo developer chars,0.0,0.13333333333333333,0.0,https://finance.yahoo.com/news/zebra-acquire-3d-machine-firm-131014028.html,2024-12-31T13:10:14Z,Yahoo Entertainment
