Date,Ticker,Company_Name,Title,Cleaned_Content,Density_Ticker,Density_Company,Sentiment,Url,PublishedAt,Source
2025-01-15,HAL,Halliburton,Moody National Bank Trust Division Sells 385 Shares of Halliburton (NYSE:HAL),moody national bank trust division reduced stake shares halliburton nyse hal free report th quarter according recent disclosure securities chars,0.0,0.02857142857142857,0.2,https://www.etfdailynews.com/2025/01/15/moody-national-bank-trust-division-sells-385-shares-of-halliburton-nysehal/,2025-01-15T09:43:09Z,ETF Daily News
2025-01-15,HAS,Hasbro,Hasbro Unveils New The Transformers: The Movie Studio Series Jazz,posted collectibles hasbro tagged hasbro transformers war autobots deceptions rages new transformers figures revealed hasbro article summary u chars,0.0,0.0625,0.13636363636363635,https://bleedingcool.com/collectibles/hasbro-unveils-new-the-transformers-the-movie-studio-series-jazz/,2025-01-15T15:52:07Z,Bleeding Cool News
2025-01-15,HAS,Hasbro,Top 7 Alternatives to Dungeons & Dragons,dungeons dragons huge resurgence recent years wizards coast hasbro intent capitalizing pushing films games even reworking dungeons amp dragon chars,0.02857142857142857,0.02857142857142857,0.20000000000000004,http://comicbook.com/gaming/news/dungeons-and-dragons-alternatives-ttrpgs/,2025-01-15T02:00:00Z,ComicBook.com
2025-01-15,HAS,Hasbro,Notice to Hasbro Inc. (HAS) Shareholders: Grabar Law Office Is Investigating Claims on Your Behalf,philadelphia pennsylvania newsfile corp january grabar law office investigating whether certain officers directors hasbro inc nasdaq nasdaq breached fi chars,0.0,0.03333333333333333,0.21428571428571427,https://www.investing.com/news/press-releases/notice-to-hasbro-inc-has-shareholders-grabar-law-office-is-investigating-claims-on-your-behalf-93CH-3813992,2025-01-15T12:40:04Z,Investing.com
2025-01-15,HAS,Hasbro,Transformers One: New Adventures Photos Unveil First Look at Hasbro Stop-Motion Show,hasbro shared official first look photos upcoming stop motion animated series titled transformers one new adventures inspired paramount pictures acclaimed transformers one movi chars,0.03571428571428571,0.03571428571428571,0.19318181818181818,https://www.comingsoon.net/tv/news/1905729-transformers-one-new-adventures-photo-unveil-first-look-hasbro-stop-motion-show,2025-01-15T18:12:58Z,ComingSoon.net
2025-01-15,HES,Hess Corporation,"Wedmont Private Capital Has $556,000 Position in Hess Co. (NYSE:HES)",wedmont private capital boosted stake hess co nyse hes free report fourth quarter holdingschannel reports firm owned shares oil gas producer stock chars,0.0,0.027777777777777776,0.05,https://www.etfdailynews.com/2025/01/15/wedmont-private-capital-has-556000-position-in-hess-co-nysehes/,2025-01-15T09:43:02Z,ETF Daily News
2025-01-15,HPE,Hewlett Packard Enterprise,Hewlett Packard Enterprise (NYSE:HPE) Shares Bought by Czech National Bank,czech national bank lifted holdings shares hewlett packard enterprise nyse hpe free report th quarter according recent disclosure securities chars,0.0,0.08823529411764706,0.2,https://www.etfdailynews.com/2025/01/15/hewlett-packard-enterprise-nysehpe-shares-bought-by-czech-national-bank/,2025-01-15T08:30:53Z,ETF Daily News
2025-01-15,HLT,Hilton Worldwide,"Wedmont Private Capital Has $828,000 Position in Hilton Worldwide Holdings Inc. (NYSE:HLT)",wedmont private capital lifted holdings shares hilton worldwide holdings inc nyse hlt free report fourth quarter according company recent filing chars,0.0,0.05714285714285714,0.1,https://www.etfdailynews.com/2025/01/15/wedmont-private-capital-has-828000-position-in-hilton-worldwide-holdings-inc-nysehlt/,2025-01-15T09:11:01Z,ETF Daily News
2025-01-15,HWM,Howmet Aerospace,Wealth Enhancement Advisory Services LLC Grows Stake in Howmet Aerospace Inc. (NYSE:HWM),wealth enhancement advisory services llc grew stake shares howmet aerospace inc nyse hwm free report fourth quarter holdings channel reports fund owned shar chars,0.0,0.058823529411764705,0.2,https://www.etfdailynews.com/2025/01/15/wealth-enhancement-advisory-services-llc-grows-stake-in-howmet-aerospace-inc-nysehwm/,2025-01-15T08:42:55Z,ETF Daily News
2025-01-15,HWM,Howmet Aerospace,Claro Advisors LLC Cuts Stake in Howmet Aerospace Inc. (NYSE:HWM),claro advisors llc lessened stake shares howmet aerospace inc nyse hwm free report fourth quarter according recent form f filing sec fund chars,0.0,0.05263157894736842,0.07500000000000001,https://www.etfdailynews.com/2025/01/15/claro-advisors-llc-cuts-stake-in-howmet-aerospace-inc-nysehwm/,2025-01-15T09:24:54Z,ETF Daily News
2025-01-15,HUBB,Hubbell Incorporated,"Hubbell to Announce Fourth Quarter 2024 Results on February 4, 2025",shelton ct jan globe newswire hubbell incorporated nyse hubb today announced release fourth quarter financial results prior opening market februa chars,0.0,0.058823529411764705,0.0,https://www.globenewswire.com/news-release/2025/01/15/3010119/0/en/Hubbell-to-Announce-Fourth-Quarter-2024-Results-on-February-4-2025.html,2025-01-15T14:05:00Z,GlobeNewswire
2025-01-15,HUBB,Hubbell Incorporated,Hubbell Incorporated (NYSE:HUBB) Position Boosted by Wealth Enhancement Advisory Services LLC,wealth enhancement advisory services llc increased holdings hubbell incorporated nyse hubb free report fourth quarter holdings channel reports firm owned sha chars,0.0,0.06451612903225806,0.06666666666666667,https://www.etfdailynews.com/2025/01/15/hubbell-incorporated-nysehubb-position-boosted-by-wealth-enhancement-advisory-services-llc/,2025-01-15T08:26:59Z,ETF Daily News
2025-01-15,HUM,Humana,Humana Inc. (NYSE:HUM) Stock Holdings Lifted by Wealth Enhancement Advisory Services LLC,wealth enhancement advisory services llc lifted holdings shares humana inc nyse hum free report fourth quarter according company recent filing chars,0.0,0.027777777777777776,0.13333333333333333,https://www.etfdailynews.com/2025/01/15/humana-inc-nysehum-stock-holdings-lifted-by-wealth-enhancement-advisory-services-llc/,2025-01-15T08:26:53Z,ETF Daily News
2025-01-15,HUM,Humana,Humana Inc. (NYSE:HUM) Shares Acquired by Czech National Bank,czech national bank increased position humana inc nyse hum free report fourth quarter according recent disclosure sec institutional investor owne chars,0.0,0.029411764705882353,0.07500000000000001,https://www.etfdailynews.com/2025/01/15/humana-inc-nysehum-shares-acquired-by-czech-national-bank/,2025-01-15T09:04:55Z,ETF Daily News
2025-01-15,HII,Huntington Ingalls Industries,"Capital Investment Advisors LLC Grows Stock Position in Huntington Ingalls Industries, Inc. (NYSE:HII)",capital investment advisors llc increased holdings huntington ingalls industries inc nyse hii free report th quarter according recent disclosure se chars,0.0,0.06060606060606061,0.2,https://www.etfdailynews.com/2025/01/15/capital-investment-advisors-llc-grows-stock-position-in-huntington-ingalls-industries-inc-nysehii/,2025-01-15T09:04:59Z,ETF Daily News
2025-01-15,IBM,IBM,Samsung Selected To Provide Mission-Critical Solutions for Emergency Services Network,samsung electronics today announced company teaming ibm mission critical mcx solution provider uks home office user services deployment part emerg chars,0.02857142857142857,0.02857142857142857,0.0,https://news.samsung.com/global/samsung-selected-to-provide-mission-critical-solutions-for-emergency-services-network,2025-01-15T13:24:03Z,Samsung.com
2025-01-15,IBM,IBM,Red Hat releases OpenShift for virtualization and tools for multicloud traffic management,ibm corp subsidiary red hat today announced general availability red hat openshift virtualization engine version openshift orchestration platform thats geared exclusively toward chars,0.03333333333333333,0.03333333333333333,0.016666666666666673,https://siliconangle.com/2025/01/15/red-hat-releases-openshift-virtualization-tools-multicloud-traffic-management/,2025-01-15T14:00:32Z,SiliconANGLE News
2025-01-15,IBM,IBM,Walmart and IBM Team to Bolster Last-Mile Delivery,walmart formed partnership ibm aimed improving last mile delivery retailers collaboration integrate walmarts golocal delivery service ibms sterling order management chars,0.03333333333333333,0.03333333333333333,0.0,https://www.pymnts.com/news/delivery/2025/walmart-and-ibm-team-to-bolster-last-mile-delivery/,2025-01-15T15:44:07Z,pymnts.com
2025-01-15,IBM,IBM,Walmart and IBM Team to Bolster Last-Mile Delivery,walmart formed partnership ibm aimed improving last mile delivery retailers collaboration integrate walmarts golocal delivery service ibms sterling order management pl chars,0.034482758620689655,0.034482758620689655,0.0,https://biztoc.com/x/cff6b3a3fab43d94,2025-01-15T16:12:51Z,Biztoc.com
2025-01-15,IBM,IBM,Palo Alto Networks secures UK emergency network,london santa clara calif palo alto networks nasdaq nasdaq panw leader global cybersecurity market capitalization billion partnered ibm nyse ibm chars,0.030303030303030304,0.030303030303030304,0.0,https://www.investing.com/news/company-news/palo-alto-networks-secures-uk-emergency-network-93CH-3814117,2025-01-15T13:13:10Z,Investing.com
2025-01-15,IBM,IBM,Problem with ibm-iaccess dependencies Ubuntu 24.04,installed new system ubuntu need install ibm database connector specifically ibm iaccess deb file installation package chars,0.030303030303030304,0.030303030303030304,0.13636363636363635,https://askubuntu.com/questions/1538199/problem-with-ibm-iaccess-dependencies-ubuntu-24-04,2025-01-15T10:17:44Z,Askubuntu.com
2025-01-15,IBM,IBM,News story: Home Office and IBM to partner on Emergency Services Network,frontline emergency services benefit new communications network modernise work together government announces new partnership ibm following series de chars,0.030303030303030304,0.030303030303030304,0.0909090909090909,https://www.gov.uk/government/news/home-office-and-ibm-to-partner-on-emergency-services-network,2025-01-15T12:54:09Z,Www.gov.uk
2025-01-15,IBM,IBM,Home Affairs lays groundwork for IBM mainframe shift,department home affairs laying foundations expiry long standing mainframe agreement ibm new future compute strategy department signed fresh chars,0.029411764705882353,0.029411764705882353,0.09659090909090909,https://www.itnews.com.au/news/home-affairs-lays-groundwork-for-ibm-mainframe-shift-614364,2025-01-15T20:30:00Z,iTnews
2025-01-15,IBM,IBM,"Traders mark time ahead of US CPI, bank earnings - Reuters",ibm purchase rolm gives new meaning term twisted pair howard anderson yankee group,0.05555555555555555,0.05555555555555555,-0.18181818181818182,https://slashdot.org/firehose.pl?op=view&amp;id=175913545,2025-01-15T05:52:27Z,Slashdot.org
2025-01-15,IBM,IBM,"Today's NYT Mini Crossword Answers for Wednesday, Jan. 15",ibm purchase rolm gives new meaning term twisted pair howard anderson yankee group,0.05555555555555555,0.05555555555555555,-0.18181818181818182,https://slashdot.org/firehose.pl?op=view&amp;id=175913381,2025-01-15T05:32:05Z,Slashdot.org
2025-01-15,IBM,IBM,There was a straight shot from Earth to the Moon and Mars last night - Ars Technica,ibm purchase rolm gives new meaning term twisted pair howard anderson yankee group,0.05555555555555555,0.05555555555555555,-0.18181818181818182,https://slashdot.org/firehose.pl?op=view&amp;id=175913541,2025-01-15T05:52:06Z,Slashdot.org
2025-01-15,IBM,IBM,Inside the dramatic air attack that saved Brentwood and Encino from the surging Palisades fire - Los Angeles Times,ibm purchase rolm gives new meaning term twisted pair howard anderson yankee group,0.05555555555555555,0.05555555555555555,-0.18181818181818182,https://slashdot.org/firehose.pl?op=view&amp;id=175913411,2025-01-15T05:33:25Z,Slashdot.org
2025-01-15,IBM,IBM,"Tim Kaine grills Pete Hegseth over 'cheating' on wife, social media users ask what about Doug Emhoff - The Times of India",ibm purchase rolm gives new meaning term twisted pair howard anderson yankee group,0.05555555555555555,0.05555555555555555,-0.18181818181818182,https://slashdot.org/firehose.pl?op=view&amp;id=175913273,2025-01-15T05:12:39Z,Slashdot.org
2025-01-15,IBM,IBM,"Author Neil Gaiman denies sexual assault allegations made by 8 women, admits he's ‘far from a perfect person’ - Hindustan Times",ibm purchase rolm gives new meaning term twisted pair howard anderson yankee group,0.05555555555555555,0.05555555555555555,-0.18181818181818182,https://slashdot.org/firehose.pl?op=view&amp;id=175913267,2025-01-15T05:12:08Z,Slashdot.org
2025-01-15,IBM,IBM,Latest Nintendo Switch 2 leaks detail GPU power and a new button - Tom's Guide,ibm purchase rolm gives new meaning term twisted pair howard anderson yankee group,0.05555555555555555,0.05555555555555555,-0.18181818181818182,https://slashdot.org/firehose.pl?op=view&amp;id=175913271,2025-01-15T05:12:29Z,Slashdot.org
2025-01-15,IBM,IBM,Michelle Obama won't attend Trump's second inauguration - Axios,ibm purchase rolm gives new meaning term twisted pair howard anderson yankee group,0.05555555555555555,0.05555555555555555,-0.18181818181818182,https://slashdot.org/firehose.pl?op=view&amp;id=175913407,2025-01-15T05:33:14Z,Slashdot.org
2025-01-15,IBM,IBM,January Windows updates may fail if Citrix SRA is installed - BleepingComputer,ibm purchase rolm gives new meaning term twisted pair howard anderson yankee group,0.05555555555555555,0.05555555555555555,-0.18181818181818182,https://slashdot.org/firehose.pl?op=view&amp;id=175913397,2025-01-15T05:32:53Z,Slashdot.org
2025-01-15,IBM,IBM,Zheng Qinwen out of Australian Open after defeat to Laura Siegemund - The Athletic - The Athletic,ibm purchase rolm gives new meaning term twisted pair howard anderson yankee group,0.05555555555555555,0.05555555555555555,-0.18181818181818182,https://slashdot.org/firehose.pl?op=view&amp;id=175913387,2025-01-15T05:32:33Z,Slashdot.org
2025-01-15,IBM,IBM,Live coverage: SpaceX to launch Firefly Aerospace and ispace Moon landers on Falcon 9 rocket from the Kennedy Space Center - Spaceflight Now,ibm purchase rolm gives new meaning term twisted pair howard anderson yankee group,0.05555555555555555,0.05555555555555555,-0.18181818181818182,https://slashdot.org/firehose.pl?op=view&amp;id=175913385,2025-01-15T05:32:22Z,Slashdot.org
2025-01-15,IBM,IBM,"French Woman Faces Cyberbullying After Forking Over $850,000 to AI Brad Pitt - Rolling Stone",ibm purchase rolm gives new meaning term twisted pair howard anderson yankee group,0.05555555555555555,0.05555555555555555,-0.18181818181818182,https://slashdot.org/firehose.pl?op=view&amp;id=175913391,2025-01-15T05:32:43Z,Slashdot.org
2025-01-15,IBM,IBM,"Trump’s Canada and Greenland Threats Imperil China Fight, Says Departing Envoy - The Wall Street Journal",ibm purchase rolm gives new meaning term twisted pair howard anderson yankee group,0.05555555555555555,0.05555555555555555,-0.18181818181818182,https://slashdot.org/firehose.pl?op=view&amp;id=175913549,2025-01-15T05:52:38Z,Slashdot.org
2025-01-15,ITW,Illinois Tool Works,"Cooper Financial Group Has $268,000 Stock Position in Illinois Tool Works Inc. (NYSE:ITW)",cooper financial group boosted stake shares illinois tool works inc nyse itw free report th quarter according company recent filing se chars,0.0,0.08108108108108109,0.13333333333333333,https://www.etfdailynews.com/2025/01/15/cooper-financial-group-has-268000-stock-position-in-illinois-tool-works-inc-nyseitw/,2025-01-15T10:30:56Z,ETF Daily News
2025-01-15,IR,Ingersoll Rand,Czech National Bank Has $7.90 Million Stock Position in Ingersoll Rand Inc. (NYSE:IR),czech national bank raised holdings ingersoll rand inc nyse ir free report th quarter according company recent disclosure sec firm ow chars,0.0,0.05405405405405406,0.02500000000000001,https://www.etfdailynews.com/2025/01/15/czech-national-bank-has-7-90-million-stock-position-in-ingersoll-rand-inc-nyseir/,2025-01-15T08:36:48Z,ETF Daily News
2025-01-15,IR,Ingersoll Rand,Citigroup Has Lowered Expectations for Ingersoll Rand (NYSE:IR) Stock Price,ingersoll rand nyse ir get free report target price decreased analysts citigroup research report issued monday benzinga reports brokerage presen chars,0.0,0.06060606060606061,0.0,https://www.etfdailynews.com/2025/01/15/citigroup-has-lowered-expectations-for-ingersoll-rand-nyseir-stock-price/,2025-01-15T09:26:56Z,ETF Daily News
2025-01-15,PODD,Insulet Corporation,Moody National Bank Trust Division Sells 215 Shares of Insulet Co. (NASDAQ:PODD),moody national bank trust division trimmed stake insulet co nasdaq podd free report th quarter according company recent disclosure securit chars,0.0,0.02857142857142857,0.2,https://www.etfdailynews.com/2025/01/15/moody-national-bank-trust-division-sells-215-shares-of-insulet-co-nasdaqpodd/,2025-01-15T10:14:45Z,ETF Daily News
2025-01-15,INTC,Intel,Intel (NASDAQ:INTC) Shares Down 1.8% Following Analyst Downgrade,shares intel co nasdaq intc get free report mid day trading monday mizuho lowered price target stock mizuho currently chars,0.0,0.02702702702702703,0.13333333333333333,https://www.etfdailynews.com/2025/01/15/intel-nasdaqintc-shares-down-1-8-following-analyst-downgrade/,2025-01-15T06:10:57Z,ETF Daily News
2025-01-15,INTC,Intel,Sandvine Appoints Chief Ethics & Compliance Officer and Board Advisor as Part of Strengthened Commitment to Internet Freedom and Digital Rights,carol tate serve cco following tenure chief compliance officer intel former president amp ceo human rights first michael breen appointed advisor board directors chars,0.0,0.02857142857142857,0.0625,https://financialpost.com/pmn/business-wire-news-releases-pmn/sandvine-appoints-chief-ethics-compliance-officer-and-board-advisor-as-part-of-strengthened-commitment-to-internet-freedom-and-digital-rights,2025-01-15T17:50:40Z,Financial Post
2025-01-15,ICE,Intercontinental Exchange,"Intercontinental Exchange (NYSE:ICE) Given New $178.00 Price Target at Keefe, Bruyette & Woods",intercontinental exchange nyse ice get free report price objective decreased investment analysts keefe bruyette amp woods report released monday b chars,0.0,0.0625,0.0,https://www.etfdailynews.com/2025/01/15/intercontinental-exchange-nyseice-given-new-178-00-price-target-at-keefe-bruyette-woods/,2025-01-15T07:33:01Z,ETF Daily News
2025-01-15,INTU,Intuit,"Lauren D. Hotz Sells 1,078 Shares of Intuit Inc. (NASDAQ:INTU) Stock",intuit inc nasdaq intu get free report cao lauren hotz sold shares stock transaction dated friday january th stock sold average price tot chars,0.0,0.02564102564102564,0.125,https://www.etfdailynews.com/2025/01/15/lauren-d-hotz-sells-1078-shares-of-intuit-inc-nasdaqintu-stock/,2025-01-15T09:40:57Z,ETF Daily News
2025-01-15,INTU,Intuit,Fiduciary Alliance LLC Boosts Holdings in Intuit Inc. (NASDAQ:INTU),fiduciary alliance llc grew position intuit inc nasdaq intu free report th quarter according company recent disclosure securities exc chars,0.0,0.02857142857142857,0.2,https://www.etfdailynews.com/2025/01/15/fiduciary-alliance-llc-boosts-holdings-in-intuit-inc-nasdaqintu/,2025-01-15T08:56:53Z,ETF Daily News
2025-01-15,IQV,IQVIA,Czech National Bank Grows Position in IQVIA Holdings Inc. (NYSE:IQV),czech national bank grew position shares iqvia holdings inc nyse iqv free report fourth quarter holdings channel com reports fund owned shares chars,0.0,0.02857142857142857,0.2,https://www.etfdailynews.com/2025/01/15/czech-national-bank-grows-position-in-iqvia-holdings-inc-nyseiqv/,2025-01-15T08:36:50Z,ETF Daily News
2025-01-15,IQV,IQVIA,Claro Advisors LLC Takes Position in IQVIA Holdings Inc. (NYSE:IQV),claro advisors llc acquired new stake iqvia holdings inc nyse iqv free report th quarter according recent filing securities exchange commission sec chars,0.0,0.027777777777777776,0.1090909090909091,https://www.etfdailynews.com/2025/01/15/claro-advisors-llc-takes-position-in-iqvia-holdings-inc-nyseiqv/,2025-01-15T09:24:55Z,ETF Daily News
2025-01-15,IRM,Iron Mountain,Iron Mountain Incorporated (NYSE:IRM) Shares Acquired by Cooper Financial Group,cooper financial group grew stake iron mountain incorporated nyse irm free report fourth quarter according recent f filing sec firm owned chars,0.0,0.05555555555555555,0.016666666666666673,https://www.etfdailynews.com/2025/01/15/iron-mountain-incorporated-nyseirm-shares-acquired-by-cooper-financial-group/,2025-01-15T09:16:53Z,ETF Daily News
2025-01-15,IRM,Iron Mountain,Head-To-Head Analysis: Iron Mountain (NYSE:IRM) and Granite Real Estate Inc. Staple (NYSE:GRP.U),granite real estate inc staple nyse grp u get free report iron mountain nyse irm get free report finance companies better investment contrast two chars,0.0,0.05555555555555555,0.375,https://www.etfdailynews.com/2025/01/15/head-to-head-analysis-iron-mountain-nyseirm-and-granite-real-estate-inc-staple-nysegrp-u/,2025-01-15T07:25:14Z,ETF Daily News
2025-01-15,JBL,Jabil,StockNews.com Downgrades Jabil (NYSE:JBL) to Hold,jabil nyse jbl get free report downgraded stock analysts stocknews com buy rating hold rating report released monday equities analysts also recently chars,0.0,0.02857142857142857,0.2,https://www.etfdailynews.com/2025/01/15/stocknews-com-downgrades-jabil-nysejbl-to-hold/,2025-01-15T07:52:55Z,ETF Daily News
2025-01-15,JBL,Jabil,Wealth Enhancement Advisory Services LLC Boosts Holdings in Jabil Inc. (NYSE:JBL),wealth enhancement advisory services llc raised holdings jabil inc nyse jbl free report th quarter according recent disclosure securities ex chars,0.0,0.029411764705882353,0.2,https://www.etfdailynews.com/2025/01/15/wealth-enhancement-advisory-services-llc-boosts-holdings-in-jabil-inc-nysejbl/,2025-01-15T08:42:53Z,ETF Daily News
2025-01-15,JNJ,Johnson & Johnson,Brokerages Set Johnson & Johnson (NYSE:JNJ) Price Target at $174.71,shares johnson amp johnson nyse jnj get free report assigned consensus recommendation hold thirteen analysts presently covering firm marketbeat report chars,0.0,0.0625,0.06666666666666667,https://www.etfdailynews.com/2025/01/15/brokerages-set-johnson-johnson-nysejnj-price-target-at-174-71/,2025-01-15T07:06:59Z,ETF Daily News
2025-01-15,JCI,Johnson Controls,Johnson Controls International (NYSE:JCI) Price Target Cut to $84.00 by Analysts at Citigroup,johnson controls international nyse jci get free report price objective cut investment analysts citigroup research note issued investors monday benz chars,0.0,0.06060606060606061,0.13333333333333333,https://www.etfdailynews.com/2025/01/15/johnson-controls-international-nysejci-price-target-cut-to-84-00-by-analysts-at-citigroup/,2025-01-15T08:30:54Z,ETF Daily News
2025-01-15,JPM,JPMorgan Chase,Jamie Dimon says these are the 2 biggest risks to the economy,story although u economy resilient slowing inflation consistently strong labor market jpmorgan chase jpm ceo jamie dimon still sees two significant ris chars,0.0,0.06060606060606061,0.4041666666666667,https://qz.com/jpmorgan-chase-jpm-q4-2024-earnings-jamie-dimon-economy-1851739824,2025-01-15T13:07:38Z,Quartz India
2025-01-15,JPM,JPMorgan Chase,JPMorgan Tops Views. Goldman Sachs Among Slew Of Bank Earnings.,q earnings season kicks higher gear wednesday jpmorgan chase beat views goldman sachs wells fargo blackrock citigroup set report results earnings growth banks fin chars,0.0,0.06060606060606061,0.25,https://www.investors.com/news/goldman-sachs-jpmorgan-wells-fargo-blackrock-earnings-q4-2024-gs-jpm-wfc-blk-c-schw/,2025-01-15T12:20:43Z,Investor's Business Daily
2025-01-15,JPM,JPMorgan Chase,"Live Earnings Analysis: JPMorgan (JPM), Goldman Sachs (GS), Wells Fargo (WFC) and Other Banks Report Fargo",list banks reporting morning long heres snapshot major banking companies issuing earnings jpmorgan chase nyse jpm wells fargo nyse wfc blackrock citigroup nyse chars,0.0,0.03125,0.006249999999999999,https://biztoc.com/x/9457460a850f511d,2025-01-15T13:28:30Z,Biztoc.com
2025-01-15,JPM,JPMorgan Chase,"Live Earnings Analysis: JPMorgan (JPM), Goldman Sachs (GS), Wells Fargo (WFC) and Other Banks Report",list banks reporting morning long snapshot major banking companies issuing earnings jpmorgan chase nyse jpm wells fargo nyse wfc blackrock nyse blk citig chars,0.0,0.03225806451612903,0.006249999999999999,https://biztoc.com/x/23f0672b23c19934,2025-01-15T14:45:26Z,Biztoc.com
2025-01-15,JPM,JPMorgan Chase,Q4 2024 Earnings Call Transcript,image source motley fool jpmorgan chase nyse jpm q earnings calljan etcontents prepared remarksquestions answerscall participantsprepared remarks operatorgood mor chars,0.0,0.041666666666666664,0.6,https://biztoc.com/x/520cfb6913e1786b,2025-01-15T19:19:45Z,Biztoc.com
2025-01-15,JPM,JPMorgan Chase,"JPMorgan posts record annual profit as dealmakers, traders ride market rebound",jpmorgan chase jpm n wednesday posted record annual profit dealmakers traders reaped windfall rebounding markets fourth quarter banking giant buoyed strong ec chars,0.0,0.058823529411764705,0.14444444444444443,https://biztoc.com/x/c1b6acbc733fa978,2025-01-15T12:11:14Z,Biztoc.com
2025-01-15,JPM,JPMorgan Chase,"Dow Jones Futures Rise With CPI Inflation Due; JPMorgan Beats, Quantum Stocks Jump",dow jones futures rose modestly wednesday along amp p futures nasdaq futures consumer price index due open jpmorgan chase jpm goldman sachs gs citigroup c chars,0.0,0.058823529411764705,0.14375,https://biztoc.com/x/5f5b61dbc6d559f2,2025-01-15T13:17:42Z,Biztoc.com
2025-01-15,JPM,JPMorgan Chase,"Dow Jones Futures: CPI Inflation, JPMorgan Due After Nvidia, Tesla Reverse Lower",dow jones futures rose slightly wednesday along amp p futures nasdaq futures consumer price index due early tuesday along earnings jpmorgan chase jpm goldman sac chars,0.0,0.06060606060606061,0.10208333333333333,https://biztoc.com/x/28f5a8458afb8e85,2025-01-15T11:48:45Z,Biztoc.com
2025-01-15,JPM,JPMorgan Chase,JPMorgan notches another record year of profits,last year jpmorgan chase jpm churned profits ever earned billion final quarter full year profits rose billion time record chars,0.0,0.05405405405405406,0.2375,https://biztoc.com/x/d75cbffbd0ecfe94,2025-01-15T12:44:10Z,Biztoc.com
