Date,Ticker,Company_Name,Title,Cleaned_Content,Density_Ticker,Density_Company,Sentiment,Url,PublishedAt,Source
2025-01-15,AOS,A. O. Smith,Claro Advisors LLC Reduces Stock Position in A. O. Smith Co. (NYSE:AOS),claro advisors llc trimmed position smith co nyse aos free report th quarter holdingschannel reports firm owned shares industrial products compan chars,0.0,0.08571428571428572,0.1,https://www.etfdailynews.com/2025/01/15/claro-advisors-llc-reduces-stock-position-in-a-o-smith-co-nyseaos/,2025-01-15T09:56:55Z,ETF Daily News
2025-01-15,AOS,A. O. Smith,Citigroup Has Lowered Expectations for A. O. Smith (NYSE:AOS) Stock Price,smith nyse aos get free report price target lowered equities research analysts citigroup report released monday benzinga reports brokerage p chars,0.0,0.08571428571428572,0.4,https://www.etfdailynews.com/2025/01/15/citigroup-has-lowered-expectations-for-a-o-smith-nyseaos-stock-price/,2025-01-15T08:29:00Z,ETF Daily News
2025-01-15,ABT,Abbott Laboratories,Jim Cramer on Abbott Laboratories (ABT): ‘Not Understood Very Well Because They’re Doing Tremendous Stuff When It Comes To Diabetes. People Don’t Seem To Care’,recently compiled list jim cramer discusses joe rogan elon musk stocks article going take look abbott laboratories nyse abt stands chars,0.0,0.05263157894736842,0.0,https://finance.yahoo.com/news/jim-cramer-abbott-laboratories-abt-163319501.html,2025-01-15T16:33:19Z,Yahoo Entertainment
2025-01-15,ABT,Abbott Laboratories,Stock Traders Buy Large Volume of Call Options on Abbott Laboratories (NYSE:ABT),abbott laboratories nyse abt get free report recipient unusually large options trading activity tuesday stock traders bought call options company increase chars,0.0,0.06060606060606061,0.30714285714285716,https://www.etfdailynews.com/2025/01/15/stock-traders-buy-large-volume-of-call-options-on-abbott-laboratories-nyseabt/,2025-01-15T08:49:01Z,ETF Daily News
2025-01-15,ABBV,AbbVie,Analysts Set AbbVie Inc. (NYSE:ABBV) Target Price at $205.50,shares abbvie inc nyse abbv get free report assigned consensus rating moderate buy twenty four brokerages presently covering company marketbeat com rep chars,0.0,0.03125,0.13333333333333333,https://www.etfdailynews.com/2025/01/15/analysts-set-abbvie-inc-nyseabbv-target-price-at-205-50/,2025-01-15T07:04:44Z,ETF Daily News
2025-01-15,AMD,Advanced Micro Devices,Advanced Micro Devices (NASDAQ:AMD) Shares Down 1.4% Following Analyst Downgrade,advanced micro devices inc nasdaq amd get free report fell tuesday keycorp lowered price target stock keycorp currently overweight rat chars,0.0,0.058823529411764705,0.26666666666666666,https://www.etfdailynews.com/2025/01/15/advanced-micro-devices-nasdaqamd-shares-down-1-4-following-analyst-downgrade/,2025-01-15T06:42:59Z,ETF Daily News
2025-01-15,AMD,Advanced Micro Devices,"Analysts Set Advanced Micro Devices, Inc. (NASDAQ:AMD) Target Price at $185.22",advanced micro devices inc nasdaq amd get free report received average recommendation moderate buy thirty research firms currently covering firm marketbeat co chars,0.0,0.06451612903225806,0.075,https://www.etfdailynews.com/2025/01/15/analysts-set-advanced-micro-devices-inc-nasdaqamd-target-price-at-185-22/,2025-01-15T08:14:50Z,ETF Daily News
2025-01-15,AMD,Advanced Micro Devices,TD Cowen Has Lowered Expectations for Advanced Micro Devices (NASDAQ:AMD) Stock Price,advanced micro devices nasdaq amd get free report price target reduced analysts td cowen report issued monday marketbeat com reports brokerage chars,0.0,0.08571428571428572,0.4,https://www.etfdailynews.com/2025/01/15/td-cowen-has-lowered-expectations-for-advanced-micro-devices-nasdaqamd-stock-price/,2025-01-15T08:58:54Z,ETF Daily News
2025-01-15,AMD,Advanced Micro Devices,Analyst unveils AMD stock price target on AI and server update,amd might find struggling keep ai race still plenty potential mature markets analysts say advanced micro devices amd shares dropped chars,0.02631578947368421,0.05263157894736842,0.16666666666666666,https://biztoc.com/x/9ab2673b8393b42a,2025-01-15T17:30:02Z,Biztoc.com
2025-01-15,AFL,Aflac,"Wedmont Private Capital Has $890,000 Stake in Aflac Incorporated (NYSE:AFL)",wedmont private capital grew holdings aflac incorporated nyse afl free report th quarter holdingschannel reports firm owned shares financial service chars,0.0,0.03125,0.05,https://www.etfdailynews.com/2025/01/15/wedmont-private-capital-has-890000-stake-in-aflac-incorporated-nyseafl/,2025-01-15T09:07:00Z,ETF Daily News
2025-01-15,A,Agilent Technologies,"Cooper Financial Group Boosts Stock Holdings in Agilent Technologies, Inc. (NYSE:A)",cooper financial group increased position agilent technologies inc nyse free report fourth quarter according company recent filing securitie chars,0.0,0.029411764705882353,0.1,https://www.etfdailynews.com/2025/01/15/cooper-financial-group-boosts-stock-holdings-in-agilent-technologies-inc-nysea/,2025-01-15T09:23:09Z,ETF Daily News
2025-01-15,APD,Air Products,"Moody National Bank Trust Division Sells 200 Shares of Air Products and Chemicals, Inc. (NYSE:APD)",moody national bank trust division lessened holdings shares air products chemicals inc nyse apd free report fourth quarter according company chars,0.0,0.05714285714285714,0.2,https://www.etfdailynews.com/2025/01/15/moody-national-bank-trust-division-sells-200-shares-of-air-products-and-chemicals-inc-nyseapd/,2025-01-15T10:31:06Z,ETF Daily News
2025-01-15,APD,Air Products,"Capital Investment Advisors LLC Has $1.58 Million Stock Position in Air Products and Chemicals, Inc. (NYSE:APD)",capital investment advisors llc cut position air products chemicals inc nyse apd free report th quarter according company recent f filing chars,0.0,0.05405405405405406,0.2,https://www.etfdailynews.com/2025/01/15/capital-investment-advisors-llc-has-1-58-million-stock-position-in-air-products-and-chemicals-inc-nyseapd/,2025-01-15T09:04:57Z,ETF Daily News
2025-01-15,APD,Air Products,"Salem Investment Counselors Inc. Sells 45 Shares of Air Products and Chemicals, Inc. (NYSE:APD)",salem investment counselors inc decreased stake shares air products chemicals inc nyse apd free report th quarter according recent f filing th chars,0.0,0.05555555555555555,0.0,https://www.etfdailynews.com/2025/01/15/salem-investment-counselors-inc-sells-45-shares-of-air-products-and-chemicals-inc-nyseapd/,2025-01-15T09:04:54Z,ETF Daily News
2025-01-15,ALB,Albemarle Corporation,"Fiduciary Alliance LLC Makes New $262,000 Investment in Albemarle Co. (NYSE:ALB)",fiduciary alliance llc acquired new stake albemarle co nyse alb free report fourth quarter according recent form f filing sec fund acquired sha chars,0.0,0.027777777777777776,0.08727272727272728,https://www.etfdailynews.com/2025/01/15/fiduciary-alliance-llc-makes-new-262000-investment-in-albemarle-co-nysealb/,2025-01-15T08:57:11Z,ETF Daily News
2025-01-15,ARE,Alexandria Real Estate Equities,Alexandria Real Estate Equities (NYSE:ARE) versus FrontView REIT (NYSE:FVR) Financial Contrast,alexandria real estate equities nyse get free report frontview reit nyse fvr get free report finance companies better investment contrast two b chars,0.02857142857142857,0.11428571428571428,0.375,https://www.etfdailynews.com/2025/01/15/alexandria-real-estate-equities-nyseare-versus-frontview-reit-nysefvr-financial-contrast/,2025-01-15T07:25:16Z,ETF Daily News
2025-01-15,ARE,Alexandria Real Estate Equities,"Eagle Bay Advisors LLC Has $28,000 Stake in Alexandria Real Estate Equities, Inc. (NYSE:ARE)",eagle bay advisors llc lowered position alexandria real estate equities inc nyse free report fourth quarter according recent filing sec chars,0.0,0.08571428571428572,0.10000000000000002,https://www.etfdailynews.com/2025/01/15/eagle-bay-advisors-llc-has-28000-stake-in-alexandria-real-estate-equities-inc-nyseare/,2025-01-15T09:04:57Z,ETF Daily News
2025-01-15,ALGN,Align Technology,"Capital Investment Advisors LLC Has $1.05 Million Holdings in Align Technology, Inc. (NASDAQ:ALGN)",capital investment advisors llc decreased holdings align technology inc nasdaq algn free report th quarter according recent filing securities amp chars,0.0,0.029411764705882353,0.0,https://www.etfdailynews.com/2025/01/15/capital-investment-advisors-llc-has-1-05-million-holdings-in-align-technology-inc-nasdaqalgn/,2025-01-15T08:50:54Z,ETF Daily News
2025-01-15,ALGN,Align Technology,"Moody National Bank Trust Division Sells 116 Shares of Align Technology, Inc. (NASDAQ:ALGN)",moody national bank trust division decreased position shares align technology inc nasdaq algn free report th quarter according company recent f f chars,0.0,0.027777777777777776,0.0,https://www.etfdailynews.com/2025/01/15/moody-national-bank-trust-division-sells-116-shares-of-align-technology-inc-nasdaqalgn/,2025-01-15T10:14:46Z,ETF Daily News
2025-01-15,ALLE,Allegion,Allegion plc (NYSE:ALLE) Receives $140.83 Consensus Price Target from Brokerages,allegion plc nyse alle get free report assigned average recommendation reduce six analysts presently covering firm marketbeat reports one analyst rate chars,0.0,0.030303030303030304,0.012499999999999997,https://www.etfdailynews.com/2025/01/15/allegion-plc-nysealle-receives-140-83-consensus-price-target-from-brokerages/,2025-01-15T06:40:54Z,ETF Daily News
2025-01-15,ALL,Allstate,"Texas Sues Allstate, Claims Insurer Illegally Collected Driver Data",texas sues allstate driver data collectionscott olson getty images hearst magazines yahoo may earn commission revenue items links state texas sued major chars,0.0,0.029411764705882353,0.0625,https://www.roadandtrack.com/news/a63433231/texas-sues-allstate-driver-data/,2025-01-15T16:54:00Z,RoadandTrack.com
2025-01-15,ALL,Allstate,Capital Investment Advisors LLC Purchases 459 Shares of The Allstate Co. (NYSE:ALL),capital investment advisors llc grew holdings shares allstate co nyse free report fourth quarter holdingschannel reports institutional investor owned chars,0.0,0.03125,0.2,https://www.etfdailynews.com/2025/01/15/capital-investment-advisors-llc-purchases-459-shares-of-the-allstate-co-nyseall/,2025-01-15T08:50:58Z,ETF Daily News
2025-01-15,ALL,Allstate,"Fiduciary Alliance LLC Buys Shares of 2,338 The Allstate Co. (NYSE:ALL)",fiduciary alliance llc purchased new position shares allstate co nyse free report th quarter according company recent f filing sec chars,0.0,0.02702702702702703,0.1090909090909091,https://www.etfdailynews.com/2025/01/15/fiduciary-alliance-llc-buys-shares-of-2338-the-allstate-co-nyseall/,2025-01-15T09:30:56Z,ETF Daily News
2025-01-15,ALL,Allstate,AllState Runs Into Privacy Lawsuit Alleging It Secretly Tracked Millions Of Drivers,skip contenta lawsuit filed texas attorney general ken paxton accuses allstate data analytics subsidiary arity illegally tracking drivers without knowledge consent well chars,0.0,0.030303030303030304,-0.22499999999999998,https://hothardware.com/news/allstate-privacy-lawsuit-alleging-secretly-tracked-millions-drivers,2025-01-15T14:10:00Z,Hot Hardware
2025-01-15,AMZN,Amazon,Every Amazon Investor Should Keep an Eye on This Number,amazon nasdaq amzn winning stock public existence save normal ebbs flows asset company tends hit marks regularly finds new busine chars,0.0,0.02564102564102564,0.1572727272727273,https://biztoc.com/x/1fc4418e049387b5,2025-01-15T11:27:13Z,Biztoc.com
2025-01-15,AMZN,Amazon,Amazon is cutting a beloved Prime membership service,amazon prime grown rapidly past years especially united states subscription service costs year monthly allows amazon amzn customers unloc chars,0.0,0.058823529411764705,-0.125,https://biztoc.com/x/793f6f85ddc45eaf,2025-01-15T15:17:59Z,Biztoc.com
2025-01-15,AEP,American Electric Power,"Wedmont Private Capital Acquires 1,111 Shares of American Electric Power Company, Inc. (NASDAQ:AEP)",wedmont private capital lifted holdings shares american electric power company inc nasdaq aep free report fourth quarter according company recent f chars,0.0,0.08571428571428572,0.08,https://www.etfdailynews.com/2025/01/15/wedmont-private-capital-acquires-1111-shares-of-american-electric-power-company-inc-nasdaqaep/,2025-01-15T09:03:12Z,ETF Daily News
2025-01-15,AEP,American Electric Power,American Electric Power (NASDAQ:AEP) Raised to Buy at Bank of America,american electric power nasdaq aep get free report upgraded equities researchers bank america underperform rating buy rating research report issued clients chars,0.0,0.08571428571428572,0.2,https://www.etfdailynews.com/2025/01/15/american-electric-power-nasdaqaep-raised-to-buy-at-bank-of-america/,2025-01-15T06:44:57Z,ETF Daily News
2025-01-15,AXP,American Express,UBS Group Forecasts Strong Price Appreciation for American Express (NYSE:AXP) Stock,american express nyse axp price target boosted equities research analysts ubs group report released monday benzinga reports brokerage currently ha chars,0.0,0.0625,0.0,https://www.etfdailynews.com/2025/01/15/ubs-group-forecasts-strong-price-appreciation-for-american-express-nyseaxp-stock/,2025-01-15T08:53:05Z,ETF Daily News
2025-01-15,AIG,American International Group,"Brokerages Set American International Group, Inc. (NYSE:AIG) Price Target at $84.06",american international group inc nyse aig get free report earned average rating moderate buy sixteen analysts currently covering firm marketbeat com reports chars,0.0,0.0625,0.007142857142857141,https://www.etfdailynews.com/2025/01/15/brokerages-set-american-international-group-inc-nyseaig-price-target-at-84-06/,2025-01-15T06:41:00Z,ETF Daily News
2025-01-15,AMT,American Tower,Barclays Has Lowered Expectations for American Tower (NYSE:AMT) Stock Price,american tower nyse amt get free report target price dropped stock analysts barclays report issued monday benzinga reports brokerage presently h chars,0.0,0.058823529411764705,0.13333333333333333,https://www.etfdailynews.com/2025/01/15/barclays-has-lowered-expectations-for-american-tower-nyseamt-stock-price/,2025-01-15T07:00:54Z,ETF Daily News
2025-01-15,AMGN,Amgen,Amgen Inc. (NASDAQ:AMGN) Shares Acquired by Brookstone Capital Management,brookstone capital management boosted stake shares amgen inc nasdaq amgn free report th quarter according company recent disclosure securit chars,0.0,0.02857142857142857,0.2,https://www.etfdailynews.com/2025/01/15/amgen-inc-nasdaqamgn-shares-acquired-by-brookstone-capital-management/,2025-01-15T09:01:00Z,ETF Daily News
2025-01-15,APH,Amphenol,Rep. James Comer Purchases Shares of Amphenol Co. (NYSE:APH),representative james comer r kentucky recently bought shares amphenol co nyse aph filing disclosed january th representative disclosed bought chars,0.0,0.03225806451612903,0.0,https://www.etfdailynews.com/2025/01/15/rep-james-comer-purchases-shares-of-amphenol-co-nyseaph/,2025-01-15T08:04:44Z,ETF Daily News
2025-01-15,AON,Aon,Cooper Financial Group Reduces Stock Holdings in Aon plc (NYSE:AON),cooper financial group lessened holdings shares aon plc nyse aon free report th quarter according company recent form f filing securities chars,0.02702702702702703,0.02702702702702703,0.13333333333333333,https://www.etfdailynews.com/2025/01/15/cooper-financial-group-reduces-stock-holdings-in-aon-plc-nyseaon/,2025-01-15T10:31:06Z,ETF Daily News
2025-01-15,AON,Aon,Wedmont Private Capital Increases Holdings in Aon plc (NYSE:AON),wedmont private capital grew holdings aon plc nyse aon free report th quarter according company recent filing sec firm owned shares chars,0.02564102564102564,0.02564102564102564,0.020000000000000007,https://www.etfdailynews.com/2025/01/15/wedmont-private-capital-increases-holdings-in-aon-plc-nyseaon/,2025-01-15T09:15:02Z,ETF Daily News
2025-01-15,APO,Apollo Global Management,Apollo Makes Key Leadership Appointments Aligned to Firm’s Five-Year Plan Announced at 2024 Investor Day,ceo marc rowan enter year employment agreement extension jim zelter named president apollo global management john zito named co president apollo asset management alongside scott kl chars,0.0,0.16129032258064516,0.0,https://www.globenewswire.com/news-release/2025/01/15/3010038/0/en/Apollo-Makes-Key-Leadership-Appointments-Aligned-to-Firm-s-Five-Year-Plan-Announced-at-2024-Investor-Day.html,2025-01-15T13:30:00Z,GlobeNewswire
2025-01-15,AAPL,Apple Inc.,Apple Inc. (NASDAQ:AAPL) Stock Holdings Cut by Bray Capital Advisors,bray capital advisors cut holdings apple inc nasdaq aapl free report third quarter according recent disclosure securities exchange commission sec chars,0.0,0.058823529411764705,0.07500000000000001,https://www.etfdailynews.com/2025/01/15/apple-inc-nasdaqaapl-stock-holdings-cut-by-bray-capital-advisors/,2025-01-15T08:40:50Z,ETF Daily News
2025-01-15,AAPL,Apple Inc.,Rovin Capital UT ADV Increases Stake in Apple Inc. (NASDAQ:AAPL),rovin capital ut adv raised holdings shares apple inc nasdaq aapl free report rd quarter holdingschannel com reports fund owned shares iphone maker chars,0.0,0.05714285714285714,0.4,https://www.etfdailynews.com/2025/01/15/rovin-capital-ut-adv-increases-stake-in-apple-inc-nasdaqaapl/,2025-01-15T08:40:53Z,ETF Daily News
2025-01-15,AAPL,Apple Inc.,Townsend & Associates Inc Has $3.38 Million Stake in Apple Inc. (NASDAQ:AAPL),townsend amp associates inc lowered holdings apple inc nasdaq aapl free report third quarter according company recent form f filing sec chars,0.0,0.05555555555555555,0.07500000000000001,https://www.etfdailynews.com/2025/01/15/townsend-associates-inc-has-3-38-million-stake-in-apple-inc-nasdaqaapl/,2025-01-15T08:40:52Z,ETF Daily News
2025-01-15,AAPL,Apple Inc.,Thomas Story & Son LLC Has $10.93 Million Stock Holdings in Apple Inc. (NASDAQ:AAPL),thomas story amp son llc lessened stake shares apple inc nasdaq aapl free report third quarter holdings channel reports fund owned shares iphon chars,0.0,0.05555555555555555,0.2,https://www.etfdailynews.com/2025/01/15/thomas-story-son-llc-has-10-93-million-stock-holdings-in-apple-inc-nasdaqaapl/,2025-01-15T09:18:59Z,ETF Daily News
2025-01-15,AAPL,Apple Inc.,First Fiduciary Investment Counsel Inc. Purchases 156 Shares of Apple Inc. (NASDAQ:AAPL),first fiduciary investment counsel inc boosted position shares apple inc nasdaq aapl free report third quarter according company recent disclosure w chars,0.0,0.08571428571428572,0.1625,https://www.etfdailynews.com/2025/01/15/first-fiduciary-investment-counsel-inc-purchases-156-shares-of-apple-inc-nasdaqaapl/,2025-01-15T08:40:52Z,ETF Daily News
2025-01-15,AAPL,Apple Inc.,Corrado Advisors LLC Boosts Stock Position in Apple Inc. (NASDAQ:AAPL),corrado advisors llc increased stake shares apple inc nasdaq aapl free report third quarter according company recent disclosure sec th chars,0.0,0.05555555555555555,0.07500000000000001,https://www.etfdailynews.com/2025/01/15/corrado-advisors-llc-boosts-stock-position-in-apple-inc-nasdaqaapl/,2025-01-15T09:18:59Z,ETF Daily News
2025-01-15,AAPL,Apple Inc.,Apple Inc. (NASDAQ:AAPL) is Processus Wealth & Capital Management LLC’s 2nd Largest Position,processus wealth amp capital management llc lessened stake apple inc nasdaq aapl free report rd quarter according recent filing sec fund owned chars,0.0,0.05555555555555555,0.10000000000000002,https://www.etfdailynews.com/2025/01/15/apple-inc-nasdaqaapl-is-processus-wealth-capital-management-llcs-2nd-largest-position/,2025-01-15T09:18:57Z,ETF Daily News
2025-01-15,AAPL,Apple Inc.,Apple Inc. (NASDAQ:AAPL) is Windward Capital Management Co. CA’s Largest Position,windward capital management co ca grew position apple inc nasdaq aapl free report third quarter holdingschannel com reports fund owned shares ip chars,0.0,0.06060606060606061,0.2,https://www.etfdailynews.com/2025/01/15/apple-inc-nasdaqaapl-is-windward-capital-management-co-cas-largest-position/,2025-01-15T08:40:49Z,ETF Daily News
2025-01-15,AAPL,Apple Inc.,Apple Inc. (NASDAQ:AAPL) is Shoker Investment Counsel Inc.’s 6th Largest Position,shoker investment counsel inc lessened stake shares apple inc nasdaq aapl free report rd quarter according recent filing securities excha chars,0.0,0.08571428571428572,0.2,https://www.etfdailynews.com/2025/01/15/apple-inc-nasdaqaapl-is-shoker-investment-counsel-inc-s-6th-largest-position/,2025-01-15T08:40:50Z,ETF Daily News
2025-01-15,AMAT,Applied Materials,Wells Fargo & Company Has Lowered Expectations for Applied Materials (NASDAQ:AMAT) Stock Price,applied materials nasdaq amat get free report price objective decreased equities research analysts wells fargo amp company note issued investors chars,0.0,0.058823529411764705,0.0,https://www.etfdailynews.com/2025/01/15/wells-fargo-company-has-lowered-expectations-for-applied-materials-nasdaqamat-stock-price/,2025-01-15T09:30:52Z,ETF Daily News
2025-01-15,APTV,Aptiv,GAMMA Investing LLC Sells 492 Shares of Aptiv PLC (NYSE:APTV),gamma investing llc decreased holdings shares aptiv plc nyse aptv free report th quarter according company recent filing securities chars,0.0,0.027777777777777776,0.0,https://www.etfdailynews.com/2025/01/15/gamma-investing-llc-sells-492-shares-of-aptiv-plc-nyseaptv/,2025-01-15T08:34:48Z,ETF Daily News
2025-01-15,ACGL,Arch Capital Group,Arch Capital Group Ltd. (NASDAQ:ACGL) Shares Bought by Czech National Bank,czech national bank raised holdings shares arch capital group ltd nasdaq acgl free report th quarter according company recent f filing se chars,0.0,0.07894736842105263,0.2,https://www.etfdailynews.com/2025/01/15/arch-capital-group-ltd-nasdaqacgl-shares-bought-by-czech-national-bank/,2025-01-15T08:36:48Z,ETF Daily News
2025-01-15,AJG,Arthur J. Gallagher & Co.,Aprio Wealth Management LLC Takes Position in Arthur J. Gallagher & Co. (NYSE:AJG),aprio wealth management llc bought new position arthur j gallagher amp co nyse ajg free report fourth quarter according recent filing sec firm bough chars,0.0,0.1111111111111111,0.0393939393939394,https://www.etfdailynews.com/2025/01/15/aprio-wealth-management-llc-takes-position-in-arthur-j-gallagher-co-nyseajg/,2025-01-15T08:30:49Z,ETF Daily News
2025-01-15,AJG,Arthur J. Gallagher & Co.,"Eastern Bank Has $233,000 Stock Holdings in Arthur J. Gallagher & Co. (NYSE:AJG)",eastern bank decreased stake shares arthur j gallagher amp co nyse ajg free report th quarter according company recent f filing se chars,0.0,0.10526315789473684,0.0,https://www.etfdailynews.com/2025/01/15/eastern-bank-has-233000-stock-holdings-in-arthur-j-gallagher-co-nyseajg/,2025-01-15T09:24:58Z,ETF Daily News
2025-01-15,ADP,Automatic Data Processing,"Cooper Financial Group Grows Holdings in Automatic Data Processing, Inc. (NASDAQ:ADP)",cooper financial group raised stake automatic data processing inc nasdaq adp free report fourth quarter according recent filing securities e chars,0.0,0.058823529411764705,0.1,https://www.etfdailynews.com/2025/01/15/cooper-financial-group-grows-holdings-in-automatic-data-processing-inc-nasdaqadp/,2025-01-15T11:10:03Z,ETF Daily News
2025-01-15,AVB,AvalonBay Communities,"Czech National Bank Boosts Position in AvalonBay Communities, Inc. (NYSE:AVB)",czech national bank grew stake shares avalonbay communities inc nyse avb free report th quarter according company recent disclosure se chars,0.0,0.027777777777777776,0.2,https://www.etfdailynews.com/2025/01/15/czech-national-bank-boosts-position-in-avalonbay-communities-inc-nyseavb/,2025-01-15T08:30:59Z,ETF Daily News
2025-01-15,AVB,AvalonBay Communities,"Wealth Enhancement Advisory Services LLC Trims Stake in AvalonBay Communities, Inc. (NYSE:AVB)",wealth enhancement advisory services llc lowered holdings avalonbay communities inc nyse avb free report th quarter holdingschannel com reports fund owned chars,0.0,0.03333333333333333,0.4,https://www.etfdailynews.com/2025/01/15/wealth-enhancement-advisory-services-llc-trims-stake-in-avalonbay-communities-inc-nyseavb/,2025-01-15T09:26:55Z,ETF Daily News
2025-01-15,AXON,Axon Enterprise,"Czech National Bank Buys 1,082 Shares of Axon Enterprise, Inc. (NASDAQ:AXON)",czech national bank raised stake axon enterprise inc nasdaq axon free report fourth quarter holdings channel com reports institutional investor owned shar chars,0.03225806451612903,0.03225806451612903,0.2,https://www.etfdailynews.com/2025/01/15/czech-national-bank-buys-1082-shares-of-axon-enterprise-inc-nasdaqaxon/,2025-01-15T08:36:49Z,ETF Daily News
2025-01-15,BKR,Baker Hughes,Wedmont Private Capital Increases Stock Position in Baker Hughes (NASDAQ:BKR),wedmont private capital boosted holdings baker hughes nasdaq bkr free report th quarter holdings channel reports firm owned shares company stock chars,0.0,0.058823529411764705,0.06666666666666667,https://www.etfdailynews.com/2025/01/15/wedmont-private-capital-increases-stock-position-in-baker-hughes-nasdaqbkr/,2025-01-15T10:14:46Z,ETF Daily News
2025-01-15,BALL,Ball Corporation,Fiduciary Alliance LLC Buys New Position in Ball Co. (NYSE:BALL),fiduciary alliance llc bought new stake shares ball co nyse ball free report fourth quarter according recent disclosure securities amp exchange commission chars,0.029411764705882353,0.029411764705882353,0.1340909090909091,https://www.etfdailynews.com/2025/01/15/fiduciary-alliance-llc-buys-new-position-in-ball-co-nyseball/,2025-01-15T09:30:56Z,ETF Daily News
2025-01-15,BAC,Bank of America,Here's what Wall St. experts are saying about these banks ahead of earnings,morgan stanley ms bank america bac scheduled announce quarterly results july watch read bofa notes five banks buy rated jpmorgan jpm wells chars,0.0,0.08571428571428572,0.0,https://thefly.com/permalinks/entry.php/id4052483/MS;BAC;JPM;WFC;GS;C;BK-Heres-what-Wall-St-experts-are-saying-about-these-banks-ahead-of-earnings,2025-01-15T19:35:50Z,Thefly.com
