Date,Ticker,Company_Name,Title,Cleaned_Content,Density_Ticker,Density_Company,Sentiment,Url,PublishedAt,Source
2024-12-31,MMM,3M,Is 3M a Top Stock to Buy for 2025?,years underperformance nyse mmm stock delivered respectable performance investors gaining bring importantly best wa chars,0.0,0.02857142857142857,0.75,https://biztoc.com/x/e02ba693e47977ea,2024-12-31T11:47:04Z,Biztoc.com
2024-12-31,ABT,Abbott Laboratories,Abbott Laboratories (NYSE:ABT) Stock Price Crosses Above 200-Day Moving Average – What’s Next?,abbott laboratories nyse abt get free report share price passed day moving average trading monday stock day moving average traded high chars,0.0,0.05555555555555555,0.065,https://www.etfdailynews.com/2024/12/31/abbott-laboratories-nyseabt-stock-price-crosses-above-200-day-moving-average-whats-next/,2024-12-31T08:40:59Z,ETF Daily News
2024-12-31,ADBE,Adobe Inc.,Rep. Marjorie Taylor Greene Buys Adobe Inc. (NASDAQ:ADBE) Stock,representative marjorie taylor greene r georgia recently bought shares adobe inc nasdaq adbe filing disclosed december th representative disclosed bought chars,0.0,0.06896551724137931,0.0,https://www.etfdailynews.com/2024/12/31/rep-marjorie-taylor-greene-buys-adobe-inc-nasdaqadbe-stock/,2024-12-31T11:04:46Z,ETF Daily News
2024-12-31,AMD,Advanced Micro Devices,AMD's Next Big Move: Northland Names It a Top Pick for 2025,recently northland analysts reiterated outperform rating advanced micro devices amd financial set price target price target nearly upside tuesday c chars,0.0,0.08823529411764706,0.125,https://finance.yahoo.com/news/amds-next-big-move-northland-065521816.html,2024-12-31T06:55:21Z,Yahoo Entertainment
2024-12-31,AMD,Advanced Micro Devices,"Advanced Micro Devices, Inc. (NASDAQ:AMD) Short Interest Up 14.7% in December",advanced micro devices inc nasdaq amd get free report saw significant growth short interest month december december th short interest totalling sha chars,0.0,0.058823529411764705,0.23500000000000001,https://www.etfdailynews.com/2024/12/31/advanced-micro-devices-inc-nasdaqamd-short-interest-up-14-7-in-december/,2024-12-31T11:56:53Z,ETF Daily News
2024-12-31,AMD,Advanced Micro Devices,GraniteShares 1x Short AMD Daily ETF (NASDAQ:AMDS) Short Interest Down 7.1% in December,graniteshares x short amd daily etf nasdaq amds get free report recipient significant drop short interest december december th short interest totalling chars,0.02857142857142857,0.0,0.12916666666666668,https://www.etfdailynews.com/2024/12/31/graniteshares-1x-short-amd-daily-etf-nasdaqamds-short-interest-down-7-1-in-december/,2024-12-31T11:56:50Z,ETF Daily News
2024-12-31,AFL,Aflac,"Aflac Incorporated (NYSE:AFL) EVP Sells $2,558,529.60 in Stock",aflac incorporated nyse afl get free report evp audrey b tillman sold shares company stock transaction dated friday december th stock sold average price chars,0.0,0.027777777777777776,0.125,https://www.etfdailynews.com/2024/12/31/aflac-incorporated-nyseafl-evp-sells-2558529-60-in-stock/,2024-12-31T09:06:58Z,ETF Daily News
2024-12-31,A,Agilent Technologies,E-Invoicing and Automation Lead the Way in Tax Transformation,regulatory demands increase digital transformation approach e invoicing indirect tax transformation becoming essential businesses recent roundtable industry leaders disc chars,0.03571428571428571,0.0,0.1125,https://economictimes.indiatimes.com/news/india/e-invoicing-and-automation-lead-the-way-in-tax-transformation/articleshow/116620671.cms,2024-12-31T09:51:10Z,The Times of India
2024-12-31,APD,Air Products,"Air Products and Chemicals, Inc. (APD) to Issue Quarterly Dividend of $1.77 on February 10th",air products chemicals inc nyse apd get free report declared quarterly dividend thursday november st rtt news reports shareholders record thursday january nd given chars,0.0,0.06060606060606061,0.4,https://www.etfdailynews.com/2024/12/31/air-products-and-chemicals-inc-apd-to-issue-quarterly-dividend-of-1-77-on-february-10th/,2024-12-31T12:06:55Z,ETF Daily News
2024-12-31,ARE,Alexandria Real Estate Equities,Zacks Research Analysts Reduce Earnings Estimates for ARE,alexandria real estate equities inc nyse free report research analysts zacks research reduced q eps estimates shares alexandria real estate equities report issu chars,0.0,0.20588235294117646,0.26666666666666666,https://www.etfdailynews.com/2024/12/31/zacks-research-analysts-reduce-earnings-estimates-for-are/,2024-12-31T06:22:50Z,ETF Daily News
2024-12-31,AMZN,Amazon,The AI stocks that could boom in 2025,big tech stocks could another big year nvidia nvda amazon amzn alphabet googl apple aapl could continue biggest winners artificial intelligence chars,0.0,0.029411764705882353,-0.19999999999999998,https://qz.com/tech-ai-stocks-2025-nvidia-google-amazon-apple-1851723970,2024-12-31T10:00:00Z,Quartz India
2024-12-31,AMZN,Amazon,"Is Amazon a Buy, Sell, or Hold in 2025?",e commerce pioneer amazon nasdaq amzn belongs small handful stocks consider buying time time master investors like warren buffett insist even great companie chars,0.0,0.029411764705882353,0.275,https://biztoc.com/x/4c6b5df0cc9c94fc,2024-12-31T17:50:46Z,Biztoc.com
2024-12-31,AXP,American Express,These Are The 5 Best Dow Jones Stocks Of 2024,nvidia nvda walmart wmt amazon com amzn count among five best dow jones stocks goldman sachs gs american express axp also make cut xnow playingstocks end strong chars,0.0,0.05714285714285714,0.4777777777777778,https://www.investors.com/news/best-dow-jones-stocks-2024-nvidia-walmart-amazon-goldman-sachs-american-express/,2024-12-31T21:21:21Z,Investor's Business Daily
2024-12-31,AXP,American Express,American Express (NYSE:AXP) Share Price Passes Above 200-Day Moving Average – Here’s Why,american express nyse axp shares crossed day moving average trading monday stock day moving average traded high american expres chars,0.0,0.08823529411764706,-0.027999999999999997,https://www.etfdailynews.com/2024/12/31/american-express-nyseaxp-share-price-passes-above-200-day-moving-average-heres-why/,2024-12-31T08:40:56Z,ETF Daily News
2024-12-31,AMT,American Tower,American Tower Co. (NYSE:AMT) Short Interest Update,american tower co nyse amt get free report target significant decline short interest december december th short interest totalling shares decl chars,0.0,0.05714285714285714,0.155,https://www.etfdailynews.com/2024/12/31/american-tower-co-nyseamt-short-interest-update/,2024-12-31T13:22:48Z,ETF Daily News
2024-12-31,APH,Amphenol,Amphenol (NYSE:APH) Stock Crosses Above 200 Day Moving Average – Here’s What Happened,amphenol co nyse aph get free report stock price passed two hundred day moving average trading monday stock two hundred day moving average traded chars,0.0,0.02631578947368421,0.03333333333333333,https://www.etfdailynews.com/2024/12/31/amphenol-nyseaph-stock-crosses-above-200-day-moving-average-heres-what-happened/,2024-12-31T08:46:25Z,ETF Daily News
2024-12-31,AON,Aon,Contrasting AON (NYSE:AON) and TWFG (NASDAQ:TWFG),aon nyse aon get free report twfg nasdaq twfg get free report finance companies superior business contrast two companies based strength chars,0.02702702702702703,0.02702702702702703,0.5,https://www.etfdailynews.com/2024/12/31/contrasting-aon-nyseaon-and-twfg-nasdaqtwfg/,2024-12-31T07:46:49Z,ETF Daily News
2024-12-31,AAPL,Apple Inc.,Apple Inc. (NASDAQ:AAPL) is Fidelis Capital Partners LLC’s Largest Position,fidelis capital partners llc lifted position apple inc nasdaq aapl free report third quarter according company recent filing securities chars,0.0,0.05714285714285714,0.13333333333333333,https://www.etfdailynews.com/2024/12/31/apple-inc-nasdaqaapl-is-fidelis-capital-partners-llcs-largest-position/,2024-12-31T08:20:48Z,ETF Daily News
2024-12-31,AAPL,Apple Inc.,Apple Inc. (NASDAQ:AAPL) Shares Sold by Jacobsen Capital Management,jacobsen capital management decreased stake apple inc nasdaq aapl free report rd quarter holdings channel reports firm owned shares iphone maker chars,0.0,0.058823529411764705,-0.06666666666666667,https://www.etfdailynews.com/2024/12/31/apple-inc-nasdaqaapl-shares-sold-by-jacobsen-capital-management/,2024-12-31T08:20:49Z,ETF Daily News
2024-12-31,AAPL,Apple Inc.,Andina Capital Management LLC Decreases Position in Apple Inc. (NASDAQ:AAPL),andina capital management llc lessened stake apple inc nasdaq aapl free report third quarter holdings channel reports fund owned shares iphone maker chars,0.0,0.05714285714285714,0.2,https://www.etfdailynews.com/2024/12/31/andina-capital-management-llc-decreases-position-in-apple-inc-nasdaqaapl/,2024-12-31T08:20:51Z,ETF Daily News
2024-12-31,AAPL,Apple Inc.,"Eagle Strategies LLC Sells 1,085 Shares of Apple Inc. (NASDAQ:AAPL)",eagle strategies llc reduced stake apple inc nasdaq aapl free report third quarter holdingschannel reports fund owned shares iphone maker stock af chars,0.0,0.058823529411764705,0.2,https://www.etfdailynews.com/2024/12/31/eagle-strategies-llc-sells-1085-shares-of-apple-inc-nasdaqaapl/,2024-12-31T08:20:48Z,ETF Daily News
2024-12-31,AAPL,Apple Inc.,"Davidson Capital Management Inc. Sells 2,282 Shares of Apple Inc. (NASDAQ:AAPL)",davidson capital management inc lessened holdings shares apple inc nasdaq aapl free report rd quarter according recent filing securities chars,0.0,0.08823529411764706,0.2,https://www.etfdailynews.com/2024/12/31/davidson-capital-management-inc-sells-2282-shares-of-apple-inc-nasdaqaapl/,2024-12-31T08:20:51Z,ETF Daily News
2024-12-31,AAPL,Apple Inc.,Apple Inc. (NASDAQ:AAPL) Shares Sold by Adams Diversified Equity Fund Inc.,adams diversified equity fund inc cut position shares apple inc nasdaq aapl free report rd quarter according company recent disclosure se chars,0.0,0.08108108108108109,0.2,https://www.etfdailynews.com/2024/12/31/apple-inc-nasdaqaapl-shares-sold-by-adams-diversified-equity-fund-inc/,2024-12-31T08:20:51Z,ETF Daily News
2024-12-31,AAPL,Apple Inc.,Walter & Keenan Wealth Management LLC IN ADV Has $21.64 Million Holdings in Apple Inc. (NASDAQ:AAPL),walter amp keenan wealth management llc adv lessened stake apple inc nasdaq aapl free report third quarter holdingschannel reports firm owned shares chars,0.0,0.058823529411764705,0.06666666666666667,https://www.etfdailynews.com/2024/12/31/walter-keenan-wealth-management-llc-in-adv-has-21-64-million-holdings-in-apple-inc-nasdaqaapl/,2024-12-31T08:20:48Z,ETF Daily News
2024-12-31,AAPL,Apple Inc.,Apple (NASDAQ:AAPL) Trading Down 0.1% – What’s Next?,apple inc nasdaq aapl get free report shares tuesday stock traded low last traded approximately shares traded trading chars,0.0,0.05714285714285714,0.0,https://www.etfdailynews.com/2024/12/31/apple-nasdaqaapl-trading-down-0-1-whats-next/,2024-12-31T17:36:27Z,ETF Daily News
2024-12-31,AAPL,Apple Inc.,Tyche Wealth Partners LLC Has $29.75 Million Stake in Apple Inc. (NASDAQ:AAPL),tyche wealth partners llc trimmed stake apple inc nasdaq aapl free report third quarter holdingschannel reports firm owned shares iphone maker stock chars,0.0,0.05714285714285714,0.06666666666666667,https://www.etfdailynews.com/2024/12/31/tyche-wealth-partners-llc-has-29-75-million-stake-in-apple-inc-nasdaqaapl/,2024-12-31T08:20:50Z,ETF Daily News
2024-12-31,AAPL,Apple Inc.,Avitas Wealth Management LLC Has $42.59 Million Stock Position in Apple Inc. (NASDAQ:AAPL),avitas wealth management llc reduced holdings shares apple inc nasdaq aapl free report third quarter according recent form f filing securitie chars,0.0,0.05714285714285714,0.13333333333333333,https://www.etfdailynews.com/2024/12/31/avitas-wealth-management-llc-has-42-59-million-stock-position-in-apple-inc-nasdaqaapl/,2024-12-31T08:20:50Z,ETF Daily News
2024-12-31,AMAT,Applied Materials,"Rep. Marjorie Taylor Greene Purchases Shares of Applied Materials, Inc. (NASDAQ:AMAT)",representative marjorie taylor greene r georgia recently bought shares applied materials inc nasdaq amat filing disclosed december th representative disclosed b chars,0.0,0.034482758620689655,0.0,https://www.etfdailynews.com/2024/12/31/rep-marjorie-taylor-greene-purchases-shares-of-applied-materials-inc-nasdaqamat/,2024-12-31T11:04:47Z,ETF Daily News
2024-12-31,APTV,Aptiv,Why Aptiv PLC (APTV) Is One of the Best Environmental Stocks to Invest in Right Now?,recently published list best environmental stocks invest right article going take look aptiv plc nyse aptv stands best envi chars,0.0,0.02564102564102564,0.5714285714285714,https://finance.yahoo.com/news/why-aptiv-plc-aptv-one-093219563.html,2024-12-31T09:32:19Z,Yahoo Entertainment
2024-12-31,AXON,Axon Enterprise,Axon Enterprise: Capitalizing On Strong Core Business And Innovative Drone Opportunities,last wrote axon enterprise nasdaq axon october several valuation metrics flashed overvaluation warning signs still recommended buying aggressive growth investor chars,0.03333333333333333,0.06666666666666667,0.0,https://biztoc.com/x/70bdb52c3fc15c9e,2024-12-31T08:39:58Z,Biztoc.com
2024-12-31,BRK.B,Berkshire Hathaway,"The Best Warren Buffett Stocks to Buy With $1,000 Right Now",article berkshire hathaway nyse brk nyse brk b owns stock portfolio worth roughly billion four dozen individual stocks legendary stock picker warren buffett hi chars,0.0,0.03333333333333333,0.3,https://biztoc.com/x/8b19d7128c01269f,2024-12-31T13:58:51Z,Biztoc.com
2024-12-31,BRK.B,Berkshire Hathaway,"The best Warren Buffett stocks to buy with $1,000 right now",berkshire hathaway nyse brk nyse brk b owns stock portfolio worth roughly billion four dozen individual stocks legendary stock picker warren buffett hand selec chars,0.0,0.06896551724137931,0.3,https://biztoc.com/x/2ffb8aa9d450152a,2024-12-31T14:20:49Z,Biztoc.com
2024-12-31,BRK.B,Berkshire Hathaway,Predictions thread for 2025 [vanity free-for-all],snip kass says berkshire hathaway brk eliminate entire stake apple selling shares midyear ceo warren buffett corporate curtain call acquisition bo chars,0.0,0.06060606060606061,0.0,https://freerepublic.com/focus/f-chat/4287256/posts,2024-12-31T03:28:53Z,Freerepublic.com
2024-12-31,BLK,BlackRock,A standoff between BlackRock and the FDIC is dragging into 2025,clash blackrock blk federal deposit insurance corporation fdic money managers holdings us banks play waning days president joe bidens administ chars,0.0,0.02857142857142857,0.0,https://finance.yahoo.com/news/a-standoff-between-blackrock-and-the-fdic-is-dragging-into-2025-155212798.html,2024-12-31T15:52:12Z,Yahoo Entertainment
2024-12-31,BLK,BlackRock,BlackRock (NYSE:BLK) Coverage Initiated at StockNews.com,stock analysts stocknews com assumed coverage shares blackrock nyse blk get free report report released tuesday firm set hold rating asset manager stock blk h chars,0.027777777777777776,0.027777777777777776,0.1,https://www.etfdailynews.com/2024/12/31/blackrock-nyseblk-coverage-initiated-at-stocknews-com/,2024-12-31T08:00:51Z,ETF Daily News
2024-12-31,BLK,BlackRock,A standoff between BlackRock and the FDIC is dragging into 2025,article clash blackrock blk federal deposit insurance corporation fdic money managers holdings us banks play waning days president joe chars,0.0,0.02857142857142857,0.0,https://biztoc.com/x/6164d2f6a3a918e4,2024-12-31T16:55:40Z,Biztoc.com
2024-12-31,BLK,BlackRock,A standoff between BlackRock and FDIC is dragging into 2025,clash blackrock blk fdic money managers holdings us banks play waning days president joe bidens administration fdic asked blackrock chars,0.0,0.05405405405405406,0.0,https://biztoc.com/x/dc82deada8a0aaa1,2024-12-31T16:11:29Z,Biztoc.com
2024-12-31,BA,Boeing,Boeing on track to be 2024's biggest loser in Dow Jones Index,reuters u planemaker boeing ba track biggest loser dow jones index tumbling bounced one crisis another rival airbus rose chars,0.0,0.025,0.6,https://finance.yahoo.com/news/boeing-track-2024s-biggest-loser-191930308.html,2024-12-31T19:19:30Z,Yahoo Entertainment
2024-12-31,BA,Boeing,The Boeing Company (NYSE:BA) Sees Significant Increase in Short Interest,boeing company nyse ba get free report target significant increase short interest month december december th short interest totalling chars,0.0,0.02857142857142857,0.19375,https://www.etfdailynews.com/2024/12/31/the-boeing-company-nyseba-sees-significant-increase-in-short-interest/,2024-12-31T06:28:43Z,ETF Daily News
2024-12-31,BWA,BorgWarner,BorgWarner Inc. (NYSE:BWA) Short Interest Up 9.7% in December,borgwarner inc nyse bwa get free report recipient significant growth short interest month december december th short interest totalling chars,0.0,0.029411764705882353,0.19375,https://www.etfdailynews.com/2024/12/31/borgwarner-inc-nysebwa-short-interest-up-9-7-in-december/,2024-12-31T13:22:48Z,ETF Daily News
2024-12-31,BSX,Boston Scientific,Boston Scientific price target raised to $101 from $97 at BTIG,article btig analyst marie thibault raised firms price target boston scientific bsx keeps buy rating shares part broader research note updating chars,0.0,0.05263157894736842,0.0,https://biztoc.com/x/83891032dad6b3ae,2024-12-31T12:19:15Z,Biztoc.com
2024-12-31,BMY,Bristol Myers Squibb,2 High-Yield Dividend Stocks to Buy Early in 2025,healthcare sector long sanctuary income investors seeking stability growth within realm bristol myers squibb nyse bmy merck amp co nyse mrk stand th chars,0.0,0.029411764705882353,-0.05,https://biztoc.com/x/f76c7c046a8cb64f,2024-12-31T13:47:32Z,Biztoc.com
2024-12-31,AVGO,Broadcom,Broadcom (NASDAQ:AVGO) Shares Down 3.1% After Insider Selling,broadcom inc nasdaq avgo get free report shares dropped monday following insider selling activity company traded low last traded approximately chars,0.0,0.03125,0.0,https://www.etfdailynews.com/2024/12/31/broadcom-nasdaqavgo-shares-down-3-1-after-insider-selling/,2024-12-31T06:49:02Z,ETF Daily News
2024-12-31,BRO,Brown & Brown,Brown & Brown (NYSE:BRO) Share Price Passes Above Two Hundred Day Moving Average – Should You Sell?,brown amp brown inc nyse bro get free report shares crossed two hundred day moving average trading monday stock two hundred day moving average chars,0.0,0.02631578947368421,0.03333333333333333,https://www.etfdailynews.com/2024/12/31/brown-brown-nysebro-share-price-passes-above-two-hundred-day-moving-average-should-you-sell/,2024-12-31T09:06:58Z,ETF Daily News
2024-12-31,CPT,Camden Property Trust,JPMorgan Chase & Co. Has $217.68 Million Stock Holdings in Camden Property Trust (NYSE:CPT),jpmorgan chase amp co decreased stake shares camden property trust nyse cpt free report rd quarter holdings channel reports firm owned shares chars,0.0,0.08571428571428572,-0.06666666666666667,https://www.etfdailynews.com/2024/12/31/jpmorgan-chase-co-has-217-68-million-stock-holdings-in-camden-property-trust-nysecpt/,2024-12-31T08:55:01Z,ETF Daily News
2024-12-31,CAH,Cardinal Health,"Cardinal Health, Inc. (NYSE:CAH) to Issue Quarterly Dividend of $0.51",cardinal health inc nyse cah get free report declared quarterly dividend tuesday november th rtt news reports shareholders record thursday january nd paid dividend chars,0.0,0.029411764705882353,0.4,https://www.etfdailynews.com/2024/12/31/cardinal-health-inc-nysecah-to-issue-quarterly-dividend-of-0-51/,2024-12-31T12:06:59Z,ETF Daily News
2024-12-31,CAT,Caterpillar Inc.,Rep. Marjorie Taylor Greene Purchases Shares of Caterpillar Inc. (NYSE:CAT),representative marjorie taylor greene r georgia recently bought shares caterpillar inc nyse cat filing disclosed december th representative disclosed bought betw chars,0.0,0.06896551724137931,0.0,https://www.etfdailynews.com/2024/12/31/rep-marjorie-taylor-greene-purchases-shares-of-caterpillar-inc-nysecat/,2024-12-31T08:12:46Z,ETF Daily News
2024-12-31,CBOE,Cboe Global Markets,How Psychology Will Likely Drive The Trading Of Options In 2025,trading bell amp p options pit cboe global markets exchange chicago illinois us thursday nov federal reserve cut benchmark lending rate qu chars,0.02631578947368421,0.07894736842105263,0.0,https://www.forbes.com/sites/hershshefrin/2024/12/31/how-psychology-will-likely-drive-the-trading-of-options-in-2025/,2024-12-31T19:23:42Z,Forbes
2024-12-31,CDW,CDW,JPMorgan Chase & Co. Reduces Holdings in CDW Co. (NASDAQ:CDW),jpmorgan chase amp co cut holdings cdw co nasdaq cdw free report rd quarter according company recent filing securities exchange commis chars,0.02702702702702703,0.02702702702702703,0.2,https://www.etfdailynews.com/2024/12/31/jpmorgan-chase-co-reduces-holdings-in-cdw-co-nasdaqcdw/,2024-12-31T08:57:10Z,ETF Daily News
2024-12-31,SCHW,Charles Schwab Corporation,Charles Schwab (NYSE:SCHW) Shares Cross Above Two Hundred Day Moving Average – Here’s Why,charles schwab co nyse schw get free report shares crossed day moving average trading monday stock day moving average traded high chars,0.0,0.05263157894736842,0.065,https://www.etfdailynews.com/2024/12/31/charles-schwab-nyseschw-shares-cross-above-two-hundred-day-moving-average-heres-why/,2024-12-31T08:20:50Z,ETF Daily News
2024-12-31,CMG,Chipotle Mexican Grill,"CMG DEADLINE ALERT: ROSEN, A TOP-RANKED LAW FIRM, Encourages Chipotle Mexican Grill, Inc. Investors with Losses in Excess of $100K to Secure Counsel Before Important Deadline in Securities Class Actio",new york new york newsfile corp december rosen law firm global investor rights law firm reminds purchasers common stock chipotle mexican grill inc nyse nyse cmg chars,0.0,0.05714285714285714,-0.061038961038961045,https://www.investing.com/news/press-releases/cmg-deadline-alert-rosen-a-topranked-law-firm-encourages-chipotle-mexican-grill-inc-investors-with-losses-in-excess-of-100k-to-secure-counsel-before-important-deadline-in-securities-class-actio-93CH-3792217,2024-12-31T04:36:03Z,Investing.com
2024-12-31,CSCO,Cisco,Cisco Systems (NASDAQ:CSCO) Stock Price Passes Above Two Hundred Day Moving Average – Should You Sell?,cisco systems inc nasdaq csco get free report shares crossed two hundred day moving average trading monday stock two hundred day moving average tra chars,0.0,0.02702702702702703,0.03333333333333333,https://www.etfdailynews.com/2024/12/31/cisco-systems-nasdaqcsco-stock-price-passes-above-two-hundred-day-moving-average-should-you-sell/,2024-12-31T08:14:54Z,ETF Daily News
2024-12-31,C,Citigroup,Is Citigroup Inc. (C) the Best Dividend Stock of 2024?,recently compiled list top dividend stocks article going take look citigroup inc nyse c stands dividend stocks macroeconom chars,0.0,0.02702702702702703,0.25,https://finance.yahoo.com/news/citigroup-inc-c-best-dividend-104703321.html,2024-12-31T10:47:03Z,Yahoo Entertainment
2024-12-31,C,Citigroup,Citigroup Inc. (NYSE:C) Short Interest Up 9.8% in December,citigroup inc nyse c get free report saw large increase short interest december december th short interest totalling shares increase n chars,0.0,0.027777777777777776,0.15357142857142858,https://www.etfdailynews.com/2024/12/31/citigroup-inc-nysec-short-interest-up-9-8-in-december/,2024-12-31T13:22:49Z,ETF Daily News
2024-12-31,CME,CME Group,What's Next for Global Monetary Policy?,erik norland cme groupat glance lingering core inflation complicating central banks efforts balance growth inflation risks futures curves suggest rate cuts could ahead chars,0.030303030303030304,0.030303030303030304,0.0,https://biztoc.com/x/cf94a936594b5075,2024-12-31T01:53:00Z,Biztoc.com
2024-12-31,CTSH,Cognizant,Cognizant Technology Solutions (NASDAQ:CTSH) Stock Passes Above 200-Day Moving Average – What’s Next?,cognizant technology solutions co nasdaq ctsh get free report stock price passed day moving average trading monday stock day moving average chars,0.0,0.029411764705882353,0.03333333333333333,https://www.etfdailynews.com/2024/12/31/cognizant-technology-solutions-nasdaqctsh-stock-passes-above-200-day-moving-average-whats-next/,2024-12-31T08:14:55Z,ETF Daily News
2024-12-31,ED,Consolidated Edison,"JPMorgan Chase & Co. Acquires 82,985 Shares of Consolidated Edison, Inc. (NYSE:ED)",jpmorgan chase amp co grew holdings consolidated edison inc nyse ed free report third quarter according company recent f filing securitie chars,0.0,0.027777777777777776,0.13333333333333333,https://www.etfdailynews.com/2024/12/31/jpmorgan-chase-co-acquires-82985-shares-of-consolidated-edison-inc-nyseed/,2024-12-31T08:51:13Z,ETF Daily News
2024-12-31,CTRA,Coterra,Analysts Set Coterra Energy Inc. (NYSE:CTRA) PT at $32.53,shares coterra energy inc nyse ctra get free report earned consensus rating moderate buy nineteen brokerages currently covering firm marketbeat ratings repo chars,0.0,0.030303030303030304,0.05,https://www.etfdailynews.com/2024/12/31/analysts-set-coterra-energy-inc-nysectra-pt-at-32-53/,2024-12-31T07:26:56Z,ETF Daily News
2024-12-31,CRWD,CrowdStrike,"CrowdStrike's Outage Put It to the Test, but Now the Company Faces an Even Bigger Challenge",doozy year cybersecurity company crowdstrike nasdaq crwd first six months year crowdstrike stock rocketed upward however vast majority thes chars,0.0,0.058823529411764705,0.125,https://biztoc.com/x/d231df332c0023aa,2024-12-31T10:52:11Z,Biztoc.com
2024-12-31,CRWD,CrowdStrike,"CrowdStrike's Outage Put It to the Test, but Now the Company Faces an Even Bigger Challenge",article doozy year cybersecurity company crowdstrike nasdaq crwd first six months year crowdstrike stock rocketed upward however vast chars,0.0,0.058823529411764705,0.125,https://biztoc.com/x/f6f9e29fcb1081f7,2024-12-31T10:40:43Z,Biztoc.com
2024-12-31,CRWD,CrowdStrike,"Brokerages Set CrowdStrike Holdings, Inc. (NASDAQ:CRWD) PT at $364.25",crowdstrike holdings inc nasdaq crwd get free report received consensus rating moderate buy forty three research firms currently covering firm marketbeat ratin chars,0.0,0.03225806451612903,0.05,https://www.etfdailynews.com/2024/12/31/brokerages-set-crowdstrike-holdings-inc-nasdaqcrwd-pt-at-364-25/,2024-12-31T07:26:53Z,ETF Daily News
