Date,Ticker,Company_Name,Title,Cleaned_Content,Density_Ticker,Density_Company,Sentiment,Url,PublishedAt,Source
2025-01-15,CAG,Conagra Brands,"Capital Investment Advisors LLC Sells 1,811 Shares of Conagra Brands, Inc. (NYSE:CAG)",capital investment advisors llc cut holdings shares conagra brands inc nyse cag free report th quarter holdings channel reports institutional investor owned chars,0.0,0.030303030303030304,0.4,https://www.etfdailynews.com/2025/01/15/capital-investment-advisors-llc-sells-1811-shares-of-conagra-brands-inc-nysecag/,2025-01-15T09:04:54Z,ETF Daily News
2025-01-15,CAG,Conagra Brands,"Wedmont Private Capital Makes New $702,000 Investment in Conagra Brands, Inc. (NYSE:CAG)",wedmont private capital purchased new stake conagra brands inc nyse cag free report fourth quarter holdingschannel reports firm purchased shares company stock chars,0.0,0.03125,0.06727272727272728,https://www.etfdailynews.com/2025/01/15/wedmont-private-capital-makes-new-702000-investment-in-conagra-brands-inc-nysecag/,2025-01-15T09:52:51Z,ETF Daily News
2025-01-15,COP,ConocoPhillips,Claro Advisors LLC Decreases Stock Holdings in ConocoPhillips (NYSE:COP),claro advisors llc decreased holdings conocophillips nyse cop free report fourth quarter holdings channel com reports institutional investor owned shares chars,0.0,0.03225806451612903,0.0,https://www.etfdailynews.com/2025/01/15/claro-advisors-llc-decreases-stock-holdings-in-conocophillips-nysecop/,2025-01-15T09:56:56Z,ETF Daily News
2025-01-15,COP,ConocoPhillips,ConocoPhillips (NYSE:COP) Given New $139.00 Price Target at Truist Financial,conocophillips nyse cop get free report price target lifted equities research analysts truist financial research report issued clients investors chars,0.0,0.029411764705882353,0.2,https://www.etfdailynews.com/2025/01/15/conocophillips-nysecop-given-new-139-00-price-target-at-truist-financial/,2025-01-15T07:00:55Z,ETF Daily News
2025-01-15,ED,Consolidated Edison,"Consolidated Edison, Inc. (NYSE:ED) Shares Bought by Wedmont Private Capital",wedmont private capital lifted position shares consolidated edison inc nyse ed free report fourth quarter according recent form f filing se chars,0.0,0.02857142857142857,0.1,https://www.etfdailynews.com/2025/01/15/consolidated-edison-inc-nyseed-shares-bought-by-wedmont-private-capital/,2025-01-15T09:14:58Z,ETF Daily News
2025-01-15,STZ,Constellation Brands,Morgan Stanley Has Lowered Expectations for Constellation Brands (NYSE:STZ) Stock Price,constellation brands nyse stz get free report price target cut analysts morgan stanley research note issued investors monday benzinga reports chars,0.0,0.058823529411764705,0.4,https://www.etfdailynews.com/2025/01/15/morgan-stanley-has-lowered-expectations-for-constellation-brands-nysestz-stock-price/,2025-01-15T06:44:56Z,ETF Daily News
2025-01-15,STZ,Constellation Brands,Evercore ISI Lowers Constellation Brands (NYSE:STZ) Price Target to $250.00,constellation brands nyse stz get free report target price dropped equities research analysts evercore isi research note issued monday benzinga repor chars,0.0,0.06060606060606061,0.4,https://www.etfdailynews.com/2025/01/15/evercore-isi-lowers-constellation-brands-nysestz-price-target-to-250-00/,2025-01-15T09:48:59Z,ETF Daily News
2025-01-15,STZ,Constellation Brands,Constellation Brands (NYSE:STZ) Given New $245.00 Price Target at Piper Sandler,constellation brands nyse stz get free report price objective cut piper sandler research note issued investors monday benzinga reports firm pres chars,0.0,0.058823529411764705,0.06666666666666667,https://www.etfdailynews.com/2025/01/15/constellation-brands-nysestz-given-new-245-00-price-target-at-piper-sandler/,2025-01-15T07:40:51Z,ETF Daily News
2025-01-15,CSGP,CoStar Group,StockNews.com Downgrades CoStar Group (NASDAQ:CSGP) to Sell,costar group nasdaq csgp get free report downgraded research analysts stocknews com hold rating sell rating research report issued clients investors wedne chars,0.0,0.05714285714285714,0.4,https://www.etfdailynews.com/2025/01/15/stocknews-com-downgrades-costar-group-nasdaqcsgp-to-sell/,2025-01-15T07:22:43Z,ETF Daily News
2025-01-15,CSGP,CoStar Group,"Czech National Bank Has $6.36 Million Stock Holdings in CoStar Group, Inc. (NASDAQ:CSGP)",czech national bank increased stake shares costar group inc nasdaq csgp free report th quarter according company recent f filing sec chars,0.0,0.02702702702702703,0.10000000000000002,https://www.etfdailynews.com/2025/01/15/czech-national-bank-has-6-36-million-stock-holdings-in-costar-group-inc-nasdaqcsgp/,2025-01-15T08:30:58Z,ETF Daily News
2025-01-15,COST,Costco,Costco is bucking the DEI retreat,story time many large u companies scaling back diversity equity inclusion dei efforts costco standing firm commitment initiatives ceo ro chars,0.0,0.02857142857142857,0.12857142857142856,https://qz.com/costco-dei-trend-mcdonalds-meta-google-ford-1851739985,2025-01-15T16:17:00Z,Quartz India
2025-01-15,COST,Costco,The cost of Costco memberships around the world compared to Canada in 2025,costco canada drew mixed reactions increased membership fees much canadians pay compared shoppers worldwide according company december sales report chars,0.0,0.030303030303030304,0.1,https://www.blogto.com/city/2025/01/costco-memberships-cost-around-world-compared-canada-2025/,2025-01-15T19:59:39Z,blogTO
2025-01-15,COST,Costco,Rep. James Comer Purchases Shares of Costco Wholesale Co. (NASDAQ:COST),representative james comer r kentucky recently bought shares costco wholesale co nasdaq cost filing disclosed january th representative disclosed bought chars,0.0,0.03333333333333333,0.0,https://www.etfdailynews.com/2025/01/15/rep-james-comer-purchases-shares-of-costco-wholesale-co-nasdaqcost/,2025-01-15T08:36:49Z,ETF Daily News
2025-01-15,COST,Costco,How to join Costco for less than your friends,may earn revenue products available page participate affiliate programs learn know someone brags little much costco membership chars,0.0,0.02702702702702703,0.1375,https://www.popsci.com/sponsored-content/costco-gold-star-member-plus-digital-shop-card-sponsored-deal/,2025-01-15T12:00:00Z,Popular Science
2025-01-15,CTRA,Coterra,Coterra Energy (NYSE:CTRA) Reaches New 52-Week High After Analyst Upgrade,coterra energy inc nyse ctra get free report stock price hit new week high mid day trading tuesday truist financial raised price target stock chars,0.0,0.027777777777777776,0.13927272727272727,https://www.etfdailynews.com/2025/01/15/coterra-energy-nysectra-reaches-new-52-week-high-after-analyst-upgrade/,2025-01-15T06:12:49Z,ETF Daily News
2025-01-15,CTRA,Coterra,Coterra Energy Inc. (NYSE:CTRA) Shares Sold by Capital Investment Advisors LLC,capital investment advisors llc lowered holdings shares coterra energy inc nyse ctra free report fourth quarter according company recent form f fil chars,0.0,0.027777777777777776,0.13333333333333333,https://www.etfdailynews.com/2025/01/15/coterra-energy-inc-nysectra-shares-sold-by-capital-investment-advisors-llc/,2025-01-15T09:26:54Z,ETF Daily News
2025-01-15,CRWD,CrowdStrike,"CrowdStrike Holdings, Inc. (NASDAQ:CRWD) Shares Acquired by Capital Investment Advisors LLC",capital investment advisors llc boosted stake shares crowdstrike holdings inc nasdaq crwd free report th quarter holdings channel com reports firm owned chars,0.0,0.03125,0.1,https://www.etfdailynews.com/2025/01/15/crowdstrike-holdings-inc-nasdaqcrwd-shares-acquired-by-capital-investment-advisors-llc/,2025-01-15T08:51:00Z,ETF Daily News
2025-01-15,CRWD,CrowdStrike,"Claro Advisors LLC Reduces Stock Position in CrowdStrike Holdings, Inc. (NASDAQ:CRWD)",claro advisors llc reduced holdings crowdstrike holdings inc nasdaq crwd free report fourth quarter according company recent f filing se chars,0.0,0.02857142857142857,0.13333333333333333,https://www.etfdailynews.com/2025/01/15/claro-advisors-llc-reduces-stock-position-in-crowdstrike-holdings-inc-nasdaqcrwd/,2025-01-15T09:24:59Z,ETF Daily News
2025-01-15,CCI,Crown Castle,"Salem Investment Counselors Inc. Has $106,000 Stake in Crown Castle Inc. (NYSE:CCI)",salem investment counselors inc grew holdings shares crown castle inc nyse cci free report fourth quarter according company recent filing chars,0.0,0.05555555555555555,0.13333333333333333,https://www.etfdailynews.com/2025/01/15/salem-investment-counselors-inc-has-106000-stake-in-crown-castle-inc-nysecci/,2025-01-15T10:12:47Z,ETF Daily News
2025-01-15,CCI,Crown Castle,"Moody National Bank Trust Division Has $755,000 Stake in Crown Castle Inc. (NYSE:CCI)",moody national bank trust division reduced position shares crown castle inc nyse cci free report th quarter according company recent f filing chars,0.0,0.05405405405405406,0.2,https://www.etfdailynews.com/2025/01/15/moody-national-bank-trust-division-has-755000-stake-in-crown-castle-inc-nysecci/,2025-01-15T10:46:48Z,ETF Daily News
2025-01-15,CCI,Crown Castle,Crown Castle (NYSE:CCI) Upgraded by Barclays to Overweight Rating,crown castle nyse cci get free report upgraded analysts barclays equal weight rating overweight rating report released monday marketbeat reports firm pre chars,0.0,0.05714285714285714,0.06666666666666667,https://www.etfdailynews.com/2025/01/15/crown-castle-nysecci-upgraded-by-barclays-to-overweight-rating/,2025-01-15T09:16:53Z,ETF Daily News
2025-01-15,CSX,CSX Corporation,CSX Co. (NASDAQ:CSX) Shares Acquired by Cooper Financial Group,cooper financial group lifted position csx co nasdaq csx free report th quarter holdingschannel reports firm owned shares transportation company stoc chars,0.030303030303030304,0.030303030303030304,0.06666666666666667,https://www.etfdailynews.com/2025/01/15/csx-co-nasdaqcsx-shares-acquired-by-cooper-financial-group/,2025-01-15T09:16:53Z,ETF Daily News
2025-01-15,CVS,CVS Health,Is CVS Health (CVS) the Hottest Large-Cap Stock So Far in 2025?,recently published list hottest large cap stocks far article going take look cvs health corporation nyse cvs stands hottest large chars,0.02702702702702703,0.05405405405405406,0.13214285714285715,https://finance.yahoo.com/news/cvs-health-cvs-hottest-large-194319076.html,2025-01-15T19:43:19Z,Yahoo Entertainment
2025-01-15,CVS,CVS Health,"Wednesday, January 15, 2025",ftc finds top three pbms took billions inflated drug costs roughly five year span cvs health cigna unitedhealth benefited increasing prices generic drugs th chars,0.029411764705882353,0.029411764705882353,0.13333333333333333,https://kffhealthnews.org/morning-briefing/wednesday-january-15-2025/,2025-01-15T13:55:48Z,Kffhealthnews.org
2025-01-15,DHR,Danaher Corporation,Capital Investment Advisors LLC Grows Stock Position in Danaher Co. (NYSE:DHR),capital investment advisors llc boosted position shares danaher co nyse dhr free report th quarter holdings channel reports institutional investor owned chars,0.0,0.030303030303030304,0.4,https://www.etfdailynews.com/2025/01/15/capital-investment-advisors-llc-grows-stock-position-in-danaher-co-nysedhr/,2025-01-15T09:04:56Z,ETF Daily News
2025-01-15,DRI,Darden Restaurants,"Darden Restaurants, Inc. (NYSE:DRI) Shares Purchased by Wealth Enhancement Advisory Services LLC",wealth enhancement advisory services llc grew position shares darden restaurants inc nyse dri free report th quarter according recent disclosure chars,0.0,0.02857142857142857,0.2,https://www.etfdailynews.com/2025/01/15/darden-restaurants-inc-nysedri-shares-purchased-by-wealth-enhancement-advisory-services-llc/,2025-01-15T08:43:00Z,ETF Daily News
2025-01-15,DE,Deere & Company,"Claro Advisors LLC Has $430,000 Stock Holdings in Deere & Company (NYSE:DE)",claro advisors llc decreased position deere amp company nyse de free report th quarter according company recent filing sec fund chars,0.0,0.08108108108108109,-0.025,https://www.etfdailynews.com/2025/01/15/claro-advisors-llc-has-430000-stock-holdings-in-deere-company-nysede/,2025-01-15T09:23:10Z,ETF Daily News
2025-01-15,DELL,Dell Technologies,Applied Digital Is Building Datacenters In North Dakota For The Next Generation of AI And Computing,sponsored dell technologies demand ai powered tools high performance computing reaching new heights story appeared youtube com,0.043478260869565216,0.043478260869565216,0.1481818181818182,https://biztoc.com/x/4a25f3a06861c0d3,2025-01-15T18:08:57Z,Biztoc.com
2025-01-15,DELL,Dell Technologies,UKG and Dell Technologies Launch Solar Community Hub in Mexico in Collaboration With TecnolÃ³gico de Monterrey and Computer Aid International,key points ul li effort create equitable opportunity resourced communities latest dell technologies nyse dell solar community hub sponsored ukg provide education chars,0.03571428571428571,0.07142857142857142,0.25,https://www.investing.com/news/press-releases/ukg-and-dell-technologies-launch-solar-community-hub-in-mexico-in-collaboration-with-tecnolagico-de-monterrey-and-computer-aid-international-93CH-3815500,2025-01-15T23:32:03Z,Investing.com
2025-01-15,DAL,Delta Air Lines,Delta Air Lines (NYSE:DAL) Raised to “Buy” at StockNews.com,delta air lines nyse dal get free report upgraded research analysts stocknews com hold rating buy rating report issued monday several research firms chars,0.0,0.08333333333333333,0.2,https://www.etfdailynews.com/2025/01/15/delta-air-lines-nysedal-raised-to-buy-at-stocknews-com/,2025-01-15T07:52:58Z,ETF Daily News
2025-01-15,DVN,Devon Energy,Devon Energy (NYSE:DVN) Price Target Lowered to $42.00 at Truist Financial,devon energy nyse dvn get free report target price lowered equities research analysts truist financial research note issued investors monday benzing chars,0.0,0.058823529411764705,0.2,https://www.etfdailynews.com/2025/01/15/devon-energy-nysedvn-price-target-lowered-to-42-00-at-truist-financial/,2025-01-15T07:40:49Z,ETF Daily News
2025-01-15,FANG,Diamondback Energy,"Czech National Bank Raises Stake in Diamondback Energy, Inc. (NASDAQ:FANG)",czech national bank increased stake diamondback energy inc nasdaq fang free report th quarter according recent filing securities exchange co chars,0.0,0.029411764705882353,0.2,https://www.etfdailynews.com/2025/01/15/czech-national-bank-raises-stake-in-diamondback-energy-inc-nasdaqfang/,2025-01-15T09:04:56Z,ETF Daily News
2025-01-15,FANG,Diamondback Energy,"Diamondback Energy (NASDAQ:FANG) Stock Price Expected to Rise, Truist Financial Analyst Says",diamondback energy nasdaq fang get free report price target hoisted investment analysts truist financial report released monday benzinga reports chars,0.0,0.0625,0.2,https://www.etfdailynews.com/2025/01/15/diamondback-energy-nasdaqfang-stock-price-expected-to-rise-truist-financial-analyst-says/,2025-01-15T07:40:49Z,ETF Daily News
2025-01-15,DLR,Digital Realty,"Brookstone Capital Management Acquires 2,951 Shares of Digital Realty Trust, Inc. (NYSE:DLR)",brookstone capital management raised stake digital realty trust inc nyse dlr free report fourth quarter according company recent form f filing w chars,0.0,0.05714285714285714,0.1,https://www.etfdailynews.com/2025/01/15/brookstone-capital-management-acquires-2951-shares-of-digital-realty-trust-inc-nysedlr/,2025-01-15T09:00:58Z,ETF Daily News
2025-01-15,DLR,Digital Realty,"Wedmont Private Capital Buys 360 Shares of Digital Realty Trust, Inc. (NYSE:DLR)",wedmont private capital increased position digital realty trust inc nyse dlr free report th quarter according company recent disclosure chars,0.0,0.05714285714285714,0.1,https://www.etfdailynews.com/2025/01/15/wedmont-private-capital-buys-360-shares-of-digital-realty-trust-inc-nysedlr/,2025-01-15T10:31:05Z,ETF Daily News
2025-01-15,DFS,Discover Financial,Czech National Bank Grows Position in Discover Financial Services (NYSE:DFS),czech national bank lifted holdings shares discover financial services nyse dfs th quarter according recent form f filing securities exchange c chars,0.0,0.05714285714285714,0.0,https://www.etfdailynews.com/2025/01/15/czech-national-bank-grows-position-in-discover-financial-services-nysedfs/,2025-01-15T09:11:00Z,ETF Daily News
2025-01-15,DFS,Discover Financial,Discover Financial Stock Hits All-Time High at $188.35,discover financial services nyse dfs stock soared time high week reaching price level financial giant market capitalization billion known chars,0.0,0.09090909090909091,0.04,https://www.investing.com/news/company-news/discover-financial-stock-hits-alltime-high-at-18835-93CH-3814632,2025-01-15T15:20:01Z,Investing.com
2025-01-15,DFS,Discover Financial,"Aprio Wealth Management LLC Makes New $225,000 Investment in Discover Financial Services (NYSE:DFS)",aprio wealth management llc bought new position shares discover financial services nyse dfs fourth quarter according company recent disclosure securities chars,0.0,0.06060606060606061,0.03409090909090909,https://www.etfdailynews.com/2025/01/15/aprio-wealth-management-llc-makes-new-225000-investment-in-discover-financial-services-nysedfs/,2025-01-15T08:30:55Z,ETF Daily News
2025-01-15,DFS,Discover Financial,"2,920 Shares in Discover Financial Services (NYSE:DFS) Bought by Fiduciary Alliance LLC",fiduciary alliance llc bought new position shares discover financial services nyse dfs th quarter according recent filing securities amp exchange commiss chars,0.0,0.0625,0.04545454545454545,https://www.etfdailynews.com/2025/01/15/2920-shares-in-discover-financial-services-nysedfs-bought-by-fiduciary-alliance-llc/,2025-01-15T10:34:54Z,ETF Daily News
2025-01-15,DFS,Discover Financial,Discover Financial Services (NYSE:DFS) Raised to Buy at UBS Group,discover financial services nyse dfs upgraded equities researchers ubs group neutral rating buy rating research note issued investors monday marketbeat reports chars,0.0,0.06060606060606061,0.0,https://www.etfdailynews.com/2025/01/15/discover-financial-services-nysedfs-raised-to-buy-at-ubs-group/,2025-01-15T10:00:58Z,ETF Daily News
2025-01-15,DFS,Discover Financial,"InterPayments appoints former Discover Financial CEO and president, Roger Hochschild, to board",interpayments leader compliant managed surcharge solutions today announced appointment former ceo president discover financial services nyse dfs roger hochschild bo chars,0.0,0.06666666666666667,0.0,https://www.finextra.com/pressarticle/103882/interpayments-appoints-former-discover-financial-ceo-and-president-roger-hochschild-to-board,2025-01-15T15:54:00Z,Finextra
2025-01-15,DG,Dollar General,Moody National Bank Trust Division Grows Position in Dollar General Co. (NYSE:DG),moody national bank trust division grew stake dollar general co nyse dg free report fourth quarter holdingschannel com reports institutional investor owned shar chars,0.0,0.0625,0.15000000000000002,https://www.etfdailynews.com/2025/01/15/moody-national-bank-trust-division-grows-position-in-dollar-general-co-nysedg/,2025-01-15T09:03:01Z,ETF Daily News
2025-01-15,DOV,Dover Corporation,Eastern Bank Sells 133 Shares of Dover Co. (NYSE:DOV),eastern bank lessened stake shares dover co nyse dov free report th quarter according recent disclosure sec institutional investor owned chars,0.0,0.027777777777777776,0.10000000000000002,https://www.etfdailynews.com/2025/01/15/eastern-bank-sells-133-shares-of-dover-co-nysedov/,2025-01-15T09:24:57Z,ETF Daily News
2025-01-15,DOV,Dover Corporation,Dover (NYSE:DOV) Stock Acquired Rep. James Comer,representative james comer r kentucky recently bought shares dover co nyse dov filing disclosed january th representative disclosed bought chars,0.0,0.03225806451612903,0.0,https://www.etfdailynews.com/2025/01/15/dover-nysedov-stock-acquired-rep-james-comer/,2025-01-15T08:04:45Z,ETF Daily News
2025-01-15,DUK,Duke Energy,Duke Energy Co. (NYSE:DUK) Shares Acquired by Moody National Bank Trust Division,moody national bank trust division raised stake duke energy co nyse duk free report th quarter according recent form f filing sec institut chars,0.0,0.05405405405405406,0.10000000000000002,https://www.etfdailynews.com/2025/01/15/duke-energy-co-nyseduk-shares-acquired-by-moody-national-bank-trust-division/,2025-01-15T09:14:57Z,ETF Daily News
2025-01-15,DD,DuPont,"Fiduciary Alliance LLC Makes New $249,000 Investment in DuPont de Nemours, Inc. (NYSE:DD)",fiduciary alliance llc bought new position dupont de nemours inc nyse dd free report th quarter according recent disclosure sec firm bought shares chars,0.0,0.02702702702702703,0.04727272727272728,https://www.etfdailynews.com/2025/01/15/fiduciary-alliance-llc-makes-new-249000-investment-in-dupont-de-nemours-inc-nysedd/,2025-01-15T11:10:49Z,ETF Daily News
2025-01-15,EBAY,eBay,EBay Roundup,put member ebay partner network means ebay links affiliate links click one ebay links purchase something earn small commission chars,0.05,0.05,-0.25,https://putthison.com/ebay-roundup-612/,2025-01-15T08:05:03Z,Putthison.com
2025-01-15,EBAY,eBay,"Refurbished: Apple MacBook Pro M3 Pro Laptop: 16.2"" XDR, 512GB SSD, 36GB RAM $1769 + Free S/H",guaranteecellular via ebay refurbished excellent condition apple macbook pro pro laptop space black model mrw sale extra w coupon code offgcmpro app chars,0.03125,0.03125,0.2777777777777778,https://slickdeals.net/f/18056910-refurb-w-1-year-warranty-16-apple-macbook-pro-laptop-m3-pro-3024x1964-36gb-ram-512gb-ssd-1-769-free-s-h-at-guaranteecellular-via-ebay?utm_source=rss&utm_content=fp&utm_medium=RSS2,2025-01-15T07:55:40Z,Slickdeals.net
2025-01-15,EBAY,eBay,4.2-Quart bella PRO Touchscreen Air Fryer (Stainless Steel) $25 + Free Shipping,best buy via ebay quart bella pro touchscreen air fryer stainless steel shipping free best buy quart bella pro touchscreen air fryer stainless steel shi chars,0.030303030303030304,0.030303030303030304,0.56,https://slickdeals.net/f/18057963-4-2-quart-bella-pro-touchscreen-air-fryer-stainless-steel-24-99-free-shipping?utm_source=rss&utm_content=fp&utm_medium=RSS2,2025-01-15T17:40:54Z,Slickdeals.net
2025-01-15,EBAY,eBay,eBay - ECO-WORTHY 4Pack 48V 100Ah 20.48KWh Bluetooth LiFePO4 Lithium Battery for UPS $3049.99,upgrade energy storage premium bluetooth enabled v ah lifepo battery pack eco worthy originally priced snag ebay appl chars,0.030303030303030304,0.030303030303030304,0.35416666666666663,https://www.dealcatcher.com/deals/household/tools/eco-worthy-bluetooth-lithium-battery-for-ups-998378356,2025-01-15T14:37:01Z,Dealcatcher.com
2025-01-15,EBAY,eBay,eBay acquires Caramel to expedite vehicle transactions,ebay inc making acquisition deal caramel fast track vehicle sales marketplace company signed definitive agreement acquire caramel online platform simplifies chars,0.03125,0.03125,0.2,https://www.digitalcommerce360.com/2025/01/15/ebay-acquisition-caramel-vehicle-transactions/,2025-01-15T21:48:24Z,DigitalCommerce360
2025-01-15,EBAY,eBay,Wedmont Private Capital Acquires 313 Shares of eBay Inc. (NASDAQ:EBAY),wedmont private capital grew holdings shares ebay inc nasdaq ebay free report fourth quarter holdings channel reports firm owned shares e commerce chars,0.029411764705882353,0.029411764705882353,0.05,https://www.etfdailynews.com/2025/01/15/wedmont-private-capital-acquires-313-shares-of-ebay-inc-nasdaqebay/,2025-01-15T09:03:12Z,ETF Daily News
2025-01-15,EBAY,eBay,Analysts Set eBay Inc. (NASDAQ:EBAY) PT at $62.92,shares ebay inc nasdaq ebay get free report given average rating hold twenty seven analysts currently covering company marketbeat ratings reports two chars,0.029411764705882353,0.029411764705882353,0.08333333333333333,https://www.etfdailynews.com/2025/01/15/analysts-set-ebay-inc-nasdaqebay-pt-at-62-92/,2025-01-15T07:06:58Z,ETF Daily News
2025-01-15,EBAY,eBay,eBay Inc. (NASDAQ:EBAY) Shares Bought by Czech National Bank,czech national bank lifted position shares ebay inc nasdaq ebay free report th quarter according recent filing securities exchange commiss chars,0.02857142857142857,0.02857142857142857,0.2,https://www.etfdailynews.com/2025/01/15/ebay-inc-nasdaqebay-shares-bought-by-czech-national-bank/,2025-01-15T10:12:46Z,ETF Daily News
2025-01-15,EBAY,eBay,"eBay (NASDAQ:EBAY) Stock Price Expected to Rise, Morgan Stanley Analyst Says",ebay nasdaq ebay get free report price objective raised analysts morgan stanley note issued investors monday benzinga reports brokerage current chars,0.029411764705882353,0.029411764705882353,0.13333333333333333,https://www.etfdailynews.com/2025/01/15/ebay-nasdaqebay-stock-price-expected-to-rise-morgan-stanley-analyst-says/,2025-01-15T08:29:00Z,ETF Daily News
2025-01-15,EBAY,eBay,CyberPower Systems Value Pro 1600VA / 960W Line Interactive UPS $259 Delivered + Surcharge @ CentreCom,looking ups units dad saw centrecom ups specials moment cheaper bought ebay past around experience ul chars,0.025,0.025,-0.25,https://www.ozbargain.com.au/node/888948,2025-01-15T00:19:36Z,Ozbargain.com.au
2025-01-15,EBAY,eBay,Build Journal: G80 M3 Maldives Blue on Tartufo,went ebay purchased rear seat f tartufo leather factory rear seat directly shipped ind dismantled pulled tartufo leather chars,0.025,0.025,0.1,https://g80.bimmerpost.com/forums/showthread.php?t=2157137,2025-01-15T14:12:37Z,Bimmerpost.com
2025-01-15,ECL,Ecolab,"Fiduciary Alliance LLC Has $211,000 Position in Ecolab Inc. (NYSE:ECL)",fiduciary alliance llc cut position shares ecolab inc nyse ecl free report th quarter holdings channel reports firm owned shares basic materials co chars,0.0,0.027777777777777776,0.06666666666666667,https://www.etfdailynews.com/2025/01/15/fiduciary-alliance-llc-has-211000-position-in-ecolab-inc-nyseecl/,2025-01-15T08:58:54Z,ETF Daily News
2025-01-15,EIX,Edison International,Edison International (NYSE:EIX) Shares Bought by Czech National Bank,czech national bank increased position edison international nyse eix free report th quarter holdingschannel reports institutional investor owned shares chars,0.0,0.0625,0.2,https://www.etfdailynews.com/2025/01/15/edison-international-nyseeix-shares-bought-by-czech-national-bank/,2025-01-15T09:43:02Z,ETF Daily News
