Date,Ticker,Company_Name,Title,Cleaned_Content,Density_Ticker,Density_Company,Sentiment,Url,PublishedAt,Source
2025-01-08,DAL,Delta Air Lines,Delta Air Lines is ditching Lyft for Uber,story members skymiles delta air lines dal loyalty program soon new way earn miles company partnering uber let people build stockpiles chars,0.0,0.07894736842105263,0.13636363636363635,https://qz.com/delta-uber-skymiles-partnership-1851735080,2025-01-08T15:22:00Z,Quartz India
2025-01-08,DAL,Delta Air Lines,Delta wants AI to fix your terrible airport experience,story delta air lines dal message tech world ai isnt silicon valley first ever keynote held las vegass immersive sphere venue delta ceo ed bast chars,0.0,0.10526315789473684,0.25,https://qz.com/delta-wants-ai-to-fix-your-terrible-airport-experience-1851734681,2025-01-08T02:32:00Z,Quartz India
2025-01-08,DAL,Delta Air Lines,Delta Air Lines Sees Unusually High Options Volume (NYSE:DAL),delta air lines inc nyse dal get free report recipient unusual options trading monday stock investors purchased call options company increase chars,0.0,0.05555555555555555,0.30000000000000004,https://www.etfdailynews.com/2025/01/08/delta-air-lines-sees-unusually-high-options-volume-nysedal/,2025-01-08T06:19:00Z,ETF Daily News
2025-01-08,DAL,Delta Air Lines,"Range Financial Group LLC Makes New $363,000 Investment in Delta Air Lines, Inc. (NYSE:DAL)",range financial group llc bought new stake delta air lines inc nyse dal free report th quarter according company recent f filing securities excha chars,0.0,0.05263157894736842,0.1340909090909091,https://www.etfdailynews.com/2025/01/08/range-financial-group-llc-makes-new-363000-investment-in-delta-air-lines-inc-nysedal/,2025-01-08T09:20:55Z,ETF Daily News
2025-01-08,DAL,Delta Air Lines,"Analysts Set Delta Air Lines, Inc. (NYSE:DAL) Target Price at $75.83",shares delta air lines inc nyse dal get free report received average rating buy fourteen brokerages presently covering stock marketbeat ratings reports chars,0.0,0.058823529411764705,0.08333333333333333,https://www.etfdailynews.com/2025/01/08/analysts-set-delta-air-lines-inc-nysedal-target-price-at-75-83/,2025-01-08T08:18:55Z,ETF Daily News
2025-01-08,DLR,Digital Realty,UBS Group Upgrades Digital Realty Trust (NYSE:DLR) to Buy,ubs group upgraded shares digital realty trust nyse dlr free report neutral rating buy rating research note released tuesday marketbeat reports ubs group currently chars,0.0,0.05555555555555555,0.13333333333333333,https://www.etfdailynews.com/2025/01/08/ubs-group-upgrades-digital-realty-trust-nysedlr-to-buy/,2025-01-08T10:23:07Z,ETF Daily News
2025-01-08,DLR,Digital Realty,"First County Bank CT Makes New Investment in Digital Realty Trust, Inc. (NYSE:DLR)",first county bank ct acquired new stake digital realty trust inc nyse dlr free report th quarter according recent f filing securities exchange commi chars,0.0,0.05555555555555555,0.1572727272727273,https://www.etfdailynews.com/2025/01/08/first-county-bank-ct-makes-new-investment-in-digital-realty-trust-inc-nysedlr/,2025-01-08T10:56:44Z,ETF Daily News
2025-01-08,DFS,Discover Financial,Discover Financial Services (NYSE:DFS) Now Covered by Truist Financial,truist financial initiated coverage shares discover financial services nyse dfs report released tuesday benzinga reports firm issued buy rating price objective chars,0.0,0.09375,-0.05,https://www.etfdailynews.com/2025/01/08/discover-financial-services-nysedfs-now-covered-by-truist-financial/,2025-01-08T10:22:47Z,ETF Daily News
2025-01-08,DFS,Discover Financial,Nordea Investment Management AB Has $59.31 Million Position in Discover Financial Services (NYSE:DFS),nordea investment management ab increased position discover financial services nyse dfs free report fourth quarter according company recent f filin chars,0.0,0.06060606060606061,0.1,https://www.etfdailynews.com/2025/01/08/nordea-investment-management-ab-has-59-31-million-position-in-discover-financial-services-nysedfs/,2025-01-08T09:04:55Z,ETF Daily News
2025-01-08,DLTR,Dollar Tree,"Versant Capital Management Inc Makes New $30,000 Investment in Dollar Tree, Inc. (NASDAQ:DLTR)",versant capital management inc bought new stake dollar tree inc nasdaq dltr free report fourth quarter holdings channel com reports firm bought shares company chars,0.0,0.030303030303030304,0.08409090909090909,https://www.etfdailynews.com/2025/01/08/versant-capital-management-inc-makes-new-30000-investment-in-dollar-tree-inc-nasdaqdltr/,2025-01-08T08:47:01Z,ETF Daily News
2025-01-08,DOV,Dover Corporation,Dover Co. (NYSE:DOV) Receives Average Rating of “Moderate Buy” from Analysts,dover co nyse dov get free report assigned average rating moderate buy twelve research firms currently covering firm marketbeat reports four equities res chars,0.0,0.029411764705882353,0.009999999999999998,https://www.etfdailynews.com/2025/01/08/dover-co-nysedov-receives-average-rating-of-moderate-buy-from-analysts/,2025-01-08T07:34:57Z,ETF Daily News
2025-01-08,DUK,Duke Energy,Bath Savings Trust Co Sells 132 Shares of Duke Energy Co. (NYSE:DUK),bath savings trust co lessened holdings shares duke energy co nyse duk free report fourth quarter holdingschannel com reports firm owned shares ut chars,0.0,0.05714285714285714,0.06666666666666667,https://www.etfdailynews.com/2025/01/08/bath-savings-trust-co-sells-132-shares-of-duke-energy-co-nyseduk/,2025-01-08T09:20:52Z,ETF Daily News
2025-01-08,DD,DuPont,"First County Bank CT Sells 1,650 Shares of DuPont de Nemours, Inc. (NYSE:DD)",first county bank ct lessened stake dupont de nemours inc nyse dd free report fourth quarter holdingschannel reports firm owned shares basic materials chars,0.0,0.027777777777777776,0.09,https://www.etfdailynews.com/2025/01/08/first-county-bank-ct-sells-1650-shares-of-dupont-de-nemours-inc-nysedd/,2025-01-08T10:24:51Z,ETF Daily News
2025-01-08,DD,DuPont,"DuPont de Nemours, Inc. (NYSE:DD) Stake Boosted by Bangor Savings Bank",bangor savings bank increased position shares dupont de nemours inc nyse dd free report th quarter according company recent form f filing chars,0.0,0.02631578947368421,0.2,https://www.etfdailynews.com/2025/01/08/dupont-de-nemours-inc-nysedd-stake-boosted-by-bangor-savings-bank/,2025-01-08T09:14:49Z,ETF Daily News
2025-01-08,EMN,Eastman Chemical Company,Everence Capital Management Inc. Acquires New Stake in Eastman Chemical (NYSE:EMN),everence capital management inc purchased new stake eastman chemical nyse emn free report th quarter holdingschannel reports fund purchased shares basic mater chars,0.0,0.0625,0.1787878787878788,https://www.etfdailynews.com/2025/01/08/everence-capital-management-inc-acquires-new-stake-in-eastman-chemical-nyseemn/,2025-01-08T09:00:50Z,ETF Daily News
2025-01-08,ETN,Eaton Corporation,"Diversified Trust Co Sells 1,943 Shares of Eaton Co. plc (NYSE:ETN)",diversified trust co decreased holdings shares eaton co plc nyse etn free report th quarter according company recent form f filing chars,0.0,0.02631578947368421,0.0,https://www.etfdailynews.com/2025/01/08/diversified-trust-co-sells-1943-shares-of-eaton-co-plc-nyseetn/,2025-01-08T09:16:54Z,ETF Daily News
2025-01-08,EBAY,eBay,Meta tests eBay listings in Facebook Marketplace,meta tests ebay listings facebook marketplace meta tests ebay listings facebook marketplace change comes response eus order stop imposing unfair trading conditions mark chars,0.058823529411764705,0.058823529411764705,-0.5,https://www.theverge.com/2025/1/8/24339056/meta-ebay-listings-facebook-marketplace-eu,2025-01-08T15:44:50Z,The Verge
2025-01-08,EBAY,eBay,Meta to test showing eBay listings on Facebook Marketplace,meta said wednesday would launch test germany france united states enable buyers browse listings ebay facebook marketplace complete transaction chars,0.02857142857142857,0.02857142857142857,0.1,https://biztoc.com/x/40c75ef1de7f6076,2025-01-08T12:09:55Z,Biztoc.com
2025-01-08,EBAY,eBay,Meta to test showing eBay listings on Facebook Marketplace,stockholm reuters meta said wednesday would launch test germany france united states enable buyers browse listings ebay nasdaq ebay facebook nasdaq meta chars,0.030303030303030304,0.030303030303030304,0.0,https://www.investing.com/news/economy-news/meta-to-test-showing-ebay-listings-on-facebook-marketplace-3802767,2025-01-08T12:48:28Z,Investing.com
2025-01-08,EBAY,eBay,Facebook Marketplace to display eBay listings to appease EU regulators,meta set start displaying ebay listings facebook marketplace classifieds platform effort appease european regulators back november meta hit million fine chars,0.02857142857142857,0.02857142857142857,0.1388888888888889,https://biztoc.com/x/8e52689aec904680,2025-01-08T15:06:25Z,Biztoc.com
2025-01-08,EBAY,eBay,eBay surges almost 12% on Meta partnership news,shares ebay inc jumped almost trading session wednesday company announced partnership meta platforms inc ebay share soared et sell fo chars,0.02702702702702703,0.02702702702702703,0.0,https://biztoc.com/x/d162e4617493da48,2025-01-08T15:06:26Z,Biztoc.com
2025-01-08,EBAY,eBay,Meta to test showing eBay listings on Facebook Marketplace,meta said wednesday would launch test germany france united states enable buyers browse listings ebay nasdaq ebay facebook nasdaq meta marketplace chars,0.029411764705882353,0.029411764705882353,0.0,https://biztoc.com/x/04d21a4ec5eb766d,2025-01-08T12:54:23Z,Biztoc.com
2025-01-08,EBAY,eBay,StockTok: eBay buyers can now browse directly on Facebook Marketplace,welcome stocktok fly weekly recap wall street reactions social media stock news antitrust latest ebay ebay said earlier blog post starting today thrilled chars,0.029411764705882353,0.029411764705882353,0.39047619047619053,https://thefly.com/permalinks/entry.php/id4048519/EBAY;META;GCI;AMZN;GOOG;GOOGL;DJT;TASK;RDDT;IAS;ZM;SNAP;PINS-StockTok-eBay-buyers-can-now-browse-directly-on-Facebook-Marketplace,2025-01-08T20:56:30Z,Thefly.com
2025-01-08,EBAY,eBay,eBay Stock Surges After Meta Launches Integration Test For Facebook Marketplace,shares e commerce company ebay inc nasdaq ebay trading higher wednesday meta platforms inc nasdaq meta said rolling new test integrate listings ebay di chars,0.058823529411764705,0.058823529411764705,0.19318181818181818,https://biztoc.com/x/efff10c264a01cc1,2025-01-08T18:24:39Z,Biztoc.com
2025-01-08,EBAY,eBay,"Meta to test showing eBay listings on Facebook Marketplace in Germany, France and U.S",meta meta q said wednesday would launch test germany france united states enable buyers browse listings ebay facebook marketplace complete tran chars,0.027777777777777776,0.027777777777777776,0.1,https://biztoc.com/x/755a435689b5ddfa,2025-01-08T13:16:17Z,Biztoc.com
2025-01-08,EBAY,eBay,"EBay shares soar after Meta allows listings on Facebook Marketplace in U.S., Europe",shares ebay soared wednesday meta announced allow listings show facebook marketplace germany france united states story appeared cnbc com chars,0.029411764705882353,0.029411764705882353,0.0,https://biztoc.com/x/89a649b2c346bdc1,2025-01-08T16:23:35Z,Biztoc.com
2025-01-08,EBAY,eBay,Meta tries letting Facebook Marketplace users view eBay listings as way to resolve EU charges,meta said wednesday allow facebook users view ebay listings marketplace service tries possible way resolve european union charges anticompetitive behavi chars,0.02857142857142857,0.02857142857142857,-0.03333333333333333,https://biztoc.com/x/e084f7ff545ae243,2025-01-08T17:30:25Z,Biztoc.com
2025-01-08,ECL,Ecolab,Ecolab Inc. (NYSE:ECL) Position Cut by First County Bank CT,first county bank ct lowered holdings shares ecolab inc nyse ecl free report th quarter according recent f filing securities exchange c chars,0.0,0.02702702702702703,0.21666666666666667,https://www.etfdailynews.com/2025/01/08/ecolab-inc-nyseecl-position-cut-by-first-county-bank-ct/,2025-01-08T10:24:52Z,ETF Daily News
2025-01-08,ECL,Ecolab,Diversified Trust Co Purchases 123 Shares of Ecolab Inc. (NYSE:ECL),diversified trust co raised holdings shares ecolab inc nyse ecl free report fourth quarter according company recent disclosure securitie chars,0.0,0.02857142857142857,0.13333333333333333,https://www.etfdailynews.com/2025/01/08/diversified-trust-co-purchases-123-shares-of-ecolab-inc-nyseecl/,2025-01-08T09:16:53Z,ETF Daily News
2025-01-08,EIX,Edison International,"Edison International stock plummets as wildfires leave 70,000 Southern Californians without power",edison international eix stock fell much wednesday company shut power tens thousands customers southern california wildfires raged region chars,0.0,0.05714285714285714,0.06666666666666667,https://biztoc.com/x/ec57f06d41bd6219,2025-01-08T20:48:56Z,Biztoc.com
2025-01-08,ELV,Elevance Health,"First County Bank CT Acquires Shares of 787 Elevance Health, Inc. (NYSE:ELV)",first county bank ct bought new position shares elevance health inc nyse elv free report fourth quarter holdings channel reports fund bought shares company sto chars,0.0,0.027777777777777776,0.1965909090909091,https://www.etfdailynews.com/2025/01/08/first-county-bank-ct-acquires-shares-of-787-elevance-health-inc-nyseelv/,2025-01-08T09:20:54Z,ETF Daily News
2025-01-08,ENPH,Enphase Energy,"ROSEN, LEADING TRIAL ATTORNEYS, Encourages Enphase Energy, Inc. Investors to Secure Counsel Before Important Deadline in Securities Class Action - ENPH",new york jan globe newswire rosen law firm global investor rights law firm reminds purchasers common stock enphase energy inc nasdaq enph april chars,0.0,0.027777777777777776,-0.11272727272727275,https://www.globenewswire.com/news-release/2025/01/08/3006743/673/en/ROSEN-LEADING-TRIAL-ATTORNEYS-Encourages-Enphase-Energy-Inc-Investors-to-Secure-Counsel-Before-Important-Deadline-in-Securities-Class-Action-ENPH.html,2025-01-08T22:45:00Z,GlobeNewswire
2025-01-08,ETR,Entergy,Scotiabank Cuts Entergy (NYSE:ETR) Price Target to $82.00,entergy nyse etr free report price target reduced scotiabank research report released tuesday benzinga reports currently sector perform rati chars,0.0,0.030303030303030304,0.2,https://www.etfdailynews.com/2025/01/08/scotiabank-cuts-entergy-nyseetr-price-target-to-82-00/,2025-01-08T10:37:13Z,ETF Daily News
2025-01-08,EPAM,EPAM Systems,"GAMMA Investing LLC Raises Stock Holdings in EPAM Systems, Inc. (NYSE:EPAM)",gamma investing llc raised stake epam systems inc nyse epam free report th quarter holdings channel com reports firm owned shares information tech chars,0.029411764705882353,0.029411764705882353,0.1,https://www.etfdailynews.com/2025/01/08/gamma-investing-llc-raises-stock-holdings-in-epam-systems-inc-nyseepam/,2025-01-08T08:48:46Z,ETF Daily News
2025-01-08,EQT,EQT Corporation,EQT Co. (NYSE:EQT) Receives Consensus Rating of “Moderate Buy” from Analysts,shares eqt co nyse eqt get free report assigned average recommendation moderate buy eighteen brokerages covering stock marketbeat reports seven inves chars,0.030303030303030304,0.030303030303030304,0.08333333333333333,https://www.etfdailynews.com/2025/01/08/eqt-co-nyseeqt-receives-consensus-rating-of-moderate-buy-from-analysts/,2025-01-08T10:16:53Z,ETF Daily News
2025-01-08,EQR,Equity Residential,Equity Residential (NYSE:EQR) Given Average Rating of “Hold” by Brokerages,equity residential nyse eqr get free report received consensus recommendation hold nineteen brokerages presently covering stock marketbeat com reports ten equit chars,0.0,0.06666666666666667,0.13333333333333333,https://www.etfdailynews.com/2025/01/08/equity-residential-nyseeqr-given-average-rating-of-hold-by-brokerages/,2025-01-08T10:16:52Z,ETF Daily News
2025-01-08,EG,Everest Group,"Diversified Trust Co Sells 101 Shares of Everest Group, Ltd. (NYSE:EG)",diversified trust co lessened holdings shares everest group ltd nyse eg free report th quarter according recent filing sec fund owned chars,0.0,0.02631578947368421,0.10000000000000002,https://www.etfdailynews.com/2025/01/08/diversified-trust-co-sells-101-shares-of-everest-group-ltd-nyseeg/,2025-01-08T10:24:52Z,ETF Daily News
2025-01-08,EG,Everest Group,Barclays Cuts Everest Group (NYSE:EG) Price Target to $499.00,everest group nyse eg get free report price target cut stock analysts barclays report issued monday benzinga reports firm currently chars,0.0,0.05555555555555555,0.06666666666666667,https://www.etfdailynews.com/2025/01/08/barclays-cuts-everest-group-nyseeg-price-target-to-499-00/,2025-01-08T08:20:54Z,ETF Daily News
2025-01-08,EVRG,Evergy,FY2025 EPS Estimates for Evergy Reduced by Seaport Res Ptn,evergy inc nasdaq evrg free report stock analysts seaport res ptn decreased fy earnings estimates shares evergy research report issued clients investors mon chars,0.0,0.02857142857142857,0.0,https://www.etfdailynews.com/2025/01/08/fy2025-eps-estimates-for-evergy-reduced-by-seaport-res-ptn/,2025-01-08T06:22:51Z,ETF Daily News
2025-01-08,ES,Eversource Energy,Bangor Savings Bank Boosts Stake in Eversource Energy (NYSE:ES),bangor savings bank lifted holdings shares eversource energy nyse es free report fourth quarter according company recent filing securities chars,0.0,0.05555555555555555,0.13333333333333333,https://www.etfdailynews.com/2025/01/08/bangor-savings-bank-boosts-stake-in-eversource-energy-nysees/,2025-01-08T09:14:48Z,ETF Daily News
2025-01-08,EXC,Exelon,Analysts Set Exelon Co. (NASDAQ:EXC) PT at $42.00,shares exelon co nasdaq exc get free report received average rating hold nine ratings firms covering company marketbeat ratings reports five investment chars,0.0,0.029411764705882353,0.125,https://www.etfdailynews.com/2025/01/08/analysts-set-exelon-co-nasdaqexc-pt-at-42-00/,2025-01-08T08:34:46Z,ETF Daily News
2025-01-08,EXC,Exelon,"Bank of New Hampshire Sells 1,212 Shares of Exelon Co. (NASDAQ:EXC)",bank new hampshire decreased stake shares exelon co nasdaq exc free report fourth quarter according company recent form f filing sec chars,0.0,0.02564102564102564,0.006060606060606058,https://www.etfdailynews.com/2025/01/08/bank-of-new-hampshire-sells-1212-shares-of-exelon-co-nasdaqexc/,2025-01-08T09:14:48Z,ETF Daily News
2025-01-08,EXPD,Expeditors International,"Nordea Investment Management AB Purchases 59,086 Shares of Expeditors International of Washington, Inc. (NASDAQ:EXPD)",nordea investment management ab raised holdings shares expeditors international washington inc nasdaq expd free report fourth quarter according rec chars,0.0,0.0625,0.13333333333333333,https://www.etfdailynews.com/2025/01/08/nordea-investment-management-ab-purchases-59086-shares-of-expeditors-international-of-washington-inc-nasdaqexpd/,2025-01-08T09:04:56Z,ETF Daily News
2025-01-08,EXR,Extra Space Storage,"Joseph D. Margolis Sells 7,500 Shares of Extra Space Storage Inc. (NYSE:EXR) Stock",extra space storage inc nyse exr get free report ceo joseph margolis sold shares business stock transaction thursday january nd stock sold average pric chars,0.0,0.08108108108108109,0.08333333333333333,https://www.etfdailynews.com/2025/01/08/joseph-d-margolis-sells-7500-shares-of-extra-space-storage-inc-nyseexr-stock/,2025-01-08T09:12:53Z,ETF Daily News
2025-01-08,FDS,FactSet,Here's what to expect with Delta's fourth-quarter earnings,story delta report fourth quarter earnings friday give sense went according finance data platform factset fds wall street expecting chars,0.0,0.027777777777777776,0.0,https://qz.com/delta-4q24-earnings-preview-1851734678,2025-01-08T10:00:00Z,Quartz India
2025-01-08,FAST,Fastenal,Nordea Investment Management AB Cuts Stock Position in Fastenal (NASDAQ:FAST),nordea investment management ab decreased holdings shares fastenal nasdaq fast free report fourth quarter according company recent disclosure wit chars,0.0,0.030303030303030304,0.04,https://www.etfdailynews.com/2025/01/08/nordea-investment-management-ab-cuts-stock-position-in-fastenal-nasdaqfast/,2025-01-08T08:56:48Z,ETF Daily News
2025-01-08,FDX,FedEx,FedEx Co. (NYSE:FDX) Shares Sold by Nordea Investment Management AB,nordea investment management ab reduced holdings shares fedex co nyse fdx free report th quarter holdingschannel reports institutional investor owned chars,0.0,0.03225806451612903,0.4,https://www.etfdailynews.com/2025/01/08/fedex-co-nysefdx-shares-sold-by-nordea-investment-management-ab/,2025-01-08T09:04:52Z,ETF Daily News
2025-01-08,FIS,Fidelity National Information Services,Fidelity National Information Services Sees Unusually High Options Volume (NYSE:FIS),fidelity national information services inc nyse fis get free report target unusually large options trading activity tuesday investors purchased put options company chars,0.0,0.09375,0.30714285714285716,https://www.etfdailynews.com/2025/01/08/fidelity-national-information-services-sees-unusually-high-options-volume-nysefis/,2025-01-08T06:48:45Z,ETF Daily News
2025-01-08,FIS,Fidelity National Information Services,"Nordea Investment Management AB Boosts Holdings in Fidelity National Information Services, Inc. (NYSE:FIS)",nordea investment management ab raised position shares fidelity national information services inc nyse fis free report fourth quarter according company chars,0.0,0.09090909090909091,0.2,https://www.etfdailynews.com/2025/01/08/nordea-investment-management-ab-boosts-holdings-in-fidelity-national-information-services-inc-nysefis/,2025-01-08T09:04:54Z,ETF Daily News
2025-01-08,FITB,Fifth Third Bancorp,"Fifth Third Bancorp (NASDAQ:FITB) Stock Price Expected to Rise, Barclays Analyst Says",fifth third bancorp nasdaq fitb get free report target price boosted barclays research note issued monday benzinga reports firm presently ove chars,0.0,0.08571428571428572,0.05,https://www.etfdailynews.com/2025/01/08/fifth-third-bancorp-nasdaqfitb-stock-price-expected-to-rise-barclays-analyst-says/,2025-01-08T08:50:51Z,ETF Daily News
2025-01-08,FITB,Fifth Third Bancorp,Fifth Third Bancorp (NASDAQ:FITB) Now Covered by Analysts at Truist Financial,truist financial began coverage shares fifth third bancorp nasdaq fitb free report research note released tuesday morning benzinga reports brokerage issued buy rating chars,0.0,0.08823529411764706,0.13333333333333333,https://www.etfdailynews.com/2025/01/08/fifth-third-bancorp-nasdaqfitb-now-covered-by-analysts-at-truist-financial/,2025-01-08T10:23:13Z,ETF Daily News
2025-01-08,FTNT,Fortinet,Fortinet to Collaborate and Share Insights with Global Leaders at World Economic Forum Annual Meeting,author article article content fortinet joins leaders government business civil society contribute insights addressing todays pressing cybersecurity challenges sunn chars,0.0,0.03571428571428571,0.0,https://financialpost.com/globe-newswire/fortinet-to-collaborate-and-share-insights-with-global-leaders-at-world-economic-forum-annual-meeting,2025-01-08T14:01:39Z,Financial Post
2025-01-08,FTV,Fortive,Fortive Co. (NYSE:FTV) Shares Sold by First County Bank CT,first county bank ct trimmed position shares fortive co nyse ftv free report fourth quarter according company recent form f filing sec chars,0.0,0.02631578947368421,0.11000000000000001,https://www.etfdailynews.com/2025/01/08/fortive-co-nyseftv-shares-sold-by-first-county-bank-ct/,2025-01-08T09:20:51Z,ETF Daily News
2025-01-08,FCX,Freeport-McMoRan,Scotiabank Cuts Freeport-McMoRan (NYSE:FCX) Price Target to $48.00,freeport mcmoran nyse fcx get free report price target lowered equities research analysts scotiabank report released monday benzinga reports firm chars,0.0,0.030303030303030304,0.1,https://www.etfdailynews.com/2025/01/08/scotiabank-cuts-freeport-mcmoran-nysefcx-price-target-to-48-00/,2025-01-08T08:20:49Z,ETF Daily News
2025-01-08,IT,Gartner,Delivering return on investment from GenAI [Q&A],many people ai seen answer problems recent gartner report suggests could entering trough disillusionment biggest challenge adopting gen chars,0.0,0.02702702702702703,0.25,https://betanews.com/2025/01/08/delivering-return-on-investment-from-genai-qa/,2025-01-08T10:01:15Z,BetaNews
2025-01-08,IT,Gartner,AI transformation is a double-edged sword. Here's how to avoid the risks,zdnet new year means fresh focus investments tech analyst gartner predicts worldwide spending hit trillion increase analyst says explorati chars,0.05555555555555555,0.027777777777777776,0.21818181818181817,https://www.zdnet.com/article/ai-transformation-is-a-double-edged-sword-heres-how-to-avoid-the-risks/,2025-01-08T11:00:16Z,ZDNet
2025-01-08,GEHC,GE HealthCare,GE HealthCare Stock Gains After Jefferies Analysts Name It 'Franchise Pick',getty images ul li ge healthcare shares gained wednesday jefferies analysts upgraded rating stock buy raised price target li li analysts said firm h chars,0.0,0.03225806451612903,-0.2,https://www.investopedia.com/ge-healthcare-stock-gains-after-jefferies-analysts-name-it-franchise-pick-8771220,2025-01-08T21:30:29Z,Investopedia
2025-01-08,GD,General Dynamics,Barclays Has Lowered Expectations for General Dynamics (NYSE:GD) Stock Price,general dynamics nyse gd get free report target price lowered equities research analysts barclays note issued investors monday benzinga reports chars,0.0,0.058823529411764705,0.22500000000000003,https://www.etfdailynews.com/2025/01/08/barclays-has-lowered-expectations-for-general-dynamics-nysegd-stock-price/,2025-01-08T08:20:49Z,ETF Daily News
2025-01-08,GM,General Motors,GM faces class action in Australia over Holden transmission issues,reuters australian law firm maurice blackburn said filed class action lawsuit u carmaker general motors local unit alleging transmission systems certain models chars,0.0,0.030303030303030304,0.02738095238095238,https://finance.yahoo.com/news/gm-faces-class-action-australia-054926369.html,2025-01-08T05:49:26Z,Yahoo Entertainment
2025-01-08,GM,General Motors,GM names new design boss,general motors announced tuesday bryan nesbitt take michael simcoe head gm global design july make eighth gm design boss nearly century chars,0.05,0.05,0.05000000000000001,https://www.motorauthority.com/news/1145455_gm-names-new-design-boss,2025-01-08T12:00:00Z,Motor Authority
