Date,Ticker,Company_Name,Title,Cleaned_Content,Density_Ticker,Density_Company,Sentiment,Url,PublishedAt,Source
2025-01-15,NOC,Northrop Grumman,Northrop Grumman approved for NGI target vehicle production,northrop grumman approved ngi target vehicle productionby clarence oxfordlos angeles ca spx jan northrop grumman corporation nyse noc secured approval advance production chars,0.0,0.13333333333333333,0.0,https://www.spacewar.com/reports/Northrop_Grumman_approved_for_NGI_target_vehicle_production_999.html,2025-01-15T04:18:17Z,Spacewar.com
2025-01-15,NOC,Northrop Grumman,Capital Investment Advisors LLC Decreases Stake in Northrop Grumman Co. (NYSE:NOC),capital investment advisors llc cut stake shares northrop grumman co nyse noc free report fourth quarter according recent form f filing secur chars,0.0,0.05555555555555555,0.13333333333333333,https://www.etfdailynews.com/2025/01/15/capital-investment-advisors-llc-decreases-stake-in-northrop-grumman-co-nysenoc/,2025-01-15T08:51:05Z,ETF Daily News
2025-01-15,NCLH,Norwegian Cruise Line Holdings,Cooper Financial Group Purchases New Position in Norwegian Cruise Line Holdings Ltd. (NYSE:NCLH),cooper financial group acquired new position norwegian cruise line holdings ltd nyse nclh free report fourth quarter according company recent disclosure chars,0.0,0.11764705882352941,0.0893939393939394,https://www.etfdailynews.com/2025/01/15/cooper-financial-group-purchases-new-position-in-norwegian-cruise-line-holdings-ltd-nysenclh/,2025-01-15T09:23:08Z,ETF Daily News
2025-01-15,NRG,NRG Energy,"NRG Energy, Inc. (NYSE:NRG) CFO Sells $1,952,600.00 in Stock",nrg energy inc nyse nrg get free report cfo bruce chung sold shares business stock transaction dated monday january th stock sold average price chars,0.02702702702702703,0.02702702702702703,0.125,https://www.etfdailynews.com/2025/01/15/nrg-energy-inc-nysenrg-cfo-sells-1952600-00-in-stock/,2025-01-15T09:08:56Z,ETF Daily News
2025-01-15,NUE,Nucor,Nucor Co. (NYSE:NUE) Shares Purchased by Czech National Bank,czech national bank increased position shares nucor co nyse nue free report fourth quarter holdingschannel reports institutional investor owned shares chars,0.0,0.03125,0.2,https://www.etfdailynews.com/2025/01/15/nucor-co-nysenue-shares-purchased-by-czech-national-bank/,2025-01-15T08:30:56Z,ETF Daily News
2025-01-15,NUE,Nucor,Nucor Co. (NYSE:NUE) Stock Position Raised by Capital Investment Advisors LLC,capital investment advisors llc lifted holdings shares nucor co nyse nue free report fourth quarter holdings channel com reports institutional investor owned chars,0.0,0.03125,0.2,https://www.etfdailynews.com/2025/01/15/nucor-co-nysenue-stock-position-raised-by-capital-investment-advisors-llc/,2025-01-15T09:04:55Z,ETF Daily News
2025-01-15,NVDA,Nvidia,Quantum stocks rally thanks to a 'Quantum Day' announcement and a glowing Microsoft blog post,story quantum computing stocks continued rallying wednesday quantum related announcements nvidia nvda microsoft msft quantum computing stock chars,0.0,0.034482758620689655,0.0,https://qz.com/quantum-computing-stocks-nvidia-gtc-microsoft-blog-1851740525,2025-01-15T21:20:00Z,Quartz India
2025-01-15,NVDA,Nvidia,Is It Time to Turn Bullish on IONQ Stock after the Quantum Freefall?,ionq ionq stock slumped along names quantum computing sector following comments made nvidia nvda ceo jensen huang early january however despite free falling shar chars,0.0,0.030303030303030304,0.16666666666666666,https://finance.yahoo.com/news/time-turn-bullish-ionq-stock-214129241.html,2025-01-15T21:41:29Z,Yahoo Entertainment
2025-01-15,NVDA,Nvidia,Stock Market Today: Dow Jones Soars 700 Points As Inflation Cools; Nvidia Rebounds As Quantum Stocks Fly (Live Coverage),dow jones industrial average jumped points wednesday inflation report pleased investors nvidia nvda rebounded microsoft msft gave quantum stocks boost stock chars,0.0,0.03125,0.175,https://www.investors.com/market-trend/stock-market-today/dow-jones-nasdaq-sp500-cpi-inflation-nvidia-stock/,2025-01-15T15:47:33Z,Investor's Business Daily
2025-01-15,NVDA,Nvidia,AI-Fueled Energy Stock Has This Edge Over The Nvidias Of The World,artificial intelligence powered giant moves likes nvidia nvda meta platforms meta alphabet googl broadcom avgo result climbs latest bases nvidia chars,0.0,0.030303030303030304,-0.033333333333333326,https://www.investors.com/research/breakout-stocks-technical-analysis/baker-hughes-stock-bkr-artificial-intelligence/,2025-01-15T15:30:07Z,Investor's Business Daily
2025-01-15,NVDA,Nvidia,Does The News Media Overanalyze Nvidia Stock Moves?,news media focused small moves nvidia nvda stock considering longer term trends wall street analyst says feel like press media talk write ab chars,0.0,0.02702702702702703,-0.25,https://www.investors.com/news/technology/nvidia-stock-moves-overanalyzed-analyst-says/,2025-01-15T17:20:25Z,Investor's Business Daily
2025-01-15,NVDA,Nvidia,AI-Fueled Energy Stock Has This Edge Over The Nvidias Of The World,artificial intelligence powered giant moves likes nvidia nvda meta platforms meta alphabet googl broadcom avgo result climbs latest bases nvidia chars,0.0,0.030303030303030304,-0.033333333333333326,https://biztoc.com/x/368ee190ea27b326,2025-01-15T15:51:12Z,Biztoc.com
2025-01-15,NVDA,Nvidia,How Big Is This Threat for Nvidia in 2025?,past two years big nvidia nasdaq nvda thanks dominance artificial intelligence ai chip market stock roared higher gaining period chars,0.0,0.027777777777777776,-0.07999999999999999,https://biztoc.com/x/5a6489e6d6810f5c,2025-01-15T09:25:57Z,Biztoc.com
2025-01-15,NVDA,Nvidia,Tradition Wealth Management LLC Has $16.19 Million Stake in NVIDIA Co. (NASDAQ:NVDA),tradition wealth management llc decreased position nvidia co nasdaq nvda free report rd quarter according company recent f filing sec chars,0.0,0.02702702702702703,-0.025,https://www.etfdailynews.com/2025/01/15/tradition-wealth-management-llc-has-16-19-million-stake-in-nvidia-co-nasdaqnvda/,2025-01-15T09:54:52Z,ETF Daily News
2025-01-15,NVDA,Nvidia,Why the Most Astonishing AI Gains May Still Be Ahead,artificial intelligence boom picked steam past years firms like nvidia nvda microsoft msft meta meta notched astronomical gains many investors chars,0.0,0.029411764705882353,-0.11666666666666665,https://biztoc.com/x/1638595956561941,2025-01-15T09:26:11Z,Biztoc.com
2025-01-15,NVDA,Nvidia,"Meet the Little-Known Company That's Betting That Nvidia's Jensen Huang Is ""Dead Wrong""",jensen huang co founder ceo nvidia nasdaq nvda right lot things lead business generate revenue billion annually unless chars,0.0,0.02702702702702703,0.2857142857142857,https://biztoc.com/x/4e63000a7f963d4a,2025-01-15T10:21:13Z,Biztoc.com
2025-01-15,NVDA,Nvidia,Stock Market Today: Dow Jones Soars 700 Points As Inflation Cools; Nvidia Rebounds As Quantum Stocks Fly (Live Coverage),dow jones industrial average jumped points wednesday inflation report pleased investors nvidia nvda rebounded microsoft msft gave quantum stocks boost stock chars,0.0,0.03125,0.175,https://biztoc.com/x/7bfc5162b6c4444c,2025-01-15T15:51:29Z,Biztoc.com
2025-01-15,NVDA,Nvidia,GraniteShares 2x Long NVDA Daily ETF (NASDAQ:NVDL) Stock Position Raised by Brookstone Capital Management,brookstone capital management boosted stake graniteshares x long nvda daily etf nasdaq nvdl free report th quarter holdings channel com reports institutional inv chars,0.03225806451612903,0.0,0.11666666666666668,https://www.etfdailynews.com/2025/01/15/graniteshares-2x-long-nvda-daily-etf-nasdaqnvdl-stock-position-raised-by-brookstone-capital-management/,2025-01-15T09:00:59Z,ETF Daily News
2025-01-15,NVDA,Nvidia,Nvidia Shares Fall on New AI Chip Export Rules. Is This a Golden Opportunity to Buy the Stock?,nvidia nasdaq nvda shares came pressure recently biden administration imposed tougher guidelines regarding export artificial intelligence ai chips new rules mo chars,0.0,0.03333333333333333,-0.15454545454545454,https://biztoc.com/x/d42919a582c4f5d8,2025-01-15T23:22:01Z,Biztoc.com
2025-01-15,NVDA,Nvidia,"Meet the Little-Known Company That's Betting That Nvidia's Jensen Huang Is ""Dead Wrong""",jensen huang co founder ceo nvidia nvda right lot things lead business generate revenue billion annually unless v chars,0.0,0.02702702702702703,0.2857142857142857,https://biztoc.com/x/921701ab8bf09058,2025-01-15T15:18:06Z,Biztoc.com
2025-01-15,NVDA,Nvidia,NVIDIA Co. (NASDAQ:NVDA) Holdings Boosted by Aragon Global Management LP,aragon global management lp raised stake shares nvidia co nasdaq nvda free report rd quarter according recent f filing securities amp exchang chars,0.0,0.027777777777777776,0.13333333333333333,https://www.etfdailynews.com/2025/01/15/nvidia-co-nasdaqnvda-holdings-boosted-by-aragon-global-management-lp/,2025-01-15T09:54:52Z,ETF Daily News
2025-01-15,NVDA,Nvidia,Josh Arnold Investment Consultant LLC Has $2.96 Million Holdings in NVIDIA Co. (NASDAQ:NVDA),josh arnold investment consultant llc increased holdings nvidia co nasdaq nvda free report third quarter according company recent disclosure chars,0.0,0.02857142857142857,0.13333333333333333,https://www.etfdailynews.com/2025/01/15/josh-arnold-investment-consultant-llc-has-2-96-million-holdings-in-nvidia-co-nasdaqnvda/,2025-01-15T09:54:52Z,ETF Daily News
2025-01-15,NVDA,Nvidia,True Wealth Design LLC Raises Stock Position in NVIDIA Co. (NASDAQ:NVDA),true wealth design llc grew stake nvidia co nasdaq nvda free report rd quarter holdings channel com reports firm owned shares computer hardware maker chars,0.0,0.02857142857142857,0.18333333333333335,https://www.etfdailynews.com/2025/01/15/true-wealth-design-llc-raises-stock-position-in-nvidia-co-nasdaqnvda/,2025-01-15T09:54:49Z,ETF Daily News
2025-01-15,NVDA,Nvidia,NVIDIA Co. (NASDAQ:NVDA) is Maverick Capital Ltd.’s Largest Position,maverick capital ltd grew stake nvidia co nasdaq nvda free report rd quarter according recent form f filing securities amp exchange commiss chars,0.0,0.02857142857142857,0.2,https://www.etfdailynews.com/2025/01/15/nvidia-co-nasdaqnvda-is-maverick-capital-ltd-s-largest-position/,2025-01-15T09:54:55Z,ETF Daily News
2025-01-15,NVDA,Nvidia,Point72 Europe London LLP Has $33.34 Million Stock Position in NVIDIA Co. (NASDAQ:NVDA),point europe london llp boosted stake shares nvidia co nasdaq nvda free report rd quarter according recent form f filing sec institu chars,0.0,0.02702702702702703,0.10000000000000002,https://www.etfdailynews.com/2025/01/15/point72-europe-london-llp-has-33-34-million-stock-position-in-nvidia-co-nasdaqnvda/,2025-01-15T09:54:52Z,ETF Daily News
2025-01-15,NVDA,Nvidia,"BRITISH COLUMBIA INVESTMENT MANAGEMENT Corp Sells 741,863 Shares of NVIDIA Co. (NASDAQ:NVDA)",british columbia investment management corp reduced position shares nvidia co nasdaq nvda free report rd quarter holdings channel reports institutional investor chars,0.0,0.03125,0.2,https://www.etfdailynews.com/2025/01/15/british-columbia-investment-management-corp-sells-741863-shares-of-nvidia-co-nasdaqnvda/,2025-01-15T09:54:50Z,ETF Daily News
2025-01-15,NVDA,Nvidia,Acropolis Investment Management LLC Has $6.45 Million Holdings in NVIDIA Co. (NASDAQ:NVDA),acropolis investment management llc increased holdings nvidia co nasdaq nvda free report third quarter holdings channel reports institutional investor owned chars,0.0,0.03225806451612903,0.2,https://www.etfdailynews.com/2025/01/15/acropolis-investment-management-llc-has-6-45-million-holdings-in-nvidia-co-nasdaqnvda/,2025-01-15T09:54:50Z,ETF Daily News
2025-01-15,NVDA,Nvidia,"Edgestream Partners L.P. Sells 3,259 Shares of NVIDIA Co. (NASDAQ:NVDA)",edgestream partners l p lowered stake shares nvidia co nasdaq nvda free report rd quarter according recent form f filing securities exchang chars,0.0,0.027777777777777776,0.2,https://www.etfdailynews.com/2025/01/15/edgestream-partners-l-p-sells-3259-shares-of-nvidia-co-nasdaqnvda/,2025-01-15T09:54:50Z,ETF Daily News
2025-01-15,NVDA,Nvidia,NVIDIA (NASDAQ:NVDA) Stock Price Down 2.9% Following Analyst Downgrade,nvidia co nasdaq nvda get free report stock price traded mid day trading monday hsbc lowered price target stock hsbc currently h chars,0.0,0.02857142857142857,0.13333333333333333,https://www.etfdailynews.com/2025/01/15/nvidia-nasdaqnvda-stock-price-down-2-9-following-analyst-downgrade/,2025-01-15T06:10:58Z,ETF Daily News
2025-01-15,NVDA,Nvidia,Ironwood Investment Counsel LLC Has $4.25 Million Position in NVIDIA Co. (NASDAQ:NVDA),ironwood investment counsel llc decreased holdings shares nvidia co nasdaq nvda free report rd quarter holdings channel com reports firm owned shares th chars,0.0,0.029411764705882353,-0.06666666666666667,https://www.etfdailynews.com/2025/01/15/ironwood-investment-counsel-llc-has-4-25-million-position-in-nvidia-co-nasdaqnvda/,2025-01-15T09:54:50Z,ETF Daily News
2025-01-15,NXPI,NXP Semiconductors,NXP Semiconductors Secures $1 Billion European Investment Bank Loan For R&D Expansion: Details,nxp semiconductors secures billion european investment bank loan r amp expansion details nxp semiconductors n v nasdaq nxpi shares trading higher wednesday secured b chars,0.0,0.12903225806451613,0.125,https://finance.yahoo.com/news/nxp-semiconductors-secures-1-billion-170753025.html,2025-01-15T17:07:53Z,Yahoo Entertainment
2025-01-15,NXPI,NXP Semiconductors,NXP Semiconductors (NASDAQ:NXPI) Lowered to “Hold” Rating by StockNews.com,nxp semiconductors nasdaq nxpi get free report downgraded stocknews com buy rating hold rating report released monday number research analysts also rec chars,0.0,0.05714285714285714,0.4,https://www.etfdailynews.com/2025/01/15/nxp-semiconductors-nasdaqnxpi-lowered-to-hold-rating-by-stocknews-com/,2025-01-15T07:52:56Z,ETF Daily News
2025-01-15,OXY,Occidental Petroleum,Occidental Petroleum Just Paid Investors: Here’s How Much They Got,occidental petroleum corp nyse oxy rewarding shareholders quarterly dividend payable wednesday jan line prior payout warre chars,0.0,0.05714285714285714,0.25,https://biztoc.com/x/86e42256dcb92d2b,2025-01-15T14:33:50Z,Biztoc.com
2025-01-15,OXY,Occidental Petroleum,Occidental Petroleum Co. (NYSE:OXY) Shares Purchased by Czech National Bank,czech national bank raised position occidental petroleum co nyse oxy free report th quarter according recent form f filing securities amp exchang chars,0.0,0.05714285714285714,0.2,https://www.etfdailynews.com/2025/01/15/occidental-petroleum-co-nyseoxy-shares-purchased-by-czech-national-bank/,2025-01-15T08:36:50Z,ETF Daily News
2025-01-15,OXY,Occidental Petroleum,Moody National Bank Trust Division Raises Stake in Occidental Petroleum Co. (NYSE:OXY),moody national bank trust division increased stake occidental petroleum co nyse oxy free report fourth quarter according recent f filing securities chars,0.0,0.05714285714285714,0.13333333333333333,https://www.etfdailynews.com/2025/01/15/moody-national-bank-trust-division-raises-stake-in-occidental-petroleum-co-nyseoxy/,2025-01-15T10:46:52Z,ETF Daily News
2025-01-15,ON,ON Semiconductor,Netherlands to expand export controls on semiconductor equipment,click accept partners including part iab transparency amp consent framework also store access information device words use chars,0.02702702702702703,0.02702702702702703,0.0,https://consent.yahoo.com/v2/collectConsent?sessionId=1_cc-session_00de1225-f78f-41c8-a3c0-98e057c92fd6,2025-01-15T17:07:55Z,Yahoo Entertainment
2025-01-15,ON,ON Semiconductor,Netherlands to expand export controls on semiconductor equipment,dutch government wednesday said would expand export controls advanced semiconductor equipment april chip equipment company asml said expect impact bus chars,0.05714285714285714,0.08571428571428572,0.4,https://biztoc.com/x/3cd51a4352b360a0,2025-01-15T17:29:54Z,Biztoc.com
2025-01-15,ON,ON Semiconductor,Better Semiconductor Stock: Wolfspeed vs. ASML,semiconductor industry great sector invest numerous secular trends driving demand trends include growing markets artificial intelligence electric vehicles e chars,0.0,0.03225806451612903,0.0666666666666667,https://biztoc.com/x/3c72c0aa1e4f1fbb,2025-01-15T13:17:32Z,Biztoc.com
2025-01-15,ORCL,Oracle Corporation,"Brookstone Capital Management Sells 1,200 Shares of Oracle Co. (NYSE:ORCL)",brookstone capital management reduced position shares oracle co nyse orcl free report fourth quarter holdingschannel com reports firm owned shares en chars,0.0,0.030303030303030304,0.06666666666666667,https://www.etfdailynews.com/2025/01/15/brookstone-capital-management-sells-1200-shares-of-oracle-co-nyseorcl/,2025-01-15T10:02:58Z,ETF Daily News
2025-01-15,OTIS,Otis Worldwide,Otis Worldwide Co. (NYSE:OTIS) Shares Purchased by Wedmont Private Capital,wedmont private capital boosted holdings shares otis worldwide co nyse otis free report th quarter according recent filing securities exch chars,0.02857142857142857,0.05714285714285714,0.13333333333333333,https://www.etfdailynews.com/2025/01/15/otis-worldwide-co-nyseotis-shares-purchased-by-wedmont-private-capital/,2025-01-15T09:43:05Z,ETF Daily News
2025-01-15,OTIS,Otis Worldwide,Moody National Bank Trust Division Lowers Stake in Otis Worldwide Co. (NYSE:OTIS),moody national bank trust division decreased position otis worldwide co nyse otis free report fourth quarter according company recent disclosure wit chars,0.029411764705882353,0.058823529411764705,0.0,https://www.etfdailynews.com/2025/01/15/moody-national-bank-trust-division-lowers-stake-in-otis-worldwide-co-nyseotis/,2025-01-15T09:02:48Z,ETF Daily News
2025-01-15,PCAR,Paccar,Wedmont Private Capital Increases Holdings in PACCAR Inc (NASDAQ:PCAR),wedmont private capital increased holdings shares paccar inc nasdaq pcar free report th quarter according recent form f filing securities exc chars,0.0,0.027777777777777776,0.13333333333333333,https://www.etfdailynews.com/2025/01/15/wedmont-private-capital-increases-holdings-in-paccar-inc-nasdaqpcar/,2025-01-15T10:12:47Z,ETF Daily News
2025-01-15,PKG,Packaging Corporation of America,Packaging Co. of America (NYSE:PKG) Holdings Lowered by Capital Investment Advisors LLC,capital investment advisors llc cut stake packaging co america nyse pkg free report th quarter holdingschannel reports fund owned shares industrial p chars,0.0,0.11428571428571428,0.4,https://www.etfdailynews.com/2025/01/15/packaging-co-of-america-nysepkg-holdings-lowered-by-capital-investment-advisors-llc/,2025-01-15T09:26:56Z,ETF Daily News
2025-01-15,PLTR,Palantir Technologies,Palantir Technologies Inc. (NASDAQ:PLTR) Shares Purchased by Capital Investment Advisors LLC,capital investment advisors llc lifted position palantir technologies inc nasdaq pltr free report fourth quarter according recent f filing sec chars,0.0,0.06060606060606061,0.07500000000000001,https://www.etfdailynews.com/2025/01/15/palantir-technologies-inc-nasdaqpltr-shares-purchased-by-capital-investment-advisors-llc/,2025-01-15T08:50:57Z,ETF Daily News
2025-01-15,PLTR,Palantir Technologies,Palantir Technologies (NASDAQ:PLTR) Trading Down 3.1% After Insider Selling,palantir technologies inc nasdaq pltr get free report share price dropped mid day trading monday insider sold shares company company traded low chars,0.0,0.058823529411764705,0.13333333333333333,https://www.etfdailynews.com/2025/01/15/palantir-technologies-nasdaqpltr-trading-down-3-1-after-insider-selling/,2025-01-15T06:10:58Z,ETF Daily News
2025-01-15,PARA,Paramount Global,Paramount shares fall on CFIUS scrutiny concerns,investing com paramount global nasdaq para shares dropped following comments congressman john moolenaar called review company merger skydance media com chars,0.0,0.0625,0.0,https://www.investing.com/news/stock-market-news/paramount-shares-fall-on-cfius-scrutiny-concerns-93CH-3815003,2025-01-15T19:54:07Z,Investing.com
2025-01-15,PYPL,PayPal,Is PayPal Stock a Buy Now?,paypal holdings nasdaq pypl original fintech company robust digital payments system merchant services however slow innovate seemed losing ground competi chars,0.0,0.029411764705882353,0.024999999999999984,https://biztoc.com/x/bc6b6958ca9851d0,2025-01-15T13:17:18Z,Biztoc.com
2025-01-15,PYPL,PayPal,"Aprio Wealth Management LLC Makes New $226,000 Investment in PayPal Holdings, Inc. (NASDAQ:PYPL)",aprio wealth management llc purchased new position paypal holdings inc nasdaq pypl free report th quarter according company recent f filing securitie chars,0.0,0.02857142857142857,0.1787878787878788,https://www.etfdailynews.com/2025/01/15/aprio-wealth-management-llc-makes-new-226000-investment-in-paypal-holdings-inc-nasdaqpypl/,2025-01-15T11:50:46Z,ETF Daily News
2025-01-15,PYPL,PayPal,"PayPal Holdings, Inc. (NASDAQ:PYPL) Shares Sold by Eastern Bank",eastern bank lessened position paypal holdings inc nasdaq pypl free report fourth quarter holdingschannel com reports institutional investor owned shares chars,0.0,0.03225806451612903,0.2,https://www.etfdailynews.com/2025/01/15/paypal-holdings-inc-nasdaqpypl-shares-sold-by-eastern-bank/,2025-01-15T10:00:57Z,ETF Daily News
2025-01-15,PYPL,PayPal,"PayPal Holdings, Inc. (NASDAQ:PYPL) Position Trimmed by Capital Investment Advisors LLC",capital investment advisors llc lowered stake paypal holdings inc nasdaq pypl free report th quarter according recent form f filing sec chars,0.0,0.027777777777777776,0.10000000000000002,https://www.etfdailynews.com/2025/01/15/paypal-holdings-inc-nasdaqpypl-position-trimmed-by-capital-investment-advisors-llc/,2025-01-15T08:51:03Z,ETF Daily News
2025-01-15,PFE,Pfizer,What To Expect From PFE Stock In 2025?,chongqing china october pfizer logo displayed smartphone screen front larger pfizer logo october chongqing china photo cheng xin getty images chars,0.0,0.05263157894736842,0.0,https://www.forbes.com/sites/greatspeculations/2025/01/15/what-to-expect-from-pfe-stock-in-2025/,2025-01-15T15:17:24Z,Forbes
2025-01-15,PFE,Pfizer,"Wedmont Private Capital Sells 6,639 Shares of Pfizer Inc. (NYSE:PFE)",wedmont private capital lessened position shares pfizer inc nyse pfe free report fourth quarter according company recent form f filing se chars,0.0,0.02702702702702703,0.1,https://www.etfdailynews.com/2025/01/15/wedmont-private-capital-sells-6639-shares-of-pfizer-inc-nysepfe/,2025-01-15T10:46:49Z,ETF Daily News
2025-01-15,PFE,Pfizer,"Brookstone Capital Management Sells 14,777 Shares of Pfizer Inc. (NYSE:PFE)",brookstone capital management trimmed stake shares pfizer inc nyse pfe free report fourth quarter holdingschannel com reports fund owned shares bio chars,0.0,0.030303030303030304,0.2,https://www.etfdailynews.com/2025/01/15/brookstone-capital-management-sells-14777-shares-of-pfizer-inc-nysepfe/,2025-01-15T10:02:59Z,ETF Daily News
2025-01-15,PM,Philip Morris International,Fiduciary Alliance LLC Acquires 628 Shares of Philip Morris International Inc. (NYSE:PM),fiduciary alliance llc grew holdings philip morris international inc nyse pm free report fourth quarter according company recent disclosure th chars,0.0,0.08823529411764706,0.1,https://www.etfdailynews.com/2025/01/15/fiduciary-alliance-llc-acquires-628-shares-of-philip-morris-international-inc-nysepm/,2025-01-15T08:57:10Z,ETF Daily News
2025-01-15,PM,Philip Morris International,Brookstone Capital Management Has $3.20 Million Stake in Philip Morris International Inc. (NYSE:PM),brookstone capital management increased stake shares philip morris international inc nyse pm free report th quarter according company recent form chars,0.0,0.08571428571428572,0.13333333333333333,https://www.etfdailynews.com/2025/01/15/brookstone-capital-management-has-3-20-million-stake-in-philip-morris-international-inc-nysepm/,2025-01-15T09:32:53Z,ETF Daily News
2025-01-15,PM,Philip Morris International,Philip Morris International Inc. (NYSE:PM) Stock Position Boosted by Moody National Bank Trust Division,moody national bank trust division grew stake shares philip morris international inc nyse pm free report fourth quarter according recent filing chars,0.0,0.08571428571428572,0.1,https://www.etfdailynews.com/2025/01/15/philip-morris-international-inc-nysepm-stock-position-boosted-by-moody-national-bank-trust-division/,2025-01-15T10:14:45Z,ETF Daily News
2025-01-15,PNC,PNC Financial Services,Why is pnc App not working?,pnc app working pnc app mobile banking app developed pnc financial services group convenient way customers manage accounts pay bills access various ban chars,0.08108108108108109,0.13513513513513514,0.03333333333333333,https://lifesciencesworld.com/why-is-pnc-app-not-working/,2025-01-15T00:49:19Z,Lifesciencesworld.com
2025-01-15,PNC,PNC Financial Services,"Claro Advisors LLC Sells 528 Shares of The PNC Financial Services Group, Inc. (NYSE:PNC)",claro advisors llc lessened holdings shares pnc financial services group inc nyse pnc free report th quarter according recent filing sec chars,0.027777777777777776,0.08333333333333333,0.07500000000000001,https://www.etfdailynews.com/2025/01/15/claro-advisors-llc-sells-528-shares-of-the-pnc-financial-services-group-inc-nysepnc/,2025-01-15T09:24:59Z,ETF Daily News
2025-01-15,PNC,PNC Financial Services,"The PNC Financial Services Group, Inc. (NYSE:PNC) Shares Bought by Wedmont Private Capital",wedmont private capital lifted stake shares pnc financial services group inc nyse pnc free report th quarter according company recent filin chars,0.027777777777777776,0.08333333333333333,0.1,https://www.etfdailynews.com/2025/01/15/the-pnc-financial-services-group-inc-nysepnc-shares-bought-by-wedmont-private-capital/,2025-01-15T13:03:00Z,ETF Daily News
