Date,Ticker,Company_Name,Title,Cleaned_Content,Density_Ticker,Density_Company,Sentiment,Url,PublishedAt,Source
2024-12-31,MGM,MGM Resorts,Saudi Arabia’s Push for Affordable Tourism Projects,big changes travel industry middle east sphere entertainment announced location abu dhabi mgm resorts announced sphere dubai wynn resorts got chars,0.02702702702702703,0.08108108108108109,0.0,http://skift.com/2024/12/31/saudi-arabias-push-for-affordable-tourism-projects/,2024-12-31T11:00:00Z,Skift
2024-12-31,MSFT,Microsoft,"Nvidia, Microsoft Expected to Lead AI Growth in 2025, Wedbush Report",wedbush securities identified microsoft msft financials nvidia nvda financials main winners rise artificial intelligence investments predicted define underlying app chars,0.0,0.034482758620689655,-0.21666666666666667,https://finance.yahoo.com/news/nvidia-microsoft-expected-lead-ai-151514014.html,2024-12-31T15:15:14Z,Yahoo Entertainment
2024-12-31,MSFT,Microsoft,Baron Silver Stevens Financial Advisors LLC Reduces Holdings in Microsoft Co. (NASDAQ:MSFT),baron silver stevens financial advisors llc reduced stake microsoft co nasdaq msft free report rd quarter according recent filing securities amp ex chars,0.0,0.02857142857142857,0.13333333333333333,https://www.etfdailynews.com/2024/12/31/baron-silver-stevens-financial-advisors-llc-reduces-holdings-in-microsoft-co-nasdaqmsft/,2024-12-31T08:53:01Z,ETF Daily News
2024-12-31,MSFT,Microsoft,Tevis Investment Management Acquires 593 Shares of Microsoft Co. (NASDAQ:MSFT),tevis investment management increased holdings shares microsoft co nasdaq msft free report third quarter holdings channel reports firm owned shares chars,0.0,0.029411764705882353,0.06666666666666667,https://www.etfdailynews.com/2024/12/31/tevis-investment-management-acquires-593-shares-of-microsoft-co-nasdaqmsft/,2024-12-31T08:53:00Z,ETF Daily News
2024-12-31,MSFT,Microsoft,Microsoft Co. (NASDAQ:MSFT) is AustralianSuper Pty Ltd’s Largest Position,australiansuper pty ltd increased holdings microsoft co nasdaq msft free report third quarter holdingschannel reports institutional investor owned shar chars,0.0,0.034482758620689655,0.2,https://www.etfdailynews.com/2024/12/31/microsoft-co-nasdaqmsft-is-australiansuper-pty-ltds-largest-position/,2024-12-31T08:53:02Z,ETF Daily News
2024-12-31,MSFT,Microsoft,Measured Wealth Private Client Group LLC Sells 960 Shares of Microsoft Co. (NASDAQ:MSFT),measured wealth private client group llc cut position shares microsoft co nasdaq msft free report rd quarter according recent f filing secu chars,0.0,0.027777777777777776,0.13333333333333333,https://www.etfdailynews.com/2024/12/31/measured-wealth-private-client-group-llc-sells-960-shares-of-microsoft-co-nasdaqmsft/,2024-12-31T08:52:55Z,ETF Daily News
2024-12-31,MSFT,Microsoft,Microsoft Co. (NASDAQ:MSFT) Stake Lifted by Palumbo Wealth Management LLC,palumbo wealth management llc grew stake microsoft co nasdaq msft free report third quarter holdings channel com reports firm owned shares software gian chars,0.0,0.029411764705882353,0.06666666666666667,https://www.etfdailynews.com/2024/12/31/microsoft-co-nasdaqmsft-stake-lifted-by-palumbo-wealth-management-llc/,2024-12-31T08:52:56Z,ETF Daily News
2024-12-31,MSFT,Microsoft,Microsoft Co. (NASDAQ:MSFT) is Aspen Wealth Strategies LLC’s 10th Largest Position,aspen wealth strategies llc lifted stake shares microsoft co nasdaq msft free report third quarter holdings channel reports fund owned shares soft chars,0.0,0.02857142857142857,0.16666666666666666,https://www.etfdailynews.com/2024/12/31/microsoft-co-nasdaqmsft-is-aspen-wealth-strategies-llcs-10th-largest-position/,2024-12-31T08:53:01Z,ETF Daily News
2024-12-31,MSFT,Microsoft,Microsoft Co. (NASDAQ:MSFT) Stock Position Lowered by Bank Hapoalim BM,bank hapoalim bm reduced holdings shares microsoft co nasdaq msft free report third quarter holdings channel reports fund owned shares software g chars,0.0,0.02857142857142857,0.2,https://www.etfdailynews.com/2024/12/31/microsoft-co-nasdaqmsft-stock-position-lowered-by-bank-hapoalim-bm/,2024-12-31T08:52:55Z,ETF Daily News
2024-12-31,MSFT,Microsoft,Microsoft Co. (NASDAQ:MSFT) is Cigna Investments Inc. New’s 2nd Largest Position,cigna investments inc new lessened holdings microsoft co nasdaq msft free report rd quarter holdings channel com reports firm owned shares software gi chars,0.0,0.029411764705882353,0.11212121212121212,https://www.etfdailynews.com/2024/12/31/microsoft-co-nasdaqmsft-is-cigna-investments-inc-news-2nd-largest-position/,2024-12-31T08:53:04Z,ETF Daily News
2024-12-31,MSFT,Microsoft,Rep. Marjorie Taylor Greene Buys Microsoft Co. (NASDAQ:MSFT) Shares,representative marjorie taylor greene r georgia recently bought shares microsoft co nasdaq msft filing disclosed december th representative disclosed bought betw chars,0.0,0.034482758620689655,0.0,https://www.etfdailynews.com/2024/12/31/rep-marjorie-taylor-greene-buys-microsoft-co-nasdaqmsft-shares/,2024-12-31T11:04:46Z,ETF Daily News
2024-12-31,MSFT,Microsoft,Microsoft Co. (NASDAQ:MSFT) Shares Purchased by Nikulski Financial Inc.,nikulski financial inc grew holdings shares microsoft co nasdaq msft free report rd quarter according company recent filing securities chars,0.0,0.027777777777777776,0.13333333333333333,https://www.etfdailynews.com/2024/12/31/microsoft-co-nasdaqmsft-shares-purchased-by-nikulski-financial-inc/,2024-12-31T08:52:59Z,ETF Daily News
2024-12-31,MRNA,Moderna,Authorization Milestone for First NextGen Covid Vaccine in Europe and More News (Update 24),first next generation covid vaccine way authorization european union recently rolled japan self amplifying mrna sarna vaccine arcturus critical chars,0.030303030303030304,0.0,0.05,https://absolutelymaybe.plos.org/2024/12/31/authorization-milestone-for-first-nextgen-covid-vaccine-in-europe-and-more-news-update-24/,2024-12-31T08:33:37Z,Plos.org
2024-12-31,MS,Morgan Stanley,2025 stock market predictions from the big banks,morgan stanley ms optimistic amp p index raising base case projection represents growth nearly current levels reflecting positivity chars,0.0,0.058823529411764705,-0.4,https://qz.com/2025-stock-market-predictions-jpmprgan-goldman-analysts-1851714659,2024-12-31T10:00:00Z,Quartz India
2024-12-31,MSCI,MSCI,ProShares Ultra MSCI Emerging Markets (NYSEARCA:EET) Share Price Pass Below 200 Day Moving Average – Should You Sell?,shares proshares ultra msci emerging markets nysearca eet get free report crossed two hundred day moving average trading monday stock two hundred day moving ave chars,0.027777777777777776,0.027777777777777776,0.125,https://www.etfdailynews.com/2024/12/31/proshares-ultra-msci-emerging-markets-nysearcaeet-share-price-pass-below-200-day-moving-average-should-you-sell/,2024-12-31T09:52:54Z,ETF Daily News
2024-12-31,MSCI,MSCI,iShares MSCI Emerging Markets ETF (NYSEARCA:EEM) Stock Cross Below 200 Day Moving Average – Here’s Why,ishares msci emerging markets etf nysearca eem get free report passed two hundred day moving average trading monday stock two hundred day moving average chars,0.02702702702702703,0.02702702702702703,0.03333333333333333,https://www.etfdailynews.com/2024/12/31/ishares-msci-emerging-markets-etf-nysearcaeem-stock-cross-below-200-day-moving-average-heres-why/,2024-12-31T09:11:01Z,ETF Daily News
2024-12-31,MSCI,MSCI,iShares Core MSCI EAFE ETF (BATS:IEFA) is Penney Financial LLC’s 6th Largest Position,penney financial llc increased stake ishares core msci eafe etf bats iefa free report third quarter holdingschannel reports firm owned shares company chars,0.029411764705882353,0.029411764705882353,0.05,https://www.etfdailynews.com/2024/12/31/ishares-core-msci-eafe-etf-batsiefa-is-penney-financial-llcs-6th-largest-position/,2024-12-31T13:40:45Z,ETF Daily News
2024-12-31,MSCI,MSCI,Jane Street Group LLC Decreases Stake in SPDR MSCI World StrategicFactors ETF (NYSEARCA:QWLD),jane street group llc reduced stake spdr msci world strategicfactors etf nysearca qwld free report rd quarter according recent filing securities amp chars,0.02857142857142857,0.02857142857142857,0.2,https://www.etfdailynews.com/2024/12/31/jane-street-group-llc-decreases-stake-in-spdr-msci-world-strategicfactors-etf-nysearcaqwld/,2024-12-31T08:33:01Z,ETF Daily News
2024-12-31,NFLX,Netflix,"After 84% Gain In 2024, Netflix Poised To Hit Another Buy Point",tuesday ibd stocks watch pick streaming media company netflix nflx created bullish add entry following gain makes netflix stock one best ideas chars,0.0,0.05405405405405406,0.5,https://www.investors.com/research/netflix-stock-buy-point-nflx/,2024-12-31T15:12:56Z,Investor's Business Daily
2024-12-31,NFLX,Netflix,Kurv Yield Premium Strategy Netflix (NFLX) ETF (BATS:NFLP) Stock Price Down 1.7% – What’s Next?,kurv yield premium strategy netflix nflx etf bats nflp get free report fell trading monday stock traded low last traded shares traded hand chars,0.0,0.02702702702702703,0.13333333333333333,https://www.etfdailynews.com/2024/12/31/kurv-yield-premium-strategy-netflix-nflx-etf-batsnflp-stock-price-down-1-7-whats-next/,2024-12-31T08:14:53Z,ETF Daily News
2024-12-31,NFLX,Netflix,"After 84% Gain In 2024, Netflix Poised To Hit Another Buy Point",tuesday ibd stocks watch pick streaming media company netflix nflx created bullish add entry following gain makes netflix stock one best ideas chars,0.0,0.05405405405405406,0.5,https://biztoc.com/x/d0de75719b7fdcb1,2024-12-31T15:27:09Z,Biztoc.com
2024-12-31,NEE,NextEra Energy,NextEra Energy Plans Rate Changes and Solar Projects,latest update nextera energy nee florida power amp light company ha chars,0.0,0.1,0.45,https://finance.yahoo.com/news/nextera-energy-plans-rate-changes-134817418.html,2024-12-31T13:48:17Z,Yahoo Entertainment
2024-12-31,NEE,NextEra Energy,"NextEra Energy's Planned 2025 Dividend Hike? 10%. And Planned for 2026? That's 10%, Too",article nextera energy nyse nee offering investors dividend yield roughly average utility stock using utilities select sector spdr etf yielding touch chars,0.0,0.029411764705882353,-0.15,https://biztoc.com/x/e5e24f311f82ff6a,2024-12-31T14:20:40Z,Biztoc.com
2024-12-31,NEE,NextEra Energy,"NextEra Energy's Planned 2025 Dividend Hike? 10%. And Planned for 2026? That's 10%, Too",nextera energy nyse nee offering investors dividend yield roughly average utility stock using utilities select sector spdr etf yielding touch per chars,0.0,0.05714285714285714,-0.15,https://biztoc.com/x/197eb26769de89b4,2024-12-31T14:54:10Z,Biztoc.com
2024-12-31,NEE,NextEra Energy,NextEra Energy Plans Rate Changes and Solar Projects,article latest update nextera energy nee miss new year offers make smarter investments weekly expert stock picks smart investor newsletterflo chars,0.0,0.0625,0.23766233766233766,https://biztoc.com/x/f92814b23b17c2f6,2024-12-31T13:58:54Z,Biztoc.com
2024-12-31,NDSN,Nordson Corporation,Nordson Co. (NDSN) to Issue Quarterly Dividend of $0.78 on January 16th,nordson co nasdaq ndsn get free report announced quarterly dividend thursday december th rtt news reports stockholders record thursday january nd paid dividend chars,0.0,0.030303030303030304,0.4,https://www.etfdailynews.com/2024/12/31/nordson-co-ndsn-to-issue-quarterly-dividend-of-0-78-on-january-16th/,2024-12-31T12:27:47Z,ETF Daily News
2024-12-31,NVDA,Nvidia,The AI stocks that could boom in 2025,big tech stocks could another big year nvidia nvda amazon amzn alphabet googl apple aapl could continue biggest winners artificial intelligence chars,0.0,0.029411764705882353,-0.19999999999999998,https://qz.com/tech-ai-stocks-2025-nvidia-google-amazon-apple-1851723970,2024-12-31T10:00:00Z,Quartz India
2024-12-31,NVDA,Nvidia,These Are The 5 Best Dow Jones Stocks Of 2024,nvidia nvda walmart wmt amazon com amzn count among five best dow jones stocks goldman sachs gs american express axp also make cut xnow playingstocks end strong chars,0.0,0.02857142857142857,0.4777777777777778,https://www.investors.com/news/best-dow-jones-stocks-2024-nvidia-walmart-amazon-goldman-sachs-american-express/,2024-12-31T21:21:21Z,Investor's Business Daily
2024-12-31,NVDA,Nvidia,Stock Market Caps Best Two-Year Gain Of 21st Century,stock market weak finish another strong year amp p index boasting best two year performance st century lot credit goes nvidia nvda chars,0.0,0.02564102564102564,0.3527777777777778,https://www.investors.com/news/stock-market-caps-best-two-year-gain-nvidia/,2024-12-31T22:00:53Z,Investor's Business Daily
2024-12-31,NVDA,Nvidia,Jim Cramer’s Take on NVIDIA (NVDA): The King of AI GPUs Under Pressure,recently published list jim cramers bold predictions semiconductor stocks article going take look nvidia corporation nasdaq nvda stands chars,0.0,0.02857142857142857,0.16666666666666666,https://finance.yahoo.com/news/jim-cramer-nvidia-nvda-king-181657526.html,2024-12-31T18:16:57Z,Yahoo Entertainment
2024-12-31,NVDA,Nvidia,"Nvidia Wraps Up 2024 as S&P 500's Top Performer, Eyes AI Expansion in 2025",third amp p behind palantir pltr financials vistra corp nvidia corp nvda financials global leader artificial intelligence image processing technologies chars,0.0,0.03225806451612903,-0.25,https://finance.yahoo.com/news/nvidia-wraps-2024-p-500s-175325762.html,2024-12-31T17:53:25Z,Yahoo Entertainment
2024-12-31,NVDA,Nvidia,"Nvidia, Microsoft Expected to Lead AI Growth in 2025, Wedbush Report",wedbush securities identified microsoft msft financials nvidia nvda financials main winners rise artificial intelligence investments predicted define underlying app chars,0.0,0.034482758620689655,-0.21666666666666667,https://finance.yahoo.com/news/nvidia-microsoft-expected-lead-ai-151514014.html,2024-12-31T15:15:14Z,Yahoo Entertainment
2024-12-31,NVDA,Nvidia,NVIDIA Stock Slips 2% Despite Analysts Remain Bullish on AI Giant's Future,tuesday nvidia nvda financial shares slid percent one low trading trading quiet volume million shares less chars,0.0,0.02564102564102564,-0.041666666666666664,https://finance.yahoo.com/news/nvidia-stock-slips-2-despite-182223222.html,2024-12-31T18:22:23Z,Yahoo Entertainment
2024-12-31,NVDA,Nvidia,Nvidia: 180 Billion Reasons Why This Artificial Intelligence (AI) Stock Could Skyrocket in 2025,article semiconductor giant nvidia nasdaq nvda terrific closer look recent stock price chart shows entering new year shaky ground thanks doubt chars,0.0,0.029411764705882353,0.0005050505050505083,https://biztoc.com/x/5d26501ae72e1322,2024-12-31T11:14:05Z,Biztoc.com
2024-12-31,NVDA,Nvidia,Peak Asset Management LLC Reduces Stake in NVIDIA Co. (NASDAQ:NVDA),peak asset management llc decreased holdings shares nvidia co nasdaq nvda free report rd quarter holdings channel com reports firm owned shares comp chars,0.0,0.02857142857142857,-0.06666666666666667,https://www.etfdailynews.com/2024/12/31/peak-asset-management-llc-reduces-stake-in-nvidia-co-nasdaqnvda/,2024-12-31T09:26:43Z,ETF Daily News
2024-12-31,NVDA,Nvidia,"Omnia Family Wealth LLC Acquires 3,164 Shares of NVIDIA Co. (NASDAQ:NVDA)",omnia family wealth llc grew position nvidia co nasdaq nvda free report rd quarter holdings channel reports institutional investor owned shares comput chars,0.0,0.029411764705882353,0.4,https://www.etfdailynews.com/2024/12/31/omnia-family-wealth-llc-acquires-3164-shares-of-nvidia-co-nasdaqnvda/,2024-12-31T09:26:43Z,ETF Daily News
2024-12-31,NVDA,Nvidia,NVIDIA Co. (NASDAQ:NVDA) is Fortis Capital Management LLC’s 4th Largest Position,fortis capital management llc increased holdings shares nvidia co nasdaq nvda free report third quarter holdingschannel reports institutional investor owned chars,0.0,0.03225806451612903,0.2,https://www.etfdailynews.com/2024/12/31/nvidia-co-nasdaqnvda-is-fortis-capital-management-llcs-4th-largest-position/,2024-12-31T08:53:05Z,ETF Daily News
2024-12-31,NVDA,Nvidia,"Wealthstream Advisors Inc. Buys 1,190 Shares of NVIDIA Co. (NASDAQ:NVDA)",wealthstream advisors inc raised position nvidia co nasdaq nvda free report third quarter according company recent disclosure securities e chars,0.0,0.02857142857142857,0.13333333333333333,https://www.etfdailynews.com/2024/12/31/wealthstream-advisors-inc-buys-1190-shares-of-nvidia-co-nasdaqnvda/,2024-12-31T08:53:05Z,ETF Daily News
2024-12-31,NVDA,Nvidia,NVIDIA Co. (NASDAQ:NVDA) Position Lifted by MeadowBrook Investment Advisors LLC,meadowbrook investment advisors llc increased holdings shares nvidia co nasdaq nvda free report rd quarter holdingschannel com reports firm owned shares chars,0.0,0.03125,0.1,https://www.etfdailynews.com/2024/12/31/nvidia-co-nasdaqnvda-position-lifted-by-meadowbrook-investment-advisors-llc/,2024-12-31T09:26:43Z,ETF Daily News
2024-12-31,NVDA,Nvidia,NVIDIA Co. (NASDAQ:NVDA) Shares Sold by One Wealth Management Investment & Advisory Services LLC,one wealth management investment amp advisory services llc cut holdings shares nvidia co nasdaq nvda free report rd quarter holdings channel reports firm chars,0.0,0.029411764705882353,0.1,https://www.etfdailynews.com/2024/12/31/nvidia-co-nasdaqnvda-shares-sold-by-one-wealth-management-investment-advisory-services-llc/,2024-12-31T08:53:04Z,ETF Daily News
2024-12-31,NVDA,Nvidia,NVIDIA Co. (NASDAQ:NVDA) Holdings Lowered by Dopkins Wealth Management LLC,dopkins wealth management llc lowered stake nvidia co nasdaq nvda free report third quarter according recent f filing securities exchange c chars,0.0,0.02857142857142857,0.13333333333333333,https://www.etfdailynews.com/2024/12/31/nvidia-co-nasdaqnvda-holdings-lowered-by-dopkins-wealth-management-llc/,2024-12-31T08:53:03Z,ETF Daily News
2024-12-31,NVDA,Nvidia,"Bouvel Investment Partners LLC Sells 10,107 Shares of NVIDIA Co. (NASDAQ:NVDA)",bouvel investment partners llc decreased holdings shares nvidia co nasdaq nvda free report rd quarter according company recent form f filing chars,0.0,0.027777777777777776,0.0,https://www.etfdailynews.com/2024/12/31/bouvel-investment-partners-llc-sells-10107-shares-of-nvidia-co-nasdaqnvda/,2024-12-31T08:53:04Z,ETF Daily News
2024-12-31,NVDA,Nvidia,Curi RMB Capital LLC Boosts Stock Position in NVIDIA Co. (NASDAQ:NVDA),curi rmb capital llc raised position shares nvidia co nasdaq nvda free report rd quarter according company recent disclosure sec fund chars,0.0,0.02564102564102564,0.10000000000000002,https://www.etfdailynews.com/2024/12/31/curi-rmb-capital-llc-boosts-stock-position-in-nvidia-co-nasdaqnvda/,2024-12-31T08:53:05Z,ETF Daily News
2024-12-31,NVDA,Nvidia,International Private Wealth Advisors LLC Sells 240 Shares of NVIDIA Co. (NASDAQ:NVDA),international private wealth advisors llc cut holdings shares nvidia co nasdaq nvda free report third quarter holdings channel reports fund owned shares chars,0.0,0.029411764705882353,0.1,https://www.etfdailynews.com/2024/12/31/international-private-wealth-advisors-llc-sells-240-shares-of-nvidia-co-nasdaqnvda/,2024-12-31T09:26:43Z,ETF Daily News
2024-12-31,NVDA,Nvidia,"Summit Asset Management LLC Acquires 1,945 Shares of NVIDIA Co. (NASDAQ:NVDA)",summit asset management llc boosted position nvidia co nasdaq nvda free report third quarter holdingschannel com reports institutional investor owned shares chars,0.0,0.03225806451612903,0.2,https://www.etfdailynews.com/2024/12/31/summit-asset-management-llc-acquires-1945-shares-of-nvidia-co-nasdaqnvda/,2024-12-31T09:26:44Z,ETF Daily News
2024-12-31,NVDA,Nvidia,NVIDIA (NASDAQ:NVDA) Shares Acquired Rep. Marjorie Taylor Greene,representative marjorie taylor greene r georgia recently bought shares nvidia co nasdaq nvda filing disclosed december th representative disclosed bought chars,0.0,0.034482758620689655,0.0,https://www.etfdailynews.com/2024/12/31/nvidia-nasdaqnvda-shares-acquired-rep-marjorie-taylor-greene-2/,2024-12-31T08:12:45Z,ETF Daily News
2024-12-31,ODFL,Old Dominion,"Old Dominion Freight Line, Inc. (ODFL): Are Hedge Funds Bullish On This Logistics Stock Right Now?",recently compiled list best logistics stocks invest right article going take look old dominion freight line inc nasdaq odfl stands chars,0.0,0.05128205128205128,0.3464285714285714,https://finance.yahoo.com/news/old-dominion-freight-line-inc-002823535.html,2024-12-31T00:28:23Z,Yahoo Entertainment
2024-12-31,ON,ON Semiconductor,Huawei sanctions 2.0 in the cards with Trump back in office,donald trump return us presidency coupled appointment hawkish cabinet members focused china signals likelihood escalated trade technology sanctions chines chars,0.03225806451612903,0.03225806451612903,0.0,https://www.digitimes.com/news/a20241225PD222/huawei-sanctions-trump-2.0-5g-telecom-materials.html,2024-12-31T08:37:16Z,Digitimes
2024-12-31,OKE,ONEOK,ONEOK Closes Sale of Wholly Owned Interstate Natural Gas Pipelines,guardian midwestern viking gas transmission pipelines sold dt midstream billion tulsa okla dec prnewswire oneok inc nyse nyse oke today announced chars,0.0,0.030303030303030304,0.0,https://www.investing.com/news/press-releases/oneok-closes-sale-of-wholly-owned-interstate-natural-gas-pipelines-93CH-3792574,2024-12-31T14:04:05Z,Investing.com
2024-12-31,PLTR,Palantir Technologies,Is Palantir's Deal With Red Cat a Game-Changer?,year breakout enterprise software company palantir technologies nasdaq pltr notable highlights include gaining inclusion amp p nasdaq chars,0.0,0.0625,0.5,https://biztoc.com/x/65f6fa67a0cd7dba,2024-12-31T11:47:04Z,Biztoc.com
2024-12-31,PARA,Paramount Global,Paramount Global (NASDAQ:PARA) Receives $12.43 Consensus Price Target from Brokerages,shares paramount global nasdaq para get free report earned consensus recommendation reduce seventeen brokerages presently covering company marketbeat com rep chars,0.0,0.06666666666666667,0.13333333333333333,https://www.etfdailynews.com/2024/12/31/paramount-global-nasdaqpara-receives-12-43-consensus-price-target-from-brokerages/,2024-12-31T07:26:55Z,ETF Daily News
2024-12-31,PFE,Pfizer,3 Reasons to Buy Pfizer Stock Like There's No Tomorrow,pharmaceutical industry tough business companies must innovate constantly stay relevant patents protecting proprietary drugs expire pfizer nyse pfe longtime stal chars,0.0,0.03333333333333333,0.003703703703703709,https://biztoc.com/x/2feb5052d6018800,2024-12-31T12:52:41Z,Biztoc.com
2024-12-31,PFE,Pfizer,Sangamo plunges after Pfizer ends pact for hemophilia drug,article bloomberg sangamo therapeutics inc sgmo shares fell years pfizer inc pfe ended two companies partnership develop new gene therapy treat hemoph chars,0.0,0.029411764705882353,0.13636363636363635,https://biztoc.com/x/a9cd7dced25bba2b,2024-12-31T15:27:11Z,Biztoc.com
2024-12-31,PM,Philip Morris International,Philip Morris International Inc. (NYSE:PM) Receives $131.50 Consensus PT from Analysts,shares philip morris international inc nyse pm get free report earned consensus rating moderate buy ten research firms covering stock marketbeat com reports chars,0.0,0.09090909090909091,0.1,https://www.etfdailynews.com/2024/12/31/philip-morris-international-inc-nysepm-receives-131-50-consensus-pt-from-analysts/,2024-12-31T07:26:56Z,ETF Daily News
2024-12-31,PNC,PNC Financial Services,"The PNC Financial Services Group, Inc. (NYSE:PNC) Given Consensus Rating of “Hold” by Analysts",pnc financial services group inc nyse pnc get free report earned consensus rating hold sixteen analysts presently covering firm marketbeat ratings reports chars,0.030303030303030304,0.09090909090909091,0.05,https://www.etfdailynews.com/2024/12/31/the-pnc-financial-services-group-inc-nysepnc-given-consensus-rating-of-hold-by-analysts/,2024-12-31T08:57:09Z,ETF Daily News
2024-12-31,PFG,Principal Financial Group,"JPMorgan Chase & Co. Has $211.53 Million Holdings in Principal Financial Group, Inc. (NYSE:PFG)",jpmorgan chase amp co raised holdings principal financial group inc nyse pfg free report third quarter according company recent form f filing chars,0.0,0.05555555555555555,0.1,https://www.etfdailynews.com/2024/12/31/jpmorgan-chase-co-has-211-53-million-holdings-in-principal-financial-group-inc-nysepfg/,2024-12-31T08:55:02Z,ETF Daily News
2024-12-31,PG,Procter & Gamble,Q2 EPS Forecast for Procter & Gamble Decreased by Analyst,procter amp gamble company nyse pg free report research analysts da davidson decreased q earnings estimates shares procter amp gamble research report issued chars,0.0,0.11428571428571428,0.0,https://www.etfdailynews.com/2024/12/31/q2-eps-forecast-for-procter-gamble-decreased-by-analyst/,2024-12-31T12:06:56Z,ETF Daily News
2024-12-31,PSA,Public Storage,Zacks Research Forecasts Weaker Earnings for Public Storage,public storage nyse psa free report analysts zacks research decreased q earnings estimates shares public storage research note issued investors thursday decemb chars,0.0,0.11764705882352941,0.0,https://www.etfdailynews.com/2024/12/31/zacks-research-forecasts-weaker-earnings-for-public-storage/,2024-12-31T06:22:57Z,ETF Daily News
2024-12-31,PWR,Quanta Services,Quanta Services (NYSE:PWR) Share Price Passes Above 200-Day Moving Average – Should You Sell?,quanta services inc nyse pwr get free report passed two hundred day moving average trading monday stock two hundred day moving average traded h chars,0.0,0.02631578947368421,0.03333333333333333,https://www.etfdailynews.com/2024/12/31/quanta-services-nysepwr-share-price-passes-above-200-day-moving-average-should-you-sell/,2024-12-31T08:40:50Z,ETF Daily News
2024-12-31,QCOM,Qualcomm,QUALCOMM FY2027 EPS Estimate Increased by Zacks Research,qualcomm incorporated nasdaq qcom free report analysts zacks research boosted fy earnings per share estimates shares qualcomm research report issued clients inve chars,0.0,0.06060606060606061,0.4,https://www.etfdailynews.com/2024/12/31/qualcomm-fy2027-eps-estimate-increased-by-zacks-research/,2024-12-31T06:22:53Z,ETF Daily News
