Date,Ticker,Company_Name,Title,Cleaned_Content,Density_Ticker,Density_Company,Sentiment,Url,PublishedAt,Source
2025-01-08,MTCH,Match Group,"Match Group, Inc. Sued for Securities Law Violations – Investors Should Contact Levi & Korsinsky for More Information – MTCH",new york jan globe newswire levi amp korsinsky llp notifies investors match group inc match group inc company nasdaq mtch class action securities lawsui chars,0.0,0.029411764705882353,0.11818181818181818,https://www.globenewswire.com/news-release/2025/01/08/3006584/3080/en/Match-Group-Inc-Sued-for-Securities-Law-Violations-Investors-Should-Contact-Levi-Korsinsky-for-More-Information-MTCH.html,2025-01-08T17:45:00Z,GlobeNewswire
2025-01-08,MTCH,Match Group,"Match Group, Inc. (NASDAQ:MTCH) Shares Bought by Nordea Investment Management AB",nordea investment management ab raised holdings shares match group inc nasdaq mtch free report th quarter according company recent f filing chars,0.0,0.027777777777777776,0.2,https://www.etfdailynews.com/2025/01/08/match-group-inc-nasdaqmtch-shares-bought-by-nordea-investment-management-ab/,2025-01-08T08:56:49Z,ETF Daily News
2025-01-08,MCK,McKesson Corporation,Range Financial Group LLC Acquires New Shares in McKesson Co. (NYSE:MCK),range financial group llc bought new position mckesson co nyse mck free report fourth quarter holdingschannel reports institutional investor bought shares company chars,0.0,0.030303030303030304,0.1340909090909091,https://www.etfdailynews.com/2025/01/08/range-financial-group-llc-acquires-new-shares-in-mckesson-co-nysemck/,2025-01-08T10:24:49Z,ETF Daily News
2025-01-08,MCK,McKesson Corporation,Bank of New Hampshire Purchases 30 Shares of McKesson Co. (NYSE:MCK),bank new hampshire increased position shares mckesson co nyse mck free report fourth quarter according recent filing securities amp excha chars,0.0,0.02857142857142857,0.1340909090909091,https://www.etfdailynews.com/2025/01/08/bank-of-new-hampshire-purchases-30-shares-of-mckesson-co-nysemck/,2025-01-08T09:46:46Z,ETF Daily News
2025-01-08,MRK,Merck & Co.,"Range Financial Group LLC Takes Position in Merck & Co., Inc. (NYSE:MRK)",range financial group llc purchased new position shares merck amp co inc nyse mrk free report fourth quarter according company recent filing secur chars,0.0,0.02702702702702703,0.10727272727272727,https://www.etfdailynews.com/2025/01/08/range-financial-group-llc-takes-position-in-merck-co-inc-nysemrk/,2025-01-08T09:20:53Z,ETF Daily News
2025-01-08,META,Meta Platforms,Mark Zuckerberg says users may leave Meta after fact-checking shutdown for 'virtue signaling',chesnot getty ul li mark zuckerberg dismisses concerns users leaving meta ends u fact checking li li meta plans replace third party fact checking crowdsourced community chars,0.038461538461538464,0.038461538461538464,0.0,https://www.businessinsider.com/mark-zuckerberg-dismissed-concerns-users-leaving-meta-platforms-virtue-signaling-2025-1,2025-01-08T20:35:26Z,Business Insider
2025-01-08,META,Meta Platforms,"Check out Mark Zuckerberg's rare $900,000 watch",meta platforms ceo mark zuckerberg reportedly wore rare watch announced companys decision end long standing fact checking practice social media platforms zuckerbe chars,0.03225806451612903,0.06451612903225806,0.09444444444444444,https://qz.com/mark-zuckerberg-watch-style-facebook-fact-check-fashion-1851734957,2025-01-08T13:22:00Z,Quartz India
2025-01-08,META,Meta Platforms,Meta Challenges CCI’s Rs. 213 Crore Penalty on WhatsApp’s 2021 Privacy Policy Update,meta platforms inc filed appeal national company law appellate tribunal nclat challenging earlier order issued competition commission india cci levying rs c chars,0.029411764705882353,0.058823529411764705,0.25,https://www.medianama.com/2025/01/223-meta-appeals-nclat-cci-rs-213-crore-penalty-whatsapp-privacy-policy-update/,2025-01-08T06:38:51Z,MediaNama.com
2025-01-08,META,Meta Platforms,The Scoop: Meta removes fact-checkers ahead of Trump’s return,meta end third party fact checking restore free expression social platforms coming months parent company facebook instagram threads introduce commun chars,0.03125,0.03125,0.14444444444444446,https://www.prdaily.com/the-scoop-meta-removes-fact-checkers-ahead-of-trumps-return/,2025-01-08T15:44:51Z,PR Daily
2025-01-08,META,Meta Platforms,Not even Instagram escaped backlash to Zuckerberg’s Meta changes,whenever meta embroiled controversy people rush boycott facebook flagship property instagram often seems dodge backlash whether meta suspending president e chars,0.06451612903225806,0.06451612903225806,0.0,https://www.dailydot.com/debug/delete-instagram-movement-mark-zuckerberg-fact-checking/,2025-01-08T20:04:04Z,The Daily Dot
2025-01-08,META,Meta Platforms,"We do not censor social media, EU says in response to Meta",brussels european commission rejected wednesday meta chief mark zuckerberg assertion european union data laws censored social media said required large platforms remo chars,0.03125,0.0625,0.0619047619047619,https://www.channelnewsasia.com/business/we-do-not-censor-social-media-eu-says-response-meta-4846066,2025-01-08T15:36:53Z,CNA
2025-01-08,META,Meta Platforms,"Meta platforms COO Javier Olivan sells shares worth $252,797",javier olivan chief operating officer meta platforms inc nasdaq meta recently executed sale company stock according filing securities exchange commission january chars,0.03125,0.03125,0.0,https://www.investing.com/news/insider-trading-news/meta-platforms-coo-javier-olivan-sells-shares-worth-252797-93CH-3804302,2025-01-08T23:36:49Z,Investing.com
2025-01-08,META,Meta Platforms,Germany warns Meta against fact-check removal,head german federal network agency klaus muller threatened meta platforms inc sanctions tech giant discontinued use fact checkers within europe according dsa chars,0.030303030303030304,0.06060606060606061,0.0,https://biztoc.com/x/cf74f294ff171117,2025-01-08T09:35:47Z,Biztoc.com
2025-01-08,META,Meta Platforms,Germany warns Meta against fact-checkers removal,head german federal network agency klaus muller threatened meta platforms inc sanctions tech giant discontinued use fact checkers within europe according dsa chars,0.03125,0.0625,0.0,https://biztoc.com/x/f93aae97d435df63,2025-01-08T09:46:35Z,Biztoc.com
2025-01-08,META,Meta Platforms,eBay surges almost 12% on Meta partnership news,shares ebay inc jumped almost trading session wednesday company announced partnership meta platforms inc ebay share soared et sell fo chars,0.02702702702702703,0.05405405405405406,0.0,https://biztoc.com/x/d162e4617493da48,2025-01-08T15:06:26Z,Biztoc.com
2025-01-08,META,Meta Platforms,"Meta Platforms, Inc. (NASDAQ:META) Shares Acquired by Bath Savings Trust Co",bath savings trust co increased stake shares meta platforms inc nasdaq meta free report th quarter according company recent form f filing wi chars,0.02702702702702703,0.02702702702702703,0.2,https://www.etfdailynews.com/2025/01/08/meta-platforms-inc-nasdaqmeta-shares-acquired-by-bath-savings-trust-co/,2025-01-08T10:24:50Z,ETF Daily News
2025-01-08,META,Meta Platforms,Meta is abandoning fact checking – this doesn’t bode well for the fight against misinformation,meta announced abandon fact checking program starting united states aimed preventing spread online lies among billion people use meta socia chars,0.027777777777777776,0.027777777777777776,0.0,https://theconversation.com/meta-is-abandoning-fact-checking-this-doesnt-bode-well-for-the-fight-against-misinformation-246878,2025-01-08T04:28:25Z,The Conversation Africa
2025-01-08,META,Meta Platforms,Internet Reacts To News That Meta Will Stop Fact-Checking: 'Don't Blame Me',protesters deliberately posting false claims meta platforms attempt call replacement fact checking model community driven system instagram facebook meta chars,0.03125,0.0625,-0.4000000000000001,https://www.newsweek.com/internet-reacts-news-meta-stops-fact-checking-2011682,2025-01-08T17:39:34Z,Newsweek
2025-01-08,META,Meta Platforms,Meta abruptly ends US fact-checks ahead of Trump term,washington social media giant meta tuesday slashed content moderation policies including ending u fact checking program facebook instagram major shift conforms chars,0.03125,0.03125,0.03194444444444444,https://www.hurriyetdailynews.com/meta-abruptly-ends-us-fact-checks-ahead-of-trump-term-204460,2025-01-08T05:57:22Z,Hurriyet Daily News
2025-01-08,META,Meta Platforms,Internet Reacts To News That Meta Will Stop Fact-Checking: 'Don't Blame Me',protesters deliberately posting false claims meta platforms attempt call replacement fact checking model community driven system instagram facebook meta c chars,0.03125,0.0625,-0.4000000000000001,https://biztoc.com/x/1195a09fda6da200,2025-01-08T17:41:15Z,Biztoc.com
2025-01-08,META,Meta Platforms,Meta shelves fact-checking in policy reversal ahead of Trump inauguration,social media company meta platforms tuesday scrapped u fact checking program reduced curbs discussions around contentious topics immigration gender identity bowing cr chars,0.03225806451612903,0.06451612903225806,0.03333333333333333,https://biztoc.com/x/c0b372522b45e288,2025-01-08T00:56:30Z,Biztoc.com
2025-01-08,META,Meta Platforms,eBay Stock Surges After Meta Launches Integration Test For Facebook Marketplace,shares e commerce company ebay inc nasdaq ebay trading higher wednesday meta platforms inc nasdaq meta said rolling new test integrate listings ebay di chars,0.029411764705882353,0.058823529411764705,0.19318181818181818,https://biztoc.com/x/efff10c264a01cc1,2025-01-08T18:24:39Z,Biztoc.com
2025-01-08,META,Meta Platforms,Meta Ditches Fact Checking in US Ahead of Trump Taking Office,meta platforms ditched fact checking popular social media sites facebook instagram threads united states move tuesday metas biggest overhaul approach managing chars,0.030303030303030304,0.06060606060606061,0.31666666666666665,https://biztoc.com/x/8624bee6cfc8e732,2025-01-08T11:37:18Z,Biztoc.com
2025-01-08,META,Meta Platforms,"Meta employees rip Mark Zuckerberg for ending fact-checking, adding Dana White to board: ‘Extremely concerned’",meta employees blasted company decision away third party fact checkers add pro trump voices including ultimate fighting championship head dana white board directors chars,0.03125,0.03125,-0.15,https://nypost.com/2025/01/08/business/meta-employees-rip-mark-zuckerberg-over-fact-checking-dana-white/,2025-01-08T16:17:02Z,New York Post
2025-01-08,META,Meta Platforms,"All But 1 ""Magnificent Seven"" Stock Beat the S&P 500 in 2024. Here's Why It Could Be a Big Winner in 2025 and Beyond",magnificent seven group seven tech orientated companies microsoft nasdaq msft apple nvidia alphabet amazon meta platforms tesla seven crushed amp p chars,0.03125,0.03125,0.45,https://biztoc.com/x/7a1c51b664c478ed,2025-01-08T12:21:17Z,Biztoc.com
2025-01-08,META,Meta Platforms,Mark Zuckerberg’s ‘Hand Made 1’ watch shocks netizens. Why it costs Rs 9 crore,mark zuckerberg recently sparked widespread discussion social media major announcement regarding meta platforms also choice wristwear meta ceo seen wearin chars,0.06060606060606061,0.09090909090909091,0.03194444444444444,https://economictimes.indiatimes.com/magazines/panache/mark-zuckerbergs-hand-made-1-watch-shocks-netizens-why-it-costs-rs-9-crore/articleshow/117041235.cms,2025-01-08T04:48:11Z,The Times of India
2025-01-08,META,Meta Platforms,"Meta Shelves Fact-Checking Program in US, Adopts X-Like ‘Community Notes’ Model",social media company meta platforms tuesday scrapped us fact checking program reduced curbs discussions around contentious topics immigration gender identity bowing crit chars,0.03225806451612903,0.06451612903225806,0.03333333333333333,https://www.gadgets360.com/internet/news/meta-shelves-fact-checking-policy-reversal-donald-trump-administration-7426253,2025-01-08T07:59:20Z,Gadgets360.com
2025-01-08,META,Meta Platforms,What is Community Notes? How does it work? With Meta removing fact-check — all you need to know explained,mark zuckerberg chairman ceo meta platforms january announced company pivot professional fact checking content reliance community notes type crowdsourced features fo chars,0.03225806451612903,0.06451612903225806,0.1,https://www.livemint.com/companies/news/whats-community-notes-how-does-it-work-meta-removing-fact-check-all-you-need-to-know-explained-mark-zuckerberg-x-tech-11736318403286.html,2025-01-08T08:45:13Z,Livemint
2025-01-08,META,Meta Platforms,How Meta's X-Style Community Notes Will Work: All You Need To Know,washington meta chief mark zuckerberg said tuesday group platforms including facebook instagram would future imitate rival x community notes feature rather using professio chars,0.03333333333333333,0.06666666666666667,0.0,https://www.ndtv.com/world-news/how-metas-x-style-community-notes-will-work-all-you-need-to-know-7424267,2025-01-08T01:49:42Z,NDTV News
2025-01-08,META,Meta Platforms,Zuckerberg lifts US content guardrails in bias shift,accident meta platforms inc chose donald trump favourite tv news show fox friends discuss decision ditch outside fact checking move impact content chars,0.02857142857142857,0.05714285714285714,0.0,https://www.bangkokpost.com/opinion/opinion/2935976/zuckerberg-lifts-us-content-guardrails-in-bias-shift,2025-01-08T21:00:00Z,Bangkok Post
2025-01-08,MET,MetLife,Barclays Issues Positive Forecast for MetLife (NYSE:MET) Stock Price,metlife nyse met get free report price target increased analysts barclays research note issued monday benzinga reports brokerage presently chars,0.0,0.02857142857142857,0.2,https://www.etfdailynews.com/2025/01/08/barclays-issues-positive-forecast-for-metlife-nysemet-stock-price/,2025-01-08T08:20:56Z,ETF Daily News
2025-01-08,MU,Micron Technology,(PR) Micron Breaks Ground on New HBM Advanced Packaging Facility in Singapore,micron technology inc nasdaq mu broke ground today new high bandwidth memory hbm advanced packaging facility adjacent company current facilities singapore micron marked chars,0.0,0.06451612903225806,0.1592727272727273,https://www.techpowerup.com/330753/micron-breaks-ground-on-new-hbm-advanced-packaging-facility-in-singapore,2025-01-08T08:44:56Z,Techpowerup.com
2025-01-08,MU,Micron Technology,Micron Breaks Ground on New HBM Advanced Packaging Facility in Singapore,singapore jan globe newswire micron technology inc nasdaq mu broke ground today new high bandwidth memory hbm advanced packaging facility adjacent companys current chars,0.0,0.03125,0.1740909090909091,https://www.globenewswire.com/news-release/2025/01/08/3005928/14450/en/Micron-Breaks-Ground-on-New-HBM-Advanced-Packaging-Facility-in-Singapore.html,2025-01-08T02:00:00Z,GlobeNewswire
2025-01-08,MSFT,Microsoft,Dumb Trading,apple aapl google googl microsoft msft amazon amzn bitcoin btc,0.0,0.1,0.0,https://dumbtrading.com/,2025-01-08T19:24:18Z,Dumbtrading.com
2025-01-08,MSFT,Microsoft,"Apple, Nvidia, Microsoft, Amazon, and Alphabet Drive S&P 500 Market Concentration to ...",apple aapl financials nvidia nvda financials microsoft msft financials amazon amzn financials alphabet goog financials googl financials together accounting chars,0.0,0.038461538461538464,0.0,https://finance.yahoo.com/news/apple-nvidia-microsoft-amazon-alphabet-205532443.html,2025-01-08T20:55:32Z,Yahoo Entertainment
2025-01-08,MSFT,Microsoft,"All But 1 ""Magnificent Seven"" Stock Beat the S&P 500 in 2024. Here's Why It Could Be a Big Winner in 2025 and Beyond",magnificent seven group seven tech orientated companies microsoft nasdaq msft apple nvidia alphabet amazon meta platforms tesla seven crushed amp p chars,0.0,0.03125,0.45,https://biztoc.com/x/7a1c51b664c478ed,2025-01-08T12:21:17Z,Biztoc.com
2025-01-08,MSFT,Microsoft,How to Load a Fabric Warehouse: Data Engineering with Fabric,data warehouse microsoft fabric written use onelake storage means every table warehouse based delta file format staying away single transactio chars,0.0,0.02857142857142857,-0.07142857142857142,https://www.sqlservercentral.com/articles/how-to-load-a-fabric-warehouse-data-engineering-with-fabric,2025-01-08T00:00:26Z,Sqlservercentral.com
2025-01-08,MSFT,Microsoft,Radnor Capital Management LLC Makes New Investment in Microsoft Co. (NASDAQ:MSFT),radnor capital management llc acquired new stake microsoft co nasdaq msft free report third quarter holdings channel com reports firm acquired shares software chars,0.0,0.03125,0.08409090909090909,https://www.etfdailynews.com/2025/01/08/radnor-capital-management-llc-makes-new-investment-in-microsoft-co-nasdaqmsft/,2025-01-08T09:46:46Z,ETF Daily News
2025-01-08,MSFT,Microsoft,Microsoft Co. (NASDAQ:MSFT) is Financial Security Advisor Inc.’s 9th Largest Position,financial security advisor inc boosted position microsoft co nasdaq msft free report third quarter holdings channel com reports institutional investor owned chars,0.0,0.03333333333333333,0.13333333333333333,https://www.etfdailynews.com/2025/01/08/microsoft-co-nasdaqmsft-is-financial-security-advisor-inc-s-9th-largest-position/,2025-01-08T09:12:52Z,ETF Daily News
2025-01-08,MSFT,Microsoft,Microsoft Co. (NASDAQ:MSFT) is 1834 Investment Advisors Co.’s 8th Largest Position,investment advisors co cut holdings shares microsoft co nasdaq msft free report third quarter according company recent form f filing chars,0.0,0.027777777777777776,0.13333333333333333,https://www.etfdailynews.com/2025/01/08/microsoft-co-nasdaqmsft-is-1834-investment-advisors-co-s-8th-largest-position/,2025-01-08T09:46:47Z,ETF Daily News
2025-01-08,MSFT,Microsoft,Armor Investment Advisors LLC Grows Stock Holdings in Microsoft Co. (NASDAQ:MSFT),armor investment advisors llc grew stake shares microsoft co nasdaq msft free report rd quarter holdingschannel reports fund owned shares softwar chars,0.0,0.029411764705882353,0.4,https://www.etfdailynews.com/2025/01/08/armor-investment-advisors-llc-grows-stock-holdings-in-microsoft-co-nasdaqmsft/,2025-01-08T09:46:48Z,ETF Daily News
2025-01-08,MSFT,Microsoft,"Gordian Advisors LLC Acquires 8,602 Shares of Microsoft Co. (NASDAQ:MSFT)",gordian advisors llc increased holdings shares microsoft co nasdaq msft free report third quarter holdings channel com reports firm owned shares chars,0.0,0.029411764705882353,0.06666666666666667,https://www.etfdailynews.com/2025/01/08/gordian-advisors-llc-acquires-8602-shares-of-microsoft-co-nasdaqmsft/,2025-01-08T09:46:47Z,ETF Daily News
2025-01-08,MSFT,Microsoft,Callahan Advisors LLC Cuts Stock Holdings in Microsoft Co. (NASDAQ:MSFT),callahan advisors llc trimmed holdings shares microsoft co nasdaq msft free report rd quarter holdings channel reports firm owned shares software g chars,0.0,0.02857142857142857,0.1,https://www.etfdailynews.com/2025/01/08/callahan-advisors-llc-cuts-stock-holdings-in-microsoft-co-nasdaqmsft/,2025-01-08T09:12:51Z,ETF Daily News
2025-01-08,MSFT,Microsoft,Umpqua Bank Buys 755 Shares of Microsoft Co. (NASDAQ:MSFT),umpqua bank increased stake microsoft co nasdaq msft free report rd quarter according company recent f filing securities exchange commis chars,0.0,0.027777777777777776,0.2,https://www.etfdailynews.com/2025/01/08/umpqua-bank-buys-755-shares-of-microsoft-co-nasdaqmsft/,2025-01-08T09:46:47Z,ETF Daily News
2025-01-08,MSFT,Microsoft,RTD Financial Advisors Inc. Buys 62 Shares of Microsoft Co. (NASDAQ:MSFT),rtd financial advisors inc raised stake shares microsoft co nasdaq msft free report third quarter according company recent filing securitie chars,0.0,0.027777777777777776,0.1,https://www.etfdailynews.com/2025/01/08/rtd-financial-advisors-inc-buys-62-shares-of-microsoft-co-nasdaqmsft/,2025-01-08T09:12:52Z,ETF Daily News
2025-01-08,MSFT,Microsoft,Sen. Shelley Moore Capito Unloads Microsoft Co. (NASDAQ:MSFT) Stock,senator shelley moore capito r west virginia recently sold shares microsoft co nasdaq msft filing disclosed january th senator disclosed sold chars,0.0,0.030303030303030304,0.0,https://www.etfdailynews.com/2025/01/08/sen-shelley-moore-capito-unloads-microsoft-co-nasdaqmsft-stock/,2025-01-08T08:36:42Z,ETF Daily News
2025-01-08,MSFT,Microsoft,Microsoft Co. (NASDAQ:MSFT) Shares Bought by CV Advisors LLC,cv advisors llc boosted position microsoft co nasdaq msft free report third quarter holdings channel reports institutional investor owned shares sof chars,0.0,0.030303030303030304,0.2,https://www.etfdailynews.com/2025/01/08/microsoft-co-nasdaqmsft-shares-bought-by-cv-advisors-llc/,2025-01-08T09:46:47Z,ETF Daily News
2025-01-08,MSFT,Microsoft,Hardman Johnston Global Advisors LLC Has $78.77 Million Stake in Microsoft Co. (NASDAQ:MSFT),hardman johnston global advisors llc cut stake microsoft co nasdaq msft free report rd quarter according company recent disclosure securities chars,0.0,0.027777777777777776,0.13333333333333333,https://www.etfdailynews.com/2025/01/08/hardman-johnston-global-advisors-llc-has-78-77-million-stake-in-microsoft-co-nasdaqmsft/,2025-01-08T09:12:52Z,ETF Daily News
2025-01-08,MRNA,Moderna,Why Did Moderna Stock Rise 12%?,moderna headquarters exterior view cambridge massachusetts usa photo plexi images ghi ucg universal images group via getty images ucg universal images group via getty images chars,0.0,0.03571428571428571,0.0,https://www.forbes.com/sites/greatspeculations/2025/01/08/why-did-moderna-stock-rise-12/,2025-01-08T14:02:08Z,Forbes
2025-01-08,MRNA,Moderna,Moderna stock forfeits gains as first US bird flu death puts vaccine development in focus,moderna stock mrna fell wednesday forfeiting gains tuesday session volatile week stock seen first reported bird flu death us chars,0.0,0.02631578947368421,0.25,https://finance.yahoo.com/news/moderna-stock-forfeits-gains-as-first-us-bird-flu-death-puts-vaccine-development-in-focus-141341697.html,2025-01-08T21:03:04Z,Yahoo Entertainment
2025-01-08,MRNA,Moderna,The Trump administration must bring Moderna to heel,last week independent journalist alex berenson reported preschool aged child died cardio respiratory arrest taking dose modernas covid mrna vaccine clinical trials chars,0.03225806451612903,0.0,-0.037500000000000006,https://www.naturalnews.com/2025-01-08-trump-administration-must-bring-moderna-to-heel.html,2025-01-08T06:00:00Z,Naturalnews.com
2025-01-08,MRNA,Moderna,Moderna stock on track for 10% weekly gain after US bird flu death,moderna stock mrna track see weekly gain wednesday shares vaccine maker rose prior day following first reported bird flu death us stock r chars,0.0,0.024390243902439025,0.2125,https://finance.yahoo.com/news/moderna-stock-on-track-for-10-weekly-gain-after-us-bird-flu-death-141341414.html,2025-01-08T14:13:41Z,Yahoo Entertainment
2025-01-08,MRNA,Moderna,Why Moderna shares are rallying this week,investing com shares moderna inc nasdaq bmv mrna surged tuesday continued rise wednesday amid growing concerns bird flu first human death relat chars,0.0,0.02857142857142857,0.125,https://www.investing.com/news/stock-market-news/why-moderna-shares-are-rallying-this-week-93CH-3802481,2025-01-08T11:48:23Z,Investing.com
2025-01-08,TAP,Molson Coors Beverage Company,Versant Capital Management Inc Reduces Position in Molson Coors Beverage (NYSE:TAP),versant capital management inc lowered position molson coors beverage nyse tap free report fourth quarter holdings channel com reports institutional investor owned chars,0.0,0.0967741935483871,0.2,https://www.etfdailynews.com/2025/01/08/versant-capital-management-inc-reduces-position-in-molson-coors-beverage-nysetap/,2025-01-08T08:46:55Z,ETF Daily News
2025-01-08,MDLZ,Mondelez International,"Bank of New Hampshire Sells 200 Shares of Mondelez International, Inc. (NASDAQ:MDLZ)",bank new hampshire lowered holdings mondelez international inc nasdaq mdlz free report th quarter according company recent f filing sec chars,0.0,0.027777777777777776,0.08727272727272728,https://www.etfdailynews.com/2025/01/08/bank-of-new-hampshire-sells-200-shares-of-mondelez-international-inc-nasdaqmdlz/,2025-01-08T09:46:45Z,ETF Daily News
2025-01-08,MDLZ,Mondelez International,"Bangor Savings Bank Trims Stock Position in Mondelez International, Inc. (NASDAQ:MDLZ)",bangor savings bank cut position mondelez international inc nasdaq mdlz free report th quarter according recent f filing securities exchan chars,0.0,0.029411764705882353,0.13333333333333333,https://www.etfdailynews.com/2025/01/08/bangor-savings-bank-trims-stock-position-in-mondelez-international-inc-nasdaqmdlz/,2025-01-08T09:08:51Z,ETF Daily News
2025-01-08,MDLZ,Mondelez International,"Diversified Trust Co Acquires 19,175 Shares of Mondelez International, Inc. (NASDAQ:MDLZ)",diversified trust co lifted holdings shares mondelez international inc nasdaq mdlz free report fourth quarter according company recent filing chars,0.0,0.02857142857142857,0.1,https://www.etfdailynews.com/2025/01/08/diversified-trust-co-acquires-19175-shares-of-mondelez-international-inc-nasdaqmdlz/,2025-01-08T10:20:44Z,ETF Daily News
2025-01-08,MPWR,Monolithic Power Systems,"Monolithic Power Systems, Inc. (NASDAQ:MPWR) Receives Consensus Recommendation of “Moderate Buy” from Analysts",monolithic power systems inc nasdaq mpwr get free report given average recommendation moderate buy twelve analysts covering stock marketbeat com reports chars,0.0,0.0625,0.08333333333333333,https://www.etfdailynews.com/2025/01/08/monolithic-power-systems-inc-nasdaqmpwr-receives-consensus-recommendation-of-moderate-buy-from-analysts/,2025-01-08T07:18:54Z,ETF Daily News
2025-01-08,MS,Morgan Stanley,Morgan Stanley upgrades NetEase on PC game pipeline,investing com morgan stanley upgraded netease inc nasdaq ntes overweight equal weight raising price target driven optimism pc gaming business bro chars,0.0,0.06451612903225806,0.0,https://www.investing.com/news/stock-market-news/morgan-stanley-upgrades-netease-on-pc-game-pipeline-3803835,2025-01-08T20:33:39Z,Investing.com
