Date,Ticker,Company_Name,Title,Cleaned_Content,Density_Ticker,Density_Company,Sentiment,Url,PublishedAt,Source
2025-01-08,MMM,3M,3M Target of Unusually Large Options Trading (NYSE:MMM),nyse mmm get free report saw unusually large options trading tuesday stock investors acquired call options stock represents increase compared average chars,0.0,0.02857142857142857,0.15476190476190477,https://www.etfdailynews.com/2025/01/08/3m-target-of-unusually-large-options-trading-nysemmm/,2025-01-08T06:48:46Z,ETF Daily News
2025-01-08,AOS,A. O. Smith,Bank of New Hampshire Trims Stock Position in A. O. Smith Co. (NYSE:AOS),bank new hampshire decreased holdings smith co nyse aos free report th quarter according recent f filing securities exchange commissi chars,0.0,0.08108108108108109,0.03409090909090909,https://www.etfdailynews.com/2025/01/08/bank-of-new-hampshire-trims-stock-position-in-a-o-smith-co-nyseaos/,2025-01-08T09:14:50Z,ETF Daily News
2025-01-08,ABT,Abbott Laboratories,"Nordea Investment Management AB Purchases 96,567 Shares of Abbott Laboratories (NYSE:ABT)",nordea investment management ab lifted holdings abbott laboratories nyse abt free report th quarter according recent filing securities exchan chars,0.0,0.06060606060606061,0.2,https://www.etfdailynews.com/2025/01/08/nordea-investment-management-ab-purchases-96567-shares-of-abbott-laboratories-nyseabt/,2025-01-08T09:04:57Z,ETF Daily News
2025-01-08,ACN,Accenture,Accenture acquires digital twin technology platform from Percipient,accenture nyse acn acquired digital twin technology platform banks developed percipient singapore based fintech company deep experience banking technology transformation th chars,0.0,0.03571428571428571,0.03333333333333333,https://www.finextra.com/pressarticle/103757/accenture-acquires-digital-twin-technology-platform-from-percipient,2025-01-08T09:29:00Z,Finextra
2025-01-08,ADBE,Adobe Inc.,Diversified Trust Co Increases Position in Adobe Inc. (NASDAQ:ADBE),diversified trust co grew holdings shares adobe inc nasdaq adbe free report th quarter according recent disclosure sec fund owned shar chars,0.0,0.05405405405405406,0.10000000000000002,https://www.etfdailynews.com/2025/01/08/diversified-trust-co-increases-position-in-adobe-inc-nasdaqadbe/,2025-01-08T09:48:46Z,ETF Daily News
2025-01-08,ADBE,Adobe Inc.,Wells Fargo & Company Cuts Adobe (NASDAQ:ADBE) Price Target to $640.00,adobe nasdaq adbe free report price objective lowered wells fargo amp company research report released tuesday benzinga reports wells fargo amp com chars,0.0,0.030303030303030304,0.2,https://www.etfdailynews.com/2025/01/08/wells-fargo-company-cuts-adobe-nasdaqadbe-price-target-to-640-00/,2025-01-08T10:52:50Z,ETF Daily News
2025-01-08,AMD,Advanced Micro Devices,AMD invests $20M in AI-powered drug discovery company Absci,advanced micro devices inc today announced invested million absci corp company using artificial intelligence develop new medicines amd also partner company chars,0.029411764705882353,0.08823529411764706,-0.0212121212121212,https://siliconangle.com/2025/01/08/amd-invests-20m-ai-powered-drug-discovery-company-absci/,2025-01-08T23:40:00Z,SiliconANGLE News
2025-01-08,AMD,Advanced Micro Devices,StockNews.com Upgrades Advanced Micro Devices (NASDAQ:AMD) to Hold,advanced micro devices nasdaq amd get free report upgraded equities research analysts stocknews com sell rating hold rating research report issued monday sever chars,0.0,0.08823529411764706,0.4,https://www.etfdailynews.com/2025/01/08/stocknews-com-upgrades-advanced-micro-devices-nasdaqamd-to-hold/,2025-01-08T06:38:49Z,ETF Daily News
2025-01-08,AMD,Advanced Micro Devices,Analyst overhauls AMD stock price target as gap with Nvidia widens,advanced micro devices shares extended recent run declines wednesday top wall street analyst cautioned chipmaker could continue trail peers performance well chars,0.0,0.09090909090909091,0.3,https://biztoc.com/x/67adb602d7ad2181,2025-01-08T12:10:12Z,Biztoc.com
2025-01-08,AMD,Advanced Micro Devices,Why AMD Stock Fell 11.9% in December and Lost Rebound Gains in 2025,advanced micro devices nasdaq amd stock saw significant sell offs december trading semiconductor company share price closed month according data amp p glo chars,0.0,0.0967741935483871,0.225,https://biztoc.com/x/c05507b24bd7480c,2025-01-08T16:34:46Z,Biztoc.com
2025-01-08,AMD,Advanced Micro Devices,Absci Stock Jumps As AMD Invests $20M To Boost AI Drug Discovery,ai drug creation company absci corporation nasdaq absi shares trading higher premarket wednesday company entered strategic collaboration advanced micro devices inc chars,0.0,0.0967741935483871,0.325,https://biztoc.com/x/edd6dc89120602c1,2025-01-08T16:24:24Z,Biztoc.com
2025-01-08,AMD,Advanced Micro Devices,Absci Stock Jumps As AMD Invests $20M To Boost AI Drug Discovery,ai drug creation company absci corporation nasdaq absi shares trading higher premarket wednesday company entered strategic collaboration advanced micro devices inc chars,0.0,0.0967741935483871,0.325,https://biztoc.com/x/160036d44619f04a,2025-01-08T14:22:28Z,Biztoc.com
2025-01-08,AMD,Advanced Micro Devices,AMD is creeping into gaming territory at CES 2025. Here's why Intel should be worried,kyle kucharski zdnet advanced micro devices amd announced next generation processors ces solidifying push pc gaming territory ryzen series amd ryzen z chars,0.030303030303030304,0.09090909090909091,0.2,https://www.zdnet.com/article/amd-is-creeping-into-gaming-territory-at-ces-2025-heres-why-intel-should-be-worried/,2025-01-08T00:10:00Z,ZDNet
2025-01-08,AFL,Aflac,StockNews.com Upgrades Aflac (NYSE:AFL) to Hold,aflac nyse afl get free report upgraded analysts stocknews com sell rating hold rating research note issued investors wednesday afl topic se chars,0.02631578947368421,0.02631578947368421,0.4,https://www.etfdailynews.com/2025/01/08/stocknews-com-upgrades-aflac-nyseafl-to-hold/,2025-01-08T07:14:53Z,ETF Daily News
2025-01-08,AFL,Aflac,"Aflac (NYSE:AFL) Stock Price Expected to Rise, Barclays Analyst Says",aflac nyse afl get free report target price boosted analysts barclays research note issued investors monday benzinga reports brokerage presentl chars,0.0,0.029411764705882353,0.4,https://www.etfdailynews.com/2025/01/08/aflac-nyseafl-stock-price-expected-to-rise-barclays-analyst-says/,2025-01-08T06:26:42Z,ETF Daily News
2025-01-08,A,Agilent Technologies,Yerba mate (Ilex paraguariensis) genome provides new insights into convergent evolution of caffeine biosynthesis,plant materials request detailed protocol paraguariensis st hil var paraguariensis cv ca inta eea cerro azul misiones argentina cv si establecimiento las mar c chars,0.034482758620689655,0.0,0.4,https://elifesciences.org/articles/104759,2025-01-08T00:00:00Z,Elifesciences.org
2025-01-08,APD,Air Products,"Air Products and Chemicals, Inc. (NYSE:APD) Stock Holdings Lowered by Nordea Investment Management AB",nordea investment management ab cut position air products chemicals inc nyse apd free report th quarter according company recent filing chars,0.0,0.05555555555555555,0.2,https://www.etfdailynews.com/2025/01/08/air-products-and-chemicals-inc-nyseapd-stock-holdings-lowered-by-nordea-investment-management-ab/,2025-01-08T09:04:52Z,ETF Daily News
2025-01-08,AKAM,Akamai Technologies,"Bank of New Hampshire Sells 866 Shares of Akamai Technologies, Inc. (NASDAQ:AKAM)",bank new hampshire trimmed stake akamai technologies inc nasdaq akam free report th quarter according recent filing securities exchange comm chars,0.0,0.02857142857142857,0.1787878787878788,https://www.etfdailynews.com/2025/01/08/bank-of-new-hampshire-sells-866-shares-of-akamai-technologies-inc-nasdaqakam/,2025-01-08T09:14:51Z,ETF Daily News
2025-01-08,ARE,Alexandria Real Estate Equities,ARE stock touches 52-week low at $96.31 amid market shifts,challenging real estate market alexandria real estate equities nyse stock reached week low dipping billion market cap reit maintains strong financials chars,0.0,0.18181818181818182,0.26666666666666666,https://www.investing.com/news/company-news/are-stock-touches-52week-low-at-9631-amid-market-shifts-93CH-3803399,2025-01-08T14:55:35Z,Investing.com
2025-01-08,ALGN,Align Technology,Align Technology (NASDAQ:ALGN) Upgraded at Leerink Partnrs,align technology nasdaq algn get free report upgraded investment analysts leerink partnrs hold rating strong buy rating note issued investors monday zacks com chars,0.0,0.06060606060606061,0.41666666666666663,https://www.etfdailynews.com/2025/01/08/align-technology-nasdaqalgn-upgraded-at-leerink-partnrs/,2025-01-08T06:38:49Z,ETF Daily News
2025-01-08,ALL,Allstate,"eBay - HP - 17.3"" Full HD Laptop - AMD Ryzen 5 - 8GB Memory - 512GB SSD $329.99",shop top brands laptops without overspending score deals hp dell lenovo apple asus favorite laptop brands,0.047619047619047616,0.0,0.5,https://www.dealcatcher.com/deals/computers-office/laptops/hp---full-hd-laptop---amd-ryzen---memory---ssd-998372919,2025-01-08T00:29:48Z,Dealcatcher.com
2025-01-08,ALL,Allstate,Barclays Issues Pessimistic Forecast for Allstate (NYSE:ALL) Stock Price,allstate nyse get free report price objective cut barclays note issued investors monday benzinga reports firm currently underweight chars,0.0,0.029411764705882353,0.05,https://www.etfdailynews.com/2025/01/08/barclays-issues-pessimistic-forecast-for-allstate-nyseall-stock-price/,2025-01-08T06:26:42Z,ETF Daily News
2025-01-08,MO,Altria,"Diversified Trust Co Acquires 39,465 Shares of Altria Group, Inc. (NYSE:MO)",diversified trust co lifted holdings altria group inc nyse mo free report fourth quarter according company recent f filing securities chars,0.0,0.027777777777777776,0.13333333333333333,https://www.etfdailynews.com/2025/01/08/diversified-trust-co-acquires-39465-shares-of-altria-group-inc-nysemo/,2025-01-08T09:16:51Z,ETF Daily News
2025-01-08,MO,Altria,"First County Bank CT Lowers Holdings in Altria Group, Inc. (NYSE:MO)",first county bank ct decreased stake altria group inc nyse mo free report fourth quarter according recent disclosure securities amp exchange co chars,0.0,0.02857142857142857,0.05,https://www.etfdailynews.com/2025/01/08/first-county-bank-ct-lowers-holdings-in-altria-group-inc-nysemo/,2025-01-08T10:24:51Z,ETF Daily News
2025-01-08,AMZN,Amazon,Dumb Trading,apple aapl google googl microsoft msft amazon amzn bitcoin btc,0.0,0.1,0.0,https://dumbtrading.com/,2025-01-08T19:24:18Z,Dumbtrading.com
2025-01-08,AMZN,Amazon,"Apple, Nvidia, Microsoft, Amazon, and Alphabet Drive S&P 500 Market Concentration to ...",apple aapl financials nvidia nvda financials microsoft msft financials amazon amzn financials alphabet goog financials googl financials together accounting chars,0.0,0.038461538461538464,0.0,https://finance.yahoo.com/news/apple-nvidia-microsoft-amazon-alphabet-205532443.html,2025-01-08T20:55:32Z,Yahoo Entertainment
2025-01-08,AMZN,Amazon,Could Buying Alibaba Stock Today Set You Up for Life?,past alibaba nyse baba often viewed amazon nasdaq amzn china stocks two companies completely different paths past decade amazo chars,0.0,0.02702702702702703,-0.16666666666666666,https://biztoc.com/x/d17bf9ee5fc97250,2025-01-08T10:20:05Z,Biztoc.com
2025-01-08,AEP,American Electric Power,American Electric Power Names Trevor Mihalik as CFO in Succession Plan,american electric power nasdaq aep announced today appointment trevor mihalik new executive vice president chief financial officer slated commence january mihalik w chars,0.0,0.09090909090909091,0.04545454545454545,https://www.etfdailynews.com/2025/01/08/american-electric-power-names-trevor-mihalik-as-cfo-in-succession-plan/,2025-01-08T09:10:57Z,ETF Daily News
2025-01-08,AEP,American Electric Power,"Nordea Investment Management AB Reduces Stock Position in American Electric Power Company, Inc. (NASDAQ:AEP)",nordea investment management ab lowered stake shares american electric power company inc nasdaq aep free report fourth quarter according recent form f f chars,0.0,0.08571428571428572,0.1,https://www.etfdailynews.com/2025/01/08/nordea-investment-management-ab-reduces-stock-position-in-american-electric-power-company-inc-nasdaqaep/,2025-01-08T10:06:59Z,ETF Daily News
2025-01-08,AEP,American Electric Power,"Analysts Set American Electric Power Company, Inc. (NASDAQ:AEP) PT at $97.13",american electric power company inc nasdaq aep get free report received consensus rating hold fifteen ratings firms presently covering company marketbeat ratin chars,0.0,0.09375,0.13333333333333333,https://www.etfdailynews.com/2025/01/08/analysts-set-american-electric-power-company-inc-nasdaqaep-pt-at-97-13/,2025-01-08T08:34:46Z,ETF Daily News
2025-01-08,AXP,American Express,American Express (NYSE:AXP) Now Covered by Analysts at Truist Financial,truist financial assumed coverage shares american express nyse axp research report sent investors tuesday morning benzinga reports brokerage issued buy rating chars,0.0,0.06060606060606061,0.0,https://www.etfdailynews.com/2025/01/08/american-express-nyseaxp-now-covered-by-analysts-at-truist-financial/,2025-01-08T10:22:58Z,ETF Daily News
2025-01-08,AXP,American Express,American Express (NYSE:AXP) Stake Cut by CWA Asset Management Group LLC,cwa asset management group llc decreased holdings shares american express nyse axp th quarter according company recent disclosure securities chars,0.0,0.05714285714285714,-0.13333333333333333,https://www.etfdailynews.com/2025/01/08/american-express-nyseaxp-stake-cut-by-cwa-asset-management-group-llc/,2025-01-08T09:04:53Z,ETF Daily News
2025-01-08,AIG,American International Group,Bowie Promoted to CEO of MGU Private Client Select Insurance,managing general underwriter private client select insurance services majority owned stone point capital american international group aig said ross bowie appointed chief executive chars,0.0,0.10344827586206896,0.012500000000000004,https://www.insurancejournal.com/news/national/2025/01/08/807475.htm,2025-01-08T22:24:14Z,Insurance Journal
2025-01-08,AMT,American Tower,First County Bank CT Sells 96 Shares of American Tower Co. (NYSE:AMT),first county bank ct trimmed holdings american tower co nyse amt free report th quarter according recent disclosure securities exchange commissio chars,0.0,0.05714285714285714,0.1625,https://www.etfdailynews.com/2025/01/08/first-county-bank-ct-sells-96-shares-of-american-tower-co-nyseamt/,2025-01-08T09:20:54Z,ETF Daily News
2025-01-08,ADI,Analog Devices,"Analog Devices, Inc. (NASDAQ:ADI) Shares Sold by First County Bank CT",first county bank ct decreased holdings shares analog devices inc nasdaq adi free report th quarter according company recent disclosure chars,0.0,0.027777777777777776,0.0625,https://www.etfdailynews.com/2025/01/08/analog-devices-inc-nasdaqadi-shares-sold-by-first-county-bank-ct/,2025-01-08T10:24:49Z,ETF Daily News
2025-01-08,AON,Aon,"Aon Appoints Lloyd’s CEO Neal as CEO of Reinsurance, Chairman of Climate Solutions",insurance broker aon plc announced appointment john neal global ceo reinsurance chairman climate solutions effective following conclusion neal notice period lloyd chars,0.030303030303030304,0.030303030303030304,0.19999999999999998,https://www.insurancejournal.com/news/international/2025/01/08/807326.htm,2025-01-08T15:04:08Z,Insurance Journal
2025-01-08,APA,APA Corporation,"APA Corporation Announces Expiration and Final Results of Private Exchange Offers, Tender Offers, and Consent Solicitations and Waiver of Financing Condition",houston jan globe newswire apa corporation apa nasdaq apa announced today final results p new york city time january expiration time p chars,0.02702702702702703,0.05405405405405406,0.06818181818181818,https://www.investing.com/news/press-releases/apa-corporation-announces-expiration-and-final-results-of-private-exchange-offers-tender-offers-and-consent-solicitations-and-waiver-of-financing-condition-93CH-3803101,2025-01-08T13:52:05Z,Investing.com
2025-01-08,APA,APA Corporation,"APA Corporation Announces Expiration and Final Results of Private Exchange Offers, Tender Offers, and Consent Solicitations and Waiver of Financing Condition",houston jan globe newswire apa corporation apa nasdaq apa announced today final results p new york city time january expiration time p chars,0.02702702702702703,0.05405405405405406,0.06818181818181818,https://www.globenewswire.com/news-release/2025/01/08/3006218/0/en/APA-Corporation-Announces-Expiration-and-Final-Results-of-Private-Exchange-Offers-Tender-Offers-and-Consent-Solicitations-and-Waiver-of-Financing-Condition.html,2025-01-08T13:00:00Z,GlobeNewswire
2025-01-08,APA,APA Corporation,APA Co. (NASDAQ:APA) Given Consensus Recommendation of “Hold” by Analysts,apa co nasdaq apa get free report assigned consensus rating hold nineteen analysts covering firm marketbeat reports four equities research analysts r chars,0.029411764705882353,0.029411764705882353,0.1,https://www.etfdailynews.com/2025/01/08/apa-co-nasdaqapa-given-consensus-recommendation-of-hold-by-analysts/,2025-01-08T08:20:52Z,ETF Daily News
2025-01-08,AAPL,Apple Inc.,Apple Inc. (NASDAQ:AAPL) Shares Sold by Capital Wealth Alliance LLC,capital wealth alliance llc trimmed stake shares apple inc nasdaq aapl free report third quarter according recent f filing securities exchan chars,0.0,0.05555555555555555,0.13333333333333333,https://www.etfdailynews.com/2025/01/08/apple-inc-nasdaqaapl-shares-sold-by-capital-wealth-alliance-llc/,2025-01-08T08:08:45Z,ETF Daily News
2025-01-08,AAPL,Apple Inc.,Apple Inc. (NASDAQ:AAPL) Stake Boosted by Wetzel Investment Advisors Inc.,wetzel investment advisors inc lifted stake apple inc nasdaq aapl free report third quarter according recent disclosure securities exchange commi chars,0.0,0.08823529411764706,0.13333333333333333,https://www.etfdailynews.com/2025/01/08/apple-inc-nasdaqaapl-stake-boosted-by-wetzel-investment-advisors-inc/,2025-01-08T08:08:46Z,ETF Daily News
2025-01-08,AAPL,Apple Inc.,"Signify Wealth Sells 3,345 Shares of Apple Inc. (NASDAQ:AAPL)",signify wealth reduced stake shares apple inc nasdaq aapl free report rd quarter according recent disclosure securities exchange commission chars,0.0,0.05714285714285714,0.2,https://www.etfdailynews.com/2025/01/08/signify-wealth-sells-3345-shares-of-apple-inc-nasdaqaapl/,2025-01-08T08:08:46Z,ETF Daily News
2025-01-08,AAPL,Apple Inc.,Intact Investment Management Inc. Boosts Position in Apple Inc. (NASDAQ:AAPL),intact investment management inc grew stake apple inc nasdaq aapl free report rd quarter according recent filing securities exchange commission chars,0.0,0.08823529411764706,0.2,https://www.etfdailynews.com/2025/01/08/intact-investment-management-inc-boosts-position-in-apple-inc-nasdaqaapl/,2025-01-08T08:08:46Z,ETF Daily News
2025-01-08,AAPL,Apple Inc.,Brokerages Set Apple Inc. (NASDAQ:AAPL) Target Price at $238.03,shares apple inc nasdaq aapl get free report received consensus rating moderate buy thirty seven research firms currently covering firm marketbeat ratings r chars,0.0,0.06060606060606061,0.05,https://www.etfdailynews.com/2025/01/08/brokerages-set-apple-inc-nasdaqaapl-target-price-at-238-03/,2025-01-08T08:50:51Z,ETF Daily News
2025-01-08,AAPL,Apple Inc.,"Silicon Valley Capital Partners Buys 28,799 Shares of Apple Inc. (NASDAQ:AAPL)",silicon valley capital partners boosted position shares apple inc nasdaq aapl free report third quarter according company recent f filing chars,0.0,0.05555555555555555,0.13333333333333333,https://www.etfdailynews.com/2025/01/08/silicon-valley-capital-partners-buys-28799-shares-of-apple-inc-nasdaqaapl/,2025-01-08T08:08:46Z,ETF Daily News
2025-01-08,AAPL,Apple Inc.,Apple Inc. (NASDAQ:AAPL) Holdings Lifted by Asset Management One Co. Ltd.,asset management one co ltd increased position shares apple inc nasdaq aapl free report third quarter according recent filing securities amp chars,0.0,0.05714285714285714,0.13333333333333333,https://www.etfdailynews.com/2025/01/08/apple-inc-nasdaqaapl-holdings-lifted-by-asset-management-one-co-ltd/,2025-01-08T08:08:45Z,ETF Daily News
2025-01-08,AAPL,Apple Inc.,Mn Services Vermogensbeheer B.V. Has $667.08 Million Stock Holdings in Apple Inc. (NASDAQ:AAPL),mn services vermogensbeheer b v lessened stake apple inc nasdaq aapl free report third quarter holdings channel reports firm owned shares iphone chars,0.0,0.06060606060606061,0.06666666666666667,https://www.etfdailynews.com/2025/01/08/mn-services-vermogensbeheer-b-v-has-667-08-million-stock-holdings-in-apple-inc-nasdaqaapl/,2025-01-08T08:08:45Z,ETF Daily News
2025-01-08,AAPL,Apple Inc.,New England Capital Financial Advisors LLC Cuts Stake in Apple Inc. (NASDAQ:AAPL),new england capital financial advisors llc lessened holdings shares apple inc nasdaq aapl free report rd quarter according company recent f filing chars,0.0,0.05555555555555555,0.1340909090909091,https://www.etfdailynews.com/2025/01/08/new-england-capital-financial-advisors-llc-cuts-stake-in-apple-inc-nasdaqaapl/,2025-01-08T08:08:46Z,ETF Daily News
2025-01-08,AAPL,Apple Inc.,Apple and Nvidia 2025 top picks at Argus,investing com argus apple inc nasdaq aapl nvidia corporation nasdaq nvda one top stock picks given leadership generative ai hardware innovation apple tar chars,0.0,0.03125,0.5,https://www.investing.com/news/stock-market-news/apple-and-nvidia-2025-top-picks-at-argus-3803852,2025-01-08T20:57:08Z,Investing.com
2025-01-08,ANET,Arista Networks,"Charles H. Giancarlo Sells 8,000 Shares of Arista Networks, Inc. (NYSE:ANET) Stock",arista networks inc nyse anet get free report director charles h giancarlo sold shares stock transaction thursday january nd shares sold average price chars,0.0,0.027777777777777776,0.125,https://www.etfdailynews.com/2025/01/08/charles-h-giancarlo-sells-8000-shares-of-arista-networks-inc-nyseanet-stock/,2025-01-08T09:12:53Z,ETF Daily News
2025-01-08,T,AT&T,Jockeying for desks and parking: AT&T workers say the 5-day office return is off to a bumpy start,one several major firms requiring office workers work site five days week kena betancur viewpress getty images ul li began implementing staggered five day return chars,0.0,0.03571428571428571,0.03125,https://www.businessinsider.com/att-begins-5-days-office-mandate-desks-parking-2025-1,2025-01-08T09:53:02Z,Business Insider
2025-01-08,ADP,Automatic Data Processing,"Range Financial Group LLC Has $390,000 Stock Holdings in Automatic Data Processing, Inc. (NASDAQ:ADP)",range financial group llc boosted holdings shares automatic data processing inc nasdaq adp free report th quarter holdings channel reports institutional inv chars,0.0,0.0625,0.2,https://www.etfdailynews.com/2025/01/08/range-financial-group-llc-has-390000-stock-holdings-in-automatic-data-processing-inc-nasdaqadp/,2025-01-08T12:00:43Z,ETF Daily News
2025-01-08,ADP,Automatic Data Processing,"David Foskett Sells 1,004 Shares of Automatic Data Processing, Inc. (NASDAQ:ADP) Stock",automatic data processing inc nasdaq adp get free report vp david foskett sold shares stock transaction occurred monday january th stock sold average chars,0.0,0.05405405405405406,0.125,https://www.etfdailynews.com/2025/01/08/david-foskett-sells-1004-shares-of-automatic-data-processing-inc-nasdaqadp-stock/,2025-01-08T11:28:51Z,ETF Daily News
2025-01-08,AVB,AvalonBay Communities,"Nordea Investment Management AB Has $69.15 Million Stake in AvalonBay Communities, Inc. (NYSE:AVB)",nordea investment management ab lifted stake avalonbay communities inc nyse avb free report fourth quarter according company recent disclosure th chars,0.0,0.029411764705882353,0.13333333333333333,https://www.etfdailynews.com/2025/01/08/nordea-investment-management-ab-has-69-15-million-stake-in-avalonbay-communities-inc-nyseavb/,2025-01-08T09:03:07Z,ETF Daily News
2025-01-08,BKR,Baker Hughes,Nordea Investment Management AB Boosts Stock Position in Baker Hughes (NASDAQ:BKR),nordea investment management ab increased position baker hughes nasdaq bkr free report th quarter according recent f filing sec firm owned chars,0.0,0.05555555555555555,0.02500000000000001,https://www.etfdailynews.com/2025/01/08/nordea-investment-management-ab-boosts-stock-position-in-baker-hughes-nasdaqbkr/,2025-01-08T09:03:06Z,ETF Daily News
2025-01-08,BKR,Baker Hughes,"Bank of New Hampshire Sells 1,025 Shares of Baker Hughes (NASDAQ:BKR)",bank new hampshire decreased holdings shares baker hughes nasdaq bkr free report fourth quarter according recent f filing securities excha chars,0.0,0.05555555555555555,0.02727272727272727,https://www.etfdailynews.com/2025/01/08/bank-of-new-hampshire-sells-1025-shares-of-baker-hughes-nasdaqbkr/,2025-01-08T09:46:47Z,ETF Daily News
2025-01-08,BALL,Ball Corporation,Citigroup Has Lowered Expectations for Ball (NYSE:BALL) Stock Price,ball nyse ball get free report price target decreased stock analysts citigroup research report issued monday benzinga reports firm presently chars,0.02857142857142857,0.02857142857142857,-0.05,https://www.etfdailynews.com/2025/01/08/citigroup-has-lowered-expectations-for-ball-nyseball-stock-price/,2025-01-08T06:54:49Z,ETF Daily News
2025-01-08,BAC,Bank of America,UBS Group Upgrades Bank of America (NYSE:BAC) to “Buy”,ubs group upgraded shares bank america nyse bac neutral rating buy rating research note released tuesday marketbeat com reports currently target price chars,0.0,0.11428571428571428,0.0,https://www.etfdailynews.com/2025/01/08/ubs-group-upgrades-bank-of-america-nysebac-to-buy/,2025-01-08T10:07:00Z,ETF Daily News
2025-01-08,BAC,Bank of America,First County Bank CT Decreases Position in Bank of America Co. (NYSE:BAC),first county bank ct lowered position bank america co nyse bac fourth quarter according company recent form f filing securities amp excha chars,0.0,0.10810810810810811,0.08333333333333333,https://www.etfdailynews.com/2025/01/08/first-county-bank-ct-decreases-position-in-bank-of-america-co-nysebac/,2025-01-08T11:30:44Z,ETF Daily News
