Date,Ticker,Company_Name,Title,Cleaned_Content,Density_Ticker,Density_Company,Sentiment,Url,PublishedAt,Source
2025-01-08,MS,Morgan Stanley,Bangor Savings Bank Acquires 183 Shares of Morgan Stanley (NYSE:MS),bangor savings bank boosted holdings morgan stanley nyse ms free report fourth quarter according company recent disclosure sec firm chars,0.0,0.05555555555555555,0.020000000000000007,https://www.etfdailynews.com/2025/01/08/bangor-savings-bank-acquires-183-shares-of-morgan-stanley-nysems/,2025-01-08T09:46:48Z,ETF Daily News
2025-01-08,MS,Morgan Stanley,"Morgan Stanley (NYSE:MS) Stock Price Expected to Rise, Barclays Analyst Says",morgan stanley nyse ms get free report target price lifted analysts barclays report issued monday benzinga reports firm currently overwe chars,0.0,0.05714285714285714,0.06666666666666667,https://www.etfdailynews.com/2025/01/08/morgan-stanley-nysems-stock-price-expected-to-rise-barclays-analyst-says/,2025-01-08T09:02:54Z,ETF Daily News
2025-01-08,MSI,Motorola Solutions,"Nordea Investment Management AB Sells 3,672 Shares of Motorola Solutions, Inc. (NYSE:MSI)",nordea investment management ab decreased position shares motorola solutions inc nyse msi free report fourth quarter holdingschannel reports firm owned sh chars,0.0,0.03125,-0.05,https://www.etfdailynews.com/2025/01/08/nordea-investment-management-ab-sells-3672-shares-of-motorola-solutions-inc-nysemsi/,2025-01-08T09:04:57Z,ETF Daily News
2025-01-08,MSCI,MSCI,iShares MSCI EAFE ETF (NYSEARCA:EFA) Shares Bought by CWA Asset Management Group LLC,cwa asset management group llc raised position ishares msci eafe etf nysearca efa free report th quarter according recent filing sec firm owned chars,0.02631578947368421,0.02631578947368421,0.02500000000000001,https://www.etfdailynews.com/2025/01/08/ishares-msci-eafe-etf-nysearcaefa-shares-bought-by-cwa-asset-management-group-llc/,2025-01-08T09:06:51Z,ETF Daily News
2025-01-08,MSCI,MSCI,"Bangor Savings Bank Purchases Shares of 1,560 iShares MSCI Eurozone ETF (BATS:EZU)",bangor savings bank purchased new stake ishares msci eurozone etf bats ezu free report th quarter holdingschannel reports fund purchased shares company stock va chars,0.029411764705882353,0.029411764705882353,0.2681818181818182,https://www.etfdailynews.com/2025/01/08/bangor-savings-bank-purchases-shares-of-1560-ishares-msci-eurozone-etf-batsezu/,2025-01-08T09:14:50Z,ETF Daily News
2025-01-08,MSCI,MSCI,iShares MSCI Netherlands ETF (NYSEARCA:EWN) Share Price Pass Above 50-Day Moving Average – Time to Sell?,ishares msci netherlands etf nysearca ewn get free report share price passed day moving average trading tuesday stock day moving average trad chars,0.02702702702702703,0.02702702702702703,0.03333333333333333,https://www.etfdailynews.com/2025/01/08/ishares-msci-netherlands-etf-nysearcaewn-share-price-pass-above-50-day-moving-average-time-to-sell/,2025-01-08T10:46:54Z,ETF Daily News
2025-01-08,MSCI,MSCI,Jane Street Group LLC Lowers Stake in Invesco MSCI Global Timber ETF (NYSEARCA:CUT),jane street group llc decreased holdings invesco msci global timber etf nysearca cut free report third quarter holdings channel com reports firm owned shares chars,0.029411764705882353,0.029411764705882353,-0.04,https://www.etfdailynews.com/2025/01/08/jane-street-group-llc-lowers-stake-in-invesco-msci-global-timber-etf-nysearcacut/,2025-01-08T08:13:01Z,ETF Daily News
2025-01-08,MSCI,MSCI,"Canandaigua National Bank & Trust Co. Has $240,000 Stake in iShares MSCI EAFE Value ETF (BATS:EFV)",canandaigua national bank amp trust co lowered holdings shares ishares msci eafe value etf bats efv free report fourth quarter holdingschannel reports firm chars,0.029411764705882353,0.029411764705882353,0.06666666666666667,https://www.etfdailynews.com/2025/01/08/canandaigua-national-bank-trust-co-has-240000-stake-in-ishares-msci-eafe-value-etf-batsefv/,2025-01-08T09:08:51Z,ETF Daily News
2025-01-08,MSCI,MSCI,Analysts Set MSCI Inc. (NYSE:MSCI) PT at $645.67,msci inc nyse msci get free report given consensus recommendation moderate buy thirteen research firms currently covering stock marketbeat ratings reports chars,0.030303030303030304,0.030303030303030304,0.13333333333333333,https://www.etfdailynews.com/2025/01/08/analysts-set-msci-inc-nysemsci-pt-at-645-67/,2025-01-08T06:34:54Z,ETF Daily News
2025-01-08,MSCI,MSCI,iShares MSCI Water Management Multisector ETF (NASDAQ:IWTR) Stock Price Down 0.7% – Here’s What Happened,ishares msci water management multisector etf nasdaq iwtr get free report shares mid day trading tuesday company traded low last traded chars,0.027777777777777776,0.027777777777777776,0.1,https://www.etfdailynews.com/2025/01/08/ishares-msci-water-management-multisector-etf-nasdaqiwtr-stock-price-down-0-7-heres-what-happened/,2025-01-08T08:22:56Z,ETF Daily News
2025-01-08,MSCI,MSCI,iShares Paris-Aligned Climate MSCI World ex USA ETF (NASDAQ:PABD) Shares Down 0.1% – Time to Sell?,shares ishares paris aligned climate msci world ex usa etf nasdaq pabd get free report dropped mid day trading tuesday company traded low last traded chars,0.02702702702702703,0.02702702702702703,0.1,https://www.etfdailynews.com/2025/01/08/ishares-paris-aligned-climate-msci-world-ex-usa-etf-nasdaqpabd-shares-down-0-1-time-to-sell/,2025-01-08T08:54:49Z,ETF Daily News
2025-01-08,MSCI,MSCI,Own the Vanguard International Shares ETF (VGS)? You banked 30% in 2024,vanguard msci index international shares etf asx vgs one popular index funds asx fact currently second popular asx index fund track austr chars,0.02702702702702703,0.02702702702702703,0.3,https://www.fool.com.au/2025/01/08/own-the-vanguard-international-shares-etf-vgs-you-banked-30-in-2024/,2025-01-08T01:49:43Z,Motley Fool Australia
2025-01-08,NDAQ,"Nasdaq, Inc.","Nordea Investment Management AB Purchases 373,376 Shares of Nasdaq, Inc. (NASDAQ:NDAQ)",nordea investment management ab raised position nasdaq inc nasdaq ndaq free report th quarter according company recent disclosure securit chars,0.0,0.058823529411764705,0.2,https://www.etfdailynews.com/2025/01/08/nordea-investment-management-ab-purchases-373376-shares-of-nasdaq-inc-nasdaqndaq/,2025-01-08T09:04:54Z,ETF Daily News
2025-01-08,NFLX,Netflix,"2 Unstoppable Streaming Stocks to Buy Hand Over Fist in 2025, According to Wall Street",spotify technology nyse spot operates world largest music streaming platform whereas netflix nasdaq nflx dominant streaming provider movies tv shows spotify stock soared chars,0.0,0.03225806451612903,0.0,https://biztoc.com/x/7239ca9c3c2527ef,2025-01-08T11:26:09Z,Biztoc.com
2025-01-08,NEM,Newmont,Is this the best ASX 200 gold stock to own in 2025?,amp p asx index asx xjo gold stock newmont corp asx nem good start newmont share price closed december shares trading time chars,0.0,0.05128205128205128,0.3,https://www.fool.com.au/2025/01/08/is-this-the-best-asx-200-gold-stock-to-own-in-2025/,2025-01-08T03:56:34Z,Motley Fool Australia
2025-01-08,NEE,NextEra Energy,"Diversified Trust Co Has $2.33 Million Holdings in NextEra Energy, Inc. (NYSE:NEE)",diversified trust co lifted position shares nextera energy inc nyse nee free report th quarter holdingschannel reports fund owned shares utilit chars,0.0,0.029411764705882353,0.4,https://www.etfdailynews.com/2025/01/08/diversified-trust-co-has-2-33-million-holdings-in-nextera-energy-inc-nysenee/,2025-01-08T09:16:50Z,ETF Daily News
2025-01-08,NDSN,Nordson Corporation,"Everence Capital Management Inc. Sells 1,340 Shares of Nordson Co. (NASDAQ:NDSN)",everence capital management inc trimmed holdings nordson co nasdaq ndsn free report th quarter according recent filing securities exchange comm chars,0.0,0.029411764705882353,0.2,https://www.etfdailynews.com/2025/01/08/everence-capital-management-inc-sells-1340-shares-of-nordson-co-nasdaqndsn/,2025-01-08T09:00:49Z,ETF Daily News
2025-01-08,NTRS,Northern Trust,Northern Trust (NASDAQ:NTRS) Coverage Initiated by Analysts at Truist Financial,truist financial assumed coverage shares northern trust nasdaq ntrs free report research report report published tuesday morning benzinga reports firm issued hold rating chars,0.0,0.06060606060606061,0.06666666666666667,https://www.etfdailynews.com/2025/01/08/northern-trust-nasdaqntrs-coverage-initiated-by-analysts-at-truist-financial/,2025-01-08T10:23:05Z,ETF Daily News
2025-01-08,NOC,Northrop Grumman,Northrop Grumman Co. (NYSE:NOC) Receives $553.27 Average Target Price from Analysts,shares northrop grumman co nyse noc get free report assigned consensus rating hold fifteen research firms currently covering stock marketbeat reports chars,0.0,0.058823529411764705,0.2,https://www.etfdailynews.com/2025/01/08/northrop-grumman-co-nysenoc-receives-553-27-average-target-price-from-analysts/,2025-01-08T07:50:52Z,ETF Daily News
2025-01-08,NCLH,Norwegian Cruise Line Holdings,"NCL Corporation Ltd. Announces Pricing of $1,800 Million of Senior Notes",miami jan globe newswire ncl corporation ltd nclc subsidiary norwegian cruise line holdings ltd nyse nclh announced today priced million aggregate pri chars,0.0,0.12121212121212122,0.0,https://www.globenewswire.com/news-release/2025/01/08/3005913/24500/en/NCL-Corporation-Ltd-Announces-Pricing-of-1-800-Million-of-Senior-Notes.html,2025-01-08T00:37:00Z,GlobeNewswire
2025-01-08,NRG,NRG Energy,"Robert J. Gaudette Sells 60,000 Shares of NRG Energy, Inc. (NYSE:NRG) Stock",nrg energy inc nyse nrg get free report vp robert j gaudette sold shares business stock transaction dated thursday january nd stock sold average price chars,0.02631578947368421,0.02631578947368421,0.125,https://www.etfdailynews.com/2025/01/08/robert-j-gaudette-sells-60000-shares-of-nrg-energy-inc-nysenrg-stock/,2025-01-08T09:12:53Z,ETF Daily News
2025-01-08,NVDA,Nvidia,Nvidia's CEO says 'useful' quantum computers are decades away — and the stocks tank,story nvidia nvda chief executive jensen huang doesnt think useful quantum computers anytime soon stocks reacting well quantum computing stocks suc chars,0.0,0.029411764705882353,0.3,https://qz.com/nvidia-jensen-huang-quantum-computers-stocks-chips-ces-1851735179,2025-01-08T16:45:00Z,Quartz India
2025-01-08,NVDA,Nvidia,Veteran analyst early to quantum computing stocks revamps outlook after stocks get clobbered,something said well jensen huang ceo ai chipmaking empire nvidia nvda yeah actually related fund manager forecast nvidias rally makes surprising move c chars,0.0,0.029411764705882353,0.35,https://biztoc.com/x/9ef2e2a0befa5a95,2025-01-08T23:56:28Z,Biztoc.com
2025-01-08,NVDA,Nvidia,"Apple, Nvidia, Microsoft, Amazon, and Alphabet Drive S&P 500 Market Concentration to ...",apple aapl financials nvidia nvda financials microsoft msft financials amazon amzn financials alphabet goog financials googl financials together accounting chars,0.0,0.038461538461538464,0.0,https://finance.yahoo.com/news/apple-nvidia-microsoft-amazon-alphabet-205532443.html,2025-01-08T20:55:32Z,Yahoo Entertainment
2025-01-08,NVDA,Nvidia,Stock Market Today: Dow Jones Falls After Jobs Data As Fed Minutes Loom; Nvidia Tries To Bounce From Key Level (Live Coverage),dow jones industrial average fell early trades wednesday mixed jobs data nvidia nvda slightly higher suffering huge drop tuesday amp p fell chars,0.0,0.027777777777777776,0.12000000000000002,https://www.investors.com/market-trend/stock-market-today/dow-jones-sp500-nasdaq-nvidia-nvda-stock-ai/,2025-01-08T15:46:52Z,Investor's Business Daily
2025-01-08,NVDA,Nvidia,Benchmark Reaffirms “Buy” Rating for NVIDIA (NASDAQ:NVDA),benchmark reiterated buy rating shares nvidia nasdaq nvda free report research report released tuesday benzinga reports benchmark currently price objective chars,0.0,0.03125,0.13333333333333333,https://www.etfdailynews.com/2025/01/08/benchmark-reaffirms-buy-rating-for-nvidia-nasdaqnvda/,2025-01-08T10:23:11Z,ETF Daily News
2025-01-08,NVDA,Nvidia,Nvidia Joins Breakout Brigade — But Watch These 3 Telltale Clues,expanding artificial intelligence reach automotive robotics initiatives ces nvidia nvda weathered recent volatility breaking yet another record high tuesday befo chars,0.0,0.03225806451612903,-0.14666666666666664,https://biztoc.com/x/a13857dd0553057a,2025-01-08T13:16:22Z,Biztoc.com
2025-01-08,NVDA,Nvidia,Fund manager who forecast Nvidia’s rally makes surprising move after CES keynote,chatgpt moment general robotics around corner nvidia said ces investors however impressed dont miss move sign thestreets free daily newsletter nvi chars,0.0,0.03125,0.36250000000000004,https://biztoc.com/x/f17b3cae3e38342b,2025-01-08T16:46:00Z,Biztoc.com
2025-01-08,NVDA,Nvidia,Billionaire Nvidia CEO Huang Loses $8 Billion on Company News,ai chip service company nvidia corp nasdaq nvda suffered stock sell announcing several new initiatives took net worth ceo jensen huang billion chars,0.0,0.027777777777777776,0.10909090909090909,https://biztoc.com/x/1149ca386537ec2f,2025-01-08T14:11:42Z,Biztoc.com
2025-01-08,NVDA,Nvidia,The Ultimate Guide to Investing in Nvidia for Maximum Returns,nvidia nasdaq nvda one greatest growth stocks recent history past decade chipmaker share price adjusted splits soared would turned chars,0.0,0.02857142857142857,0.25,https://biztoc.com/x/250784cc6abf18a6,2025-01-08T11:26:22Z,Biztoc.com
2025-01-08,NVDA,Nvidia,NVIDIA Co. (NASDAQ:NVDA) Shares Sold by Lathrop Investment Management Corp,lathrop investment management corp trimmed position shares nvidia co nasdaq nvda free report rd quarter holdings channel com reports firm owned shares chars,0.0,0.029411764705882353,0.1,https://www.etfdailynews.com/2025/01/08/nvidia-co-nasdaqnvda-shares-sold-by-lathrop-investment-management-corp/,2025-01-08T08:08:45Z,ETF Daily News
2025-01-08,NVDA,Nvidia,"Dow Jones Futures Fall Ahead Of Jobs Reports, Fed Minutes; Nvidia Bounces From Key Level",dow jones industrial average major indexes traded lower wednesday ahead critical employment reports later minutes latest federal reserve meeting nvidia nvda bounce chars,0.0,0.03225806451612903,0.08249999999999999,https://biztoc.com/x/ff34997ed81fcd45,2025-01-08T13:16:50Z,Biztoc.com
2025-01-08,NVDA,Nvidia,"Investors Can't Quit Nvidia, Tesla And Huge Bitcoin Holder, Schwab Says",investors brokerage charles schwab schw increased equities holdings december seems enough nvidia nvda stock tech titan top pick month chars,0.0,0.02857142857142857,0.25,https://biztoc.com/x/f5a2e929e09a8537,2025-01-08T13:16:44Z,Biztoc.com
2025-01-08,NVDA,Nvidia,Prediction: This 1 Artificial Intelligence Development Will Be a Once-in-a-Generation Opportunity for Nvidia,nvidia nasdaq nvda already soared first stages artificial intelligence ai story company designs sought graphic processing units gpus chips power chars,0.0,0.030303030303030304,-0.11666666666666665,https://biztoc.com/x/0d836328b41d0bb8,2025-01-08T10:19:56Z,Biztoc.com
2025-01-08,NVDA,Nvidia,"Rigetti, IonQ stocks plunge after Nvidia CEO says 'useful' quantum computing is decades away",ionq ionq quantum computing stocks fell wednesday nvidia nvda ceo jensen huang told wall street analysts useful quantum computers likely years aw chars,0.0,0.02857142857142857,0.15,https://biztoc.com/x/1fa426214e5aebd2,2025-01-08T17:52:01Z,Biztoc.com
2025-01-08,NVDA,Nvidia,Apple and Nvidia 2025 top picks at Argus,investing com argus apple inc nasdaq aapl nvidia corporation nasdaq nvda one top stock picks given leadership generative ai hardware innovation apple tar chars,0.0,0.03125,0.5,https://www.investing.com/news/stock-market-news/apple-and-nvidia-2025-top-picks-at-argus-3803852,2025-01-08T20:57:08Z,Investing.com
2025-01-08,NVDA,Nvidia,Stock Market Today: Dow Jones Falls After Jobs Data As Fed Minutes Loom; Nvidia Tries To Bounce From Key Level (Live Coverage),dow jones industrial average fell early trades wednesday mixed jobs data nvidia nvda slightly higher suffering huge drop tuesday amp p fell chars,0.0,0.027777777777777776,0.12000000000000002,https://biztoc.com/x/f6ca9bba64025023,2025-01-08T16:01:44Z,Biztoc.com
2025-01-08,NVDA,Nvidia,German American Bancorp Inc. Boosts Position in NVIDIA Co. (NASDAQ:NVDA),german american bancorp inc lifted position nvidia co nasdaq nvda free report rd quarter according recent f filing securities exchange commiss chars,0.0,0.02857142857142857,0.1,https://www.etfdailynews.com/2025/01/08/german-american-bancorp-inc-boosts-position-in-nvidia-co-nasdaqnvda/,2025-01-08T08:08:44Z,ETF Daily News
2025-01-08,NVDA,Nvidia,Pacer Advisors Inc. Has $289.66 Million Position in NVIDIA Co. (NASDAQ:NVDA),pacer advisors inc decreased position shares nvidia co nasdaq nvda free report rd quarter holdings channel reports institutional investor owned sha chars,0.0,0.03125,0.0,https://www.etfdailynews.com/2025/01/08/pacer-advisors-inc-has-289-66-million-position-in-nvidia-co-nasdaqnvda/,2025-01-08T08:08:45Z,ETF Daily News
2025-01-08,NVDA,Nvidia,Yahav Achim Ve Achayot Provident Funds Management Co Ltd. Cuts Stake in NVIDIA Co. (NASDAQ:NVDA),yahav achim achayot provident funds management co ltd lessened holdings shares nvidia co nasdaq nvda free report rd quarter according recent filin chars,0.0,0.02857142857142857,0.2,https://www.etfdailynews.com/2025/01/08/yahav-achim-ve-achayot-provident-funds-management-co-ltd-cuts-stake-in-nvidia-co-nasdaqnvda/,2025-01-08T08:08:45Z,ETF Daily News
2025-01-08,NVDA,Nvidia,NVIDIA Co. (NASDAQ:NVDA) Shares Acquired by Eagle Asset Management Inc.,eagle asset management inc lifted stake shares nvidia co nasdaq nvda free report rd quarter holdingschannel reports institutional investor owned shares chars,0.0,0.030303030303030304,0.4,https://www.etfdailynews.com/2025/01/08/nvidia-co-nasdaqnvda-shares-acquired-by-eagle-asset-management-inc/,2025-01-08T08:08:46Z,ETF Daily News
2025-01-08,NVDA,Nvidia,NVIDIA Co. (NASDAQ:NVDA) Shares Sold by Brown Capital Management LLC,brown capital management llc decreased holdings nvidia co nasdaq nvda free report rd quarter holdingschannel reports institutional investor owned shares chars,0.0,0.03225806451612903,0.0,https://www.etfdailynews.com/2025/01/08/nvidia-co-nasdaqnvda-shares-sold-by-brown-capital-management-llc/,2025-01-08T08:08:44Z,ETF Daily News
2025-01-08,NVDA,Nvidia,"Thompson Siegel & Walmsley LLC Buys 45,569 Shares of NVIDIA Co. (NASDAQ:NVDA)",thompson siegel amp walmsley llc grew stake shares nvidia co nasdaq nvda free report third quarter according company recent f filing th chars,0.0,0.02702702702702703,0.13333333333333333,https://www.etfdailynews.com/2025/01/08/thompson-siegel-walmsley-llc-buys-45569-shares-of-nvidia-co-nasdaqnvda/,2025-01-08T08:08:44Z,ETF Daily News
2025-01-08,NVDA,Nvidia,NVIDIA Co. (NASDAQ:NVDA) Shares Bought by Banco Santander S.A.,banco santander lifted position shares nvidia co nasdaq nvda free report rd quarter holdingschannel com reports fund owned shares comput chars,0.0,0.030303030303030304,0.4,https://www.etfdailynews.com/2025/01/08/nvidia-co-nasdaqnvda-shares-bought-by-banco-santander-s-a/,2025-01-08T08:08:45Z,ETF Daily News
2025-01-08,NVDA,Nvidia,NVIDIA Co. (NASDAQ:NVDA) is First County Bank CT’s 6th Largest Position,first county bank ct raised position nvidia co nasdaq nvda free report third quarter according company recent f filing securities exc chars,0.0,0.02702702702702703,0.1625,https://www.etfdailynews.com/2025/01/08/nvidia-co-nasdaqnvda-is-first-county-bank-cts-6th-largest-position/,2025-01-08T08:08:44Z,ETF Daily News
2025-01-08,OXY,Occidental Petroleum,Occidental Petroleum Co. (NYSE:OXY) Shares Sold by CWA Asset Management Group LLC,cwa asset management group llc decreased stake occidental petroleum co nyse oxy free report th quarter according company recent filing securit chars,0.0,0.05555555555555555,0.0,https://www.etfdailynews.com/2025/01/08/occidental-petroleum-co-nyseoxy-shares-sold-by-cwa-asset-management-group-llc/,2025-01-08T09:06:51Z,ETF Daily News
2025-01-08,ODFL,Old Dominion,"Analysts Set Old Dominion Freight Line, Inc. (NASDAQ:ODFL) PT at $204.00",shares old dominion freight line inc nasdaq odfl get free report assigned average recommendation hold twenty analysts covering firm marketbeat report chars,0.0,0.06060606060606061,0.03749999999999999,https://www.etfdailynews.com/2025/01/08/analysts-set-old-dominion-freight-line-inc-nasdaqodfl-pt-at-204-00/,2025-01-08T08:18:54Z,ETF Daily News
2025-01-08,ORCL,Oracle Corporation,Range Financial Group LLC Makes New Investment in Oracle Co. (NYSE:ORCL),range financial group llc acquired new stake shares oracle co nyse orcl free report fourth quarter according company recent filing securities amp chars,0.0,0.027777777777777776,0.10727272727272727,https://www.etfdailynews.com/2025/01/08/range-financial-group-llc-makes-new-investment-in-oracle-co-nyseorcl/,2025-01-08T09:20:55Z,ETF Daily News
2025-01-08,PKG,Packaging Corporation of America,"Packaging Co. of America (NYSE:PKG) Stock Price Expected to Rise, Citigroup Analyst Says",packaging co america nyse pkg get free report price target upped analysts citigroup report released monday benzinga reports firm presently h chars,0.0,0.08571428571428572,0.06666666666666667,https://www.etfdailynews.com/2025/01/08/packaging-co-of-america-nysepkg-stock-price-expected-to-rise-citigroup-analyst-says/,2025-01-08T06:54:48Z,ETF Daily News
2025-01-08,PLTR,Palantir Technologies,Palantir Technologies Inc. (PLTR): Jim Cramer Bets on a Breakout 2024 for This “Cult Stock,recently published list jim cramer discussed nasdaq stocks recently article going take look palantir technologies inc nasdaq pltr stands chars,0.0,0.05714285714285714,0.0,https://finance.yahoo.com/news/palantir-technologies-inc-pltr-jim-215113118.html,2025-01-08T21:51:13Z,Yahoo Entertainment
2025-01-08,PANW,Palo Alto Networks,"Palo Alto (PANW) Gets Downgraded, Flutter (FLUT) Cuts Its Guidance",deutsche bank lowered rating today palo alto networks panw one investors favorite names security sector fanduel owner flutter flut cut guidance schwab tv reporte chars,0.0,0.08823529411764706,0.5,https://finance.yahoo.com/news/palo-alto-panw-gets-downgraded-194643897.html,2025-01-08T19:46:43Z,Yahoo Entertainment
2025-01-08,PANW,Palo Alto Networks,"Lee Klarich Sells 120,000 Shares of Palo Alto Networks, Inc. (NASDAQ:PANW) Stock",palo alto networks inc nasdaq panw get free report evp lee klarich sold shares palo alto networks stock transaction occurred monday january th shares sold chars,0.0,0.1388888888888889,0.4,https://www.etfdailynews.com/2025/01/08/lee-klarich-sells-120000-shares-of-palo-alto-networks-inc-nasdaqpanw-stock/,2025-01-08T10:40:43Z,ETF Daily News
2025-01-08,PANW,Palo Alto Networks,"This Stock-Split Stock Is Up by Nearly 360% Over the Past 5 Years, but Is It a Buy Now?",stocks good run palo alto networks nasdaq panw past five years cybersecurity company stock risen nearly prompted management condu chars,0.0,0.08108108108108109,0.18333333333333332,https://biztoc.com/x/9a04f417c8766146,2025-01-08T13:27:35Z,Biztoc.com
2025-01-08,PARA,Paramount Global,"Range Financial Group LLC Invests $165,000 in Paramount Global (NASDAQ:PARA)",range financial group llc purchased new stake shares paramount global nasdaq para free report th quarter according recent disclosure sec fund purcha chars,0.0,0.05714285714285714,0.07272727272727274,https://www.etfdailynews.com/2025/01/08/range-financial-group-llc-invests-165000-in-paramount-global-nasdaqpara/,2025-01-08T10:26:50Z,ETF Daily News
2025-01-08,PARA,Paramount Global,Everence Capital Management Inc. Buys New Holdings in Paramount Global (NASDAQ:PARA),everence capital management inc purchased new position shares paramount global nasdaq para free report th quarter according recent f filing securities chars,0.0,0.058823529411764705,0.1340909090909091,https://www.etfdailynews.com/2025/01/08/everence-capital-management-inc-buys-new-holdings-in-paramount-global-nasdaqpara/,2025-01-08T09:00:49Z,ETF Daily News
2025-01-08,PAYC,Paycom,"Nordea Investment Management AB Raises Stock Position in Paycom Software, Inc. (NYSE:PAYC)",nordea investment management ab grew holdings paycom software inc nyse payc free report th quarter holdings channel com reports fund owned shares chars,0.0,0.030303030303030304,0.4,https://www.etfdailynews.com/2025/01/08/nordea-investment-management-ab-raises-stock-position-in-paycom-software-inc-nysepayc/,2025-01-08T09:04:55Z,ETF Daily News
2025-01-08,PYPL,PayPal,"Nordea Investment Management AB Sells 1,547,972 Shares of PayPal Holdings, Inc. (NASDAQ:PYPL)",nordea investment management ab trimmed holdings shares paypal holdings inc nasdaq pypl free report fourth quarter according company recent chars,0.0,0.029411764705882353,0.13333333333333333,https://www.etfdailynews.com/2025/01/08/nordea-investment-management-ab-sells-1547972-shares-of-paypal-holdings-inc-nasdaqpypl/,2025-01-08T09:04:53Z,ETF Daily News
2025-01-08,PEP,PepsiCo,PepsiCo (NASDAQ:PEP) Now Covered by Analysts at Piper Sandler,piper sandler initiated coverage shares pepsico nasdaq pep free report research note released tuesday marketbeat ratings reports brokerage issued overweight rating chars,0.0,0.030303030303030304,0.4,https://www.etfdailynews.com/2025/01/08/pepsico-nasdaqpep-now-covered-by-analysts-at-piper-sandler/,2025-01-08T10:45:08Z,ETF Daily News
2025-01-08,PFE,Pfizer,"Range Financial Group LLC Acquires Shares of 13,317 Pfizer Inc. (NYSE:PFE)",range financial group llc purchased new stake pfizer inc nyse pfe free report fourth quarter according company recent form f filing securities chars,0.0,0.02702702702702703,0.10727272727272727,https://www.etfdailynews.com/2025/01/08/range-financial-group-llc-acquires-shares-of-13317-pfizer-inc-nysepfe/,2025-01-08T10:24:51Z,ETF Daily News
